United States v. Windsor, 570 U.S. 744 (2013), is a landmark United States Supreme Court civil rights case concerning same-sex marriage. The Court held that Section 3 of the Defense of Marriage Act (DOMA), which denied federal recognition of same-sex marriages, was a violation of the Due Process Clause of the Fifth Amendment.
Edith Windsor and Thea Spyer, a same-sex couple residing in New York, had their marriage recognized by the state of New York in 2008; Spyer died in 2009, leaving her entire estate to Windsor. Windsor sought to claim the federal estate tax exemption for surviving spouses, but was barred from doing so by Section 3 of DOMA. Seeking a refund, Windsor sued the federal government in the U.S. District Court for the Southern District of New York. As the Department of Justice declined to defend the constitutionality of Section 3 of DOMA, the Bipartisan Legal Advisory Group (BLAG) intervened to defend the law. District Judge Barbara S. Jones ruled that Section 3 of DOMA was unconstitutional, and her ruling was affirmed by the U.S. Court of Appeals for the Second Circuit.
The Supreme Court granted certiorari in December 2012 and handed down its judgment on June 26, 2013. In the majority opinion, which was joined by four other justices, Justice Anthony Kennedy declared Section 3 of DOMA to be unconstitutional "as a deprivation of the liberty of the person protected by the Fifth Amendment". He further wrote: "The federal statute is invalid, for no legitimate purpose overcomes the purpose and effect to disparage and to injure those whom the State, by its marriage laws, sought to protect in personhood and dignity." Four justices filed dissenting opinions, including Justice Antonin Scalia, who argued that the Court had "no power under the Constitution to invalidate this democratically adopted legislation."
On the same day, the Court also issued a separate 5–4 decision in Hollingsworth v. Perry that effectively allowed same-sex marriage in California to resume. Following the decision, the Obama administration began to extend other federal rights, privileges, and benefits to married same-sex couples. Two years later, in the case of Obergefell v. Hodges, the Court struck down all state bans on same-sex marriage, ruling that marriage is guaranteed to same-sex couples by both the Due Process Clause and the Equal Protection Clause.


== Background ==
Edith "Edie" Windsor (née Schlain) was born in Philadelphia on June 20, 1929, to a Russian Jewish immigrant family of modest means. During her childhood, her father lost both his candy-and-ice-cream store and his house during the Great Depression, and she at times experienced anti-Semitism. After graduating from Temple University, she married Saul Windsor. They divorced less than one year afterward, and she confided in him that she longed to be with women. Edie Windsor soon moved to New York City to pursue a master's degree in mathematics at New York University. She would eventually become one of the first female senior systems programmers at IBM.Thea Clara Spyer was born in Amsterdam on October 8, 1931, to a wealthy Jewish family that escaped the Holocaust by fleeing to the United States before the Nazi invasion of the Netherlands. Spyer enrolled at Sarah Lawrence College, but was expelled after a campus guard saw her and another woman kissing. She received a bachelor's degree from the New School for Social Research, and a master's degree and PhD in clinical psychology from City University of New York and Adelphi University, respectively. In addition to her private psychology practice in Manhattan, Spyer was an accomplished violinist. She met Windsor in 1963 at a West Village restaurant, and the two began dating after they reconnected in the Hamptons during Memorial Day weekend of 1965. Windsor had first suggested engagement in 1965. Spyer proposed to her in 1967 but presented her with a diamond brooch instead of an engagement ring, fearing that Windsor would be stigmatized at work if her colleagues knew about her relationship.In 2007, the pair, both residents of New York, married in Toronto, Ontario, under the provisions set forth in the Canadian Civil Marriage Act, after 40 years of romantic partnership. Canada's first openly gay judge, Justice Harvey Brownstone, officiated. After Spyer's death in 2009, Windsor was required to pay $363,053 in federal estate taxes on her inheritance of her wife's estate. Had federal law recognized the validity of their marriage, Windsor would have qualified for an unlimited spousal deduction and paid no federal estate taxes.In May 2008, New York Governor David Paterson had ordered state agencies to recognize same-sex marriages performed in other jurisdictions. Some lower-level state courts had made similar rulings, but whether the state's highest court would give such a ruling the force of law, as Windsor's claim for a refund required, remained uncertain and was disputed throughout her lawsuit.

Windsor at first asked several gay rights advocacy groups to represent her, but none would take the case. Finally, she was referred to Roberta Kaplan, a partner at the law firm of Paul, Weiss, Rifkind, Wharton & Garrison LLP, who later recalled: "When I heard her story, it took me about five seconds, maybe less, to agree to represent her". Kaplan had unsuccessfully represented the plaintiffs in a 2006 case that challenged the inability of same-sex couples to marry under New York law, Hernández v. Robles. Both Kaplan and Windsor were members of Congregation Beit Simchat Torah.


=== District Court ===
Paul, Weiss, Rifkind, Wharton & Garrison, in conjunction with the American Civil Liberties Union (ACLU), filed the case in the U.S. District Court for the Southern District of New York on behalf of Windsor as executor of Spyer's estate on November 9, 2010.On February 23, 2011, Attorney General Eric Holder released a statement regarding two lawsuits challenging DOMA Section 3, Windsor and Pedersen v. Office of Personnel Management. He explained that the Department of Justice (DOJ) had previously defended Section 3 of DOMA in several other lawsuits in jurisdictions where precedents required the court to use the rational basis standard for reviewing laws concerning sexual orientation. Since Windsor was filed in the jurisdiction of the Second Circuit Court of Appeals, which had no such precedent, the DOJ had identified the proper standard of review in such cases as the more demanding "heightened scrutiny". Under that standard, it could no longer defend the constitutionality of DOMA Section 3.On April 18, 2011, Paul Clement, representing the Bipartisan Legal Advisory Group of the House of Representatives (BLAG), filed a motion asking to be allowed to intervene in the suit "for the limited purpose of defending the constitutionality of Section III" of DOMA. The Department of Justice did not oppose the motion.Windsor filed a motion for summary judgment on June 24. New York Attorney General Eric Schneiderman filed a brief supporting Windsor's claim on July 26, 2011, arguing that DOMA Section 3 could not survive the scrutiny used for classifications based on sex and constitutes "an intrusion on the power of the state to define marriage". On August 1, 2011, BLAG filed a brief opposing Windsor's motion for summary judgment on the grounds that sexual orientation is not subject to heightened scrutiny.On June 6, 2012, Judge Barbara S. Jones ruled that a rational basis review of Section 3 of DOMA showed it to be unconstitutional, as it violated plaintiff's rights under the equal protection guarantees of the Fifth Amendment, and ordered that Windsor receive the tax refund due to her. Where BLAG had argued that the Spyer-Windsor marriage was not recognized by New York law at the time of Spyer's death – a prerequisite for Windsor's claim against the IRS – Jones cited the "informal opinion letters" of the state's governor, attorney general, and comptroller to the contrary along with several opinions in New York appellate courts. The plaintiff said afterward: "It's thrilling to have a court finally recognize how unfair it is for the government to have treated us as though we were strangers."


=== Court of Appeals ===
Despite its approval of the ruling, the Justice Department filed a notice of appeal on June 14, 2012, to facilitate BLAG's defense of the statute. BLAG filed a motion to dismiss the DOJ's Second Circuit appeal on July 19, claiming the DOJ lacks standing because it prevailed in the District Court. Meanwhile, Windsor's legal counsel filed a petition of certiorari before judgment with the Supreme Court on July 16, 2012, asking for the case to be considered without waiting for the Second Circuit's review, citing the plaintiff's age and health.The DOJ replied to BLAG's motion to dismiss, asserting: (1) its standing as an "aggrieved party", because the District Court's stay prevents the DOJ from taking steps to cease enforcement of Section 3 of DOMA; and (2) that its participation ensures consideration of the constitutional issue if the Second Circuit or the Supreme Court determines that BLAG lacks standing.On September 27, Chief Judge Dennis Jacobs and Judges Chester J. Straub and Christopher F. Droney heard arguments in the case. On October 18, the Second Circuit Court of Appeals upheld the lower court's ruling that Section 3 of DOMA is unconstitutional. The majority opinion stated, "It is easy to conclude that homosexuals have suffered a history of discrimination." Thus they were part of a quasi-suspect class that deserves any law restricting its rights to be subjected to intermediate scrutiny. Because DOMA could not pass that test, Judge Jacobs wrote, it is unconstitutional under the equal protection guarantees of the Fifth Amendment.
Our straightforward legal analysis sidesteps the fair point that same-sex marriage is unknown to history and tradition, but law (federal or state) is not concerned with holy matrimony. Government deals with marriage as a civil status—however fundamental—and New York has elected to extend that status to same-sex couples. 
It was the first federal court of appeals decision to hold that laws that classify people based on sexual orientation should be subject to heightened scrutiny. Like the lower court, the Second Circuit held that the Spyer-Windsor marriage was valid under New York law, citing precedents on that question from several state appellate court decisions, two of which preceded Spyer's death. Where New York law is unclear, the Second Circuit must adopt a predictive approach, as it did in this case.


=== United States Supreme Court ===

On September 11, 2012, following Windsor's petition for certiorari before judgment and before the Second Circuit's ruling, the Department of Justice filed its own petition for certiorari before judgment with the Supreme Court. After the appellate ruling on October 18, the parties filed supplemental briefs. On December 7, the Supreme Court granted certiorari in the case, now United States v. Windsor, accepting the DOJ's petition.
In addition to the question presented by the DOJ – "Whether Section 3 of DOMA violates the Fifth Amendment's guarantee of equal protection" for same sex partners – the court also asked the parties to brief and argue two other questions: whether the government's agreement with the Second Circuit's decision deprived the court of a "real dispute" and therefore of jurisdiction to hear the case, and whether BLAG had standing in its own right, i.e., the legal right to independently ask for the appeal to be heard in the event that the government was not a valid petitioner. Article III of the Constitution (the "Case or Controversy clause") forbids parties that do not themselves have a real and personal ("particularized") complaint from filing a case or appeal in a federal court.Windsor noted in a statement that when she and her partner met nearly 50 years earlier that they never dreamed their marriage would land before the Supreme Court "as an example of why gay married couples should be treated equally, and not like second-class citizens". Noting that her deceased wife would be proud, Windsor added, "The truth is, I never expected any less from my country."On December 11, the Supreme Court appointed Vicki C. Jackson, a professor of constitutional law at Harvard Law School, as an amicus curiae to argue the two additional questions it posed. BLAG filed its own petition for certiorari, in order to enable the court to rule on the constitutionality of DOMA, even if it were to decide that it lacked jurisdiction to hear the DOJ's petition. The Supreme Court heard oral arguments on March 27, 2013.


== Opinion of the Court ==


=== Majority opinion ===
In a 5–4 decision issued on June 26, 2013, the Supreme Court found Section 3 of DOMA (codified at 1 U.S.C. § 7) to be unconstitutional, "as a deprivation of the liberty of the person protected by the Fifth Amendment". The Court held that the Constitution prevented the federal government from treating state-sanctioned heterosexual marriages differently from state-sanctioned same-sex marriages, and that such differentiation "demean[ed] the couple, whose moral and sexual choices the Constitution protects". Justice Anthony Kennedy authored the majority opinion, joined by Justices Ginsburg, Breyer, Sotomayor, and Kagan. Kennedy's decision to strike down a central part of DOMA cited the principles of state autonomy, equal protection and liberty, but the constitutional basis for striking down the law was not entirely clear, as it had elements of federalism, equal protection and due process. The answer may be found in Windsor's brief, in which she argues that DOMA operates to say "that married gay couples aren't genuinely married at all but are instead 'similarly situated' to unmarried people".The Court wrote:

DOMA seeks to injure the very class New York seeks to protect. By doing so it violates basic due process and equal protection principles applicable to the Federal Government. See U.S. Const., Amdt. 5; Bolling v. Sharpe, 347 U.S. 497 (1954).When New York adopted a law to permit same-sex marriage, it sought to eliminate inequality; but DOMA frustrates that objective through a system-wide enactment with no identified connection to any particular area of federal law. DOMA writes inequality into the entire United States Code. The particular case at hand concerns the estate tax, but DOMA is more than a simple determination of what should or should not be allowed as an estate tax refund. Among the over 1,000 statutes and numerous federal regulations that DOMA controls are laws pertaining to Social Security, housing, taxes, criminal sanctions, copyright, and veterans' benefits.DOMA's principal effect is to identify a subset of state-sanctioned marriages and make them unequal. The principal purpose is to impose inequality, not for other reasons like governmental efficiency. Responsibilities, as well as rights, enhance the dignity and integrity of the person. And DOMA contrives to deprive some couples married under the laws of their State, but not other couples, of both rights and responsibilities. By creating two contradictory marriage regimes within the same State, DOMA forces same-sex couples to live as married for the purpose of state law but unmarried for the purpose of federal law, thus diminishing the stability and predictability of basic personal relations the State has found it proper to acknowledge and protect. By this dynamic DOMA undermines both the public and private significance of state-sanctioned same-sex marriages; for it tells those couples, and all the world, that their otherwise valid marriages are unworthy of federal recognition. This places same-sex couples in an unstable position of being in a second-tier marriage. The differentiation demeans the couple, whose moral and sexual choices the Constitution protects, ... and whose relationship the State has sought to dignify. And it humiliates tens of thousands of children now being raised by same-sex couples. The law in question makes it even more difficult for the children to understand the integrity and closeness of their own family and its concord with other families in their community and in their daily lives.Under DOMA, same-sex married couples have their lives burdened, by reason of government decree, in visible and public ways. By its great reach, DOMA touches many aspects of married and family life, from the mundane to the profound. It prevents same-sex married couples from obtaining government healthcare benefits they would otherwise receive. ... It deprives them of the Bankruptcy Code's special protections for domestic-support obligations. ... It forces them to follow a complicated procedure to file their state and federal taxes jointly. ... It prohibits them from being buried together in veterans' cemeteries.For certain married couples, DOMA's unequal effects are even more serious. The federal penal code makes it a crime to "assaul[t], kidna[p], or murde[r] ... a member of the immediate family" of "a United States official, a United States judge, [or] a Federal law enforcement officer", ... with the intent to influence or retaliate against that official. ... Although a "spouse" qualifies as a member of the officer's "immediate family", ... DOMA makes this protection inapplicable to same-sex spouses.The liberty protected by the Fifth Amendment's Due Process Clause contains within it the prohibition against denying to any person the equal protection of the laws. While the Fifth Amendment itself withdraws from Government the power to degrade or demean in the way this law does, the equal protection guarantee of the Fourteenth Amendment makes that Fifth Amendment right all the more specific and all the better understood and preserved.

The class to which DOMA directs its restrictions and restraints are those persons who are joined in same-sex marriages made lawful by the State. DOMA singles out a class of persons deemed by a State entitled to recognition and protection to enhance their own liberty. It imposes a disability on the class by refusing to acknowledge a status the State finds to be dignified and proper. DOMA instructs all federal officials, and indeed all persons with whom same-sex couples interact, including their own children, that their marriage is less worthy than the marriages of others. The federal statute is invalid, for no legitimate purpose overcomes the purpose and effect to disparage and to injure those whom the State, by its marriage laws, sought to protect in personhood and dignity. By seeking to displace this protection and treating those persons as living in marriages less respected than others, the federal statute is in violation of the Fifth Amendment.


=== Dissents ===
Chief Justice John Roberts and Justices Antonin Scalia and Samuel Alito authored dissenting opinions, which Justice Clarence Thomas joined.Justice Scalia's dissent, which was joined in full by Justice Thomas and in part by Chief Justice Roberts, opened:

This case is about power in several respects. It is about the power of our people to govern themselves, and the power of this Court to pronounce the law. Today's opinion aggrandizes the latter, with the predictable consequence of diminishing the former. We have no power to decide this case. And even if we did, we have no power under the Constitution to invalidate this democratically adopted legislation.

He continued: 

Windsor's injury was cured by the judgment in her favor. ... What the petitioner United States asks us to do in the case before us is exactly what the respondent Windsor asks us to do: not to provide relief from the judgment below but to say that that judgment was correct. And the same was true in the Court of Appeals: Neither party sought to undo the judgment for Windsor, and so that court should have dismissed the appeal (just as we should dismiss) for lack of jurisdiction.
Scalia argued that the judgment effectively characterized opponents of same-sex marriage as "enemies of the human race":
It is one thing for a society to elect change; it is another for a court of law to impose change by adjudging those who oppose it hostes humani generis, enemies of the human race.
He argued that the Court's ruling would affect state bans on same-sex marriage as well:

As far as this Court is concerned, no one should be fooled; it is just a matter of listening and waiting for the other shoe.
By formally declaring anyone opposed to same-sex marriage an enemy of human decency, the majority arms well every challenger to a state law restricting marriage to its traditional definition.
Scalia concluded by saying that the Supreme Court "has cheated both sides, robbing the winners of an honest victory, and the losers of the peace that comes from a fair defeat".The opinions of Roberts and Scalia offered different interpretations of the majority ruling. Roberts said the majority opinion was based on federalism, finding DOMA unconstitutional because the federal government was interfering with state control of marriage. He wrote: "The dominant theme of the majority opinion is that the Federal Government's intrusion into an area 'central to state domestic relations law applicable to its residents and citizens' is sufficiently 'unusual' to set off alarm bells. ... [I]ts judgment is based on federalism." Scalia was uncertain whether the majority relied upon that federalism argument or based its decision on Equal Protection grounds, writing, "if this is meant to be an equal-protection opinion, it is a confusing one".


== Responses and analysis ==

President Obama hailed the ruling as a "victory for American democracy". On the question of how the ruling would affect bans on same-sex marriage in those states that prohibit it, Obama said: "My personal belief, but I'm speaking now as a president as opposed to as a lawyer, is that if you've been married in Massachusetts and you move someplace else, you're still married, and that under federal law you should be able to obtain the benefits of any lawfully married couple."Laurence Tribe, a professor of constitutional law at Harvard Law School, described Scalia's response and dissent as "intemperate", "extraordinary", and "at the very least, an exercise in jurisprudential cynicism". He considered that Scalia appeared to have been unable to resist "the temptation to use the occasion to insult the Court's majority, and Justice Kennedy in particular, in essentially ad hominem ... terms".Neil Siegel, a professor of constitutional law at Duke Law School, wrote that Justice Roberts' view that the majority relied on federalism was a fallacy in that the majority did not place any weight on the federalism argument, but rather used "federalism as a waystation" to put off making a decision on the constitutionality of state laws concerning same-sex marriage.


== Impact and implementation ==
A day after the decision in Windsor, the federal judge hearing McLaughlin v. Panetta asked the parties to explain by July 18 why the logic that found DOMA's section 3 unconstitutional did not apply equally to federal regulations that control eligibility for veterans' spousal benefits, which define "spouse" as "a person of the opposite sex". On July 18, 2013, BLAG stated in a court filing that in light of Windsor, they would no longer seek to defend this case or similar statutes in court, and sought leave to withdraw from defending the case.In the wake of the U.S. Supreme Court ruling the Obama Administration and several federal executive departments and agencies such as the Office of Personnel Management began to extend federal rights, privileges and benefits to married same-sex couples by changing regulations in order to conform with the Supreme Court decision in Windsor:

Medicaid announced in August 2013 that "all beneficiaries in private Medicare plans have access to equal coverage when it comes to care in a nursing home where their spouse lives".
All same-sex couples who are legally married are recognized as such for federal tax purposes, even if the state where they live does not recognize their union.
Federal employees in same-sex marriages can apply for health, dental, life, long-term care and retirement benefits.
Legally married same-sex seniors on Medicare are eligible for equal benefits and joint placement in nursing homes.
Death benefits are paid to survivors of a same-sex marriage by the Social Security Administration.
The Department of Homeland Security treats same-sex spouses equally for the purposes of obtaining a green card if the spouse is a foreign national.
On February 10, 2014, the Justice Department instructed all of its employees to give lawful same-sex marriages the same rights as heterosexual married couples in all programs it administers, whether or not the activity occurs in a jurisdiction that recognizes same-sex marriage. Included are the right to decline to testify against a spouse, spousal privileges for prison inmates, eligibility for joint bankruptcy filing, and access to such federal programs as the Sep 11 fund to compensate victims of the terrorist attacks and the compensation program for the surviving spouse of a public safety officer killed in the line of duty. The policy also affects domestic support obligations, such as alimony owed to a former same-sex spouse, as well as the exclusion of certain debts to a current or former same-sex spouse.
