The marriage can take place in a State or other Country where that ceremony was legal, and will confer eligibility to apply for lawful permanent residence.As a result of the Windsor decision, married same-sex couples—regardless of domicile—have tax benefits (which include the previously unavailable ability to file joint tax returns with the IRS), military benefits, federal employment benefits for employees of the U.S Government and immigration benefits.In February 2014, the Justice Department expanded recognition of same-sex marriages in federal legal matters, including bankruptcies, prison visits, survivor benefits and the legal right to refuse to testify to incriminate a spouse. Likewise in June 2014, family medical leave benefits under the Family and Medical Leave Act of 1993 were extended to married same-sex couples in all of the U.S. With respect to social security and veterans benefits, same-sex married couples who live in states where same-sex marriage is recognised are eligible for full benefits from the Veterans Affairs (VA) and the Social Security Administration (SSA). The VA and SSA can provide only limited benefits to married same-sex couples living in states where same-sex marriage isn't legal, with Congress required to amend federal law to rectify that inequity.According to one reporter's assessment in August 2013, despite the foregoing efforts the U.S. federal agencies are not working in concert with respect to the implementation of the Windsor ruling. Instead "they are creating a patchwork of regulations affecting gay and lesbian couples – and may be raising questions about discrimination and fairness in the way that federal benefits are distributed."In February 2015, the United States Department of Labor issued its final rule amending the definition of spouse under the FMLA in response to Windsor. The new rule is effective March 27, 2015. The revised definition of "spouse" extends FMLA leave rights and job protections to employees in a same-sex marriage or a common-law marriage entered into in a state where those statuses are legally recognized, regardless of the state in which the employee works or resides.


== Judicial interpretation ==
The ruling in Windsor led to a series of state and federal lawsuits being filed against same-sex marriage bans and affected other discrimination rulings.  A year after the Windsor ruling was announced, there was at least one state or federal lawsuit against every state same-sex marriage ban.


=== State courts ===
New Jersey Supreme Court previously ruled in Lewis v. Harris that the denial of marriage benefits violate same-sex couples equal protection under the New Jersey state constitution.  But following Windsor a New Jersey state judge ruled that the extension of federal benefits to married same-sex couples made New Jersey's civil unions to be lacking the equal protection.


=== Federal courts ===
In several other cases, the ambiguity in the majority decision in Windsor has produced varying interpretations in later legal decisions that address state regulation of marriage and the denial of marriage rights to same-sex couples. Courts have disputed whether Windsor relied upon federalism or equal protection and what standard of review the Supreme Court applied. Others have used it to dismiss the precedential importance of Baker v. Nelson.  Within 2 years of the Windsor decision 28 district courts and 4 appeals court ruled that state level same-sex marriage bans are unconstitutional, while only two district courts and one appeals court ruled they did not violate the constitution.
In December 2013, a U.S. District Court judge ruling in Kitchen v. Herbert found that Baker no longer controlled his decision, because the rule is that "doctrinal developments" can obviate the importance of a dismissal like Baker and given the issues before the court Windsor was "highly relevant and is therefore a significant doctrinal development". It also read Windsor as an equal protection case, writing: "The court agrees with Justice Scalia's interpretation of
Windsor and finds that the important federalism concerns at issue here are nevertheless insufficient to save a state-law prohibition that denies the Plaintiffs their rights to due process and equal protection under the law."District Court Judge Arenda L. Wright Allen ruling in Bostic v. Rainey on February 13, 2014, noted that Windsor discussed the deference due state laws defining marriage only to assert that "due process and equal protection
guarantees must trump objections to federal intervention". She cited Justice Scalia's prediction that the reasoning of the majority in Windsor with respect to federal law motivated by a "bare ... desire to harm" would produce the same conclusion with respect to state laws.In De Leon v. Perry, Orlando Garcia on February 26, 2014, framed the lawsuit in terms of Windsor: "Now, the lower courts must apply the Supreme Court's decision in Windsor and decide whether a state can do what the federal government cannot -– discriminate against same-sex couples." He then made the same point Judge Wright Allen had made, citing Windsor: "While Texas has the 'unquestioned authority' to regulate and define marriage, the State must nevertheless do so in a way that does not infringe on an individual's constitutional rights." (references omitted)Some courts have agreed with Scalia that the Windsor decision lacked clarity and proceeded to interpret it with little reference to federalism, just as Scalia had predicted. When ruling Oklahoma's ban on same-sex marriage unconstitutional on January 14, 2014, in Bishop v. Oklahoma, U.S. District Judge Terence C. Kern described the decision as the culmination of a process: "There is no precise legal label for what has occurred in Supreme Court jurisprudence beginning with Romer in 1996 and culminating in Windsor in 2013, but this Court knows a rhetorical shift when it sees one". When U.S. District Judge Jone E. Jones ruled on May 20, 2014, that Pennsylvania's same-sex marriage ban was unconstitutional, he read Windsor as an equal protection decision. He cited Justice Scalia's critique of the lack of clarity in the Windsor decision, writing: "As Justice Scalia cogently remarked in his dissent, 'if [Windsor] is meant to be an equal-protection opinion, it is a confusing one. ... Windsor found DOMA unconstitutional because 'no legitimate purpose overcomes the purpose and effect to disparage and to injure.'"Conversely, U.S. District Judge Martin Feldman, upholding Louisiana's ban on same-sex marriage on September 3, 2014, reviewed the arguments before him and wrote: "Both sides invoke the Supreme Court's decision in United States v. Windsor. ... But Windsor does little more than give both sides in this case something to hope for." In a footnote, he explained his reading of the case:
Windsor, in the context of the issues presented to this Court, is unclear (contrary to the conclusions in many recent federal court decisions). It is by its own terms, limited. Its "opinion and its holding are confined to those lawful marriages". However, Windsor also references an amorphous but alluring "evolving understanding of the meaning of equality". Hence this Court's unease that Windsor merely offer bits and pieces of hope to both sides. (citations omitted)
He quoted Chief Justice Roberts' dissent as a reason not to read Windsor as a guide for deciding the constitutionality of restrictions on same-sex marriage: "The Court does not have before it", wrote Roberts, "and the logic of its opinion does not decide the distinct question whether the States, in the exercise of their 'historic and essential authority to define the marital relation', ... may continue to utilize the traditional definition of marriage". Feldman found nothing in Windsor to require him to use heightened scrutiny, saying that "Windsor starkly avoids mention of heightened scrutiny". He called the argument that Windsor's use of the phrase "careful consideration" meant intermediate or heightened scrutiny amounted to "intellectual anarchy". He criticized several recent federal court decisions for failing to specify the appropriate standard of review they used to evaluate the constitutionality of bans on same-sex marriage. Instead he cited Windsor for its "powerful reminder" that "'The definition of marriage is the foundation of the State's broader authority to regulate the subject of domestic relations'".


=== Sexual orientation as a suspect class ===
A 3-judge panel of the Ninth Circuit Court of Appeals in SmithKline v. Abbott considered what standard of review to apply when determining whether sexual orientation can be used in selecting the members of a jury. It ruled unanimously on January 21, 2014, based on its reading of Windsor, that distinctions based on sexual orientation are subject to a standard of review higher then rational basis review and that "equal protection prohibits peremptory strikes based on sexual orientation". The Ninth Circuit wrote:
Windsor review is not rational basis review. In its words and its deed, Windsor established a level of scrutiny for classifications based on sexual orientation that is unquestionably higher than rational basis review. In other words, Windsor requires that heightened scrutiny be applied to equal protection claims involving sexual orientation. 
The Supreme court did not explicitly determine what level of review that classification on the basis of sexual orientation requires, and was overruled in Obergefell v. Hodges in 2015. Currently, there is circuit split between the second, sixth and ninth circuits regarding the correct level of scrutiny that should be applied to classifications based on sexual orientation. Although the Supreme Court had the opportunity to rule on the level of scrutiny in Obergefell v. Hodges, they decided not to and based their analysis on the fundamental right to marry.Many scholars have theorized that the ruling in Windsor have elevated classifications on the basis of sexual orientation to be considered under a 'rational basis with bite' evaluation; and have found the analysis to be closely synonymous with how classification of religion are reviewed. The Ninth Circuit court also observed that the majority in Windsor shifted the burden from the same-sex couple to the government when it wrote that the government has to "justify disparate treatment of the group".


== See also ==
Meyer v. Nebraska — 1923 case defining the "liberty" protected by the Due Process clause
Romer v. Evans — 1996 case holding that an amendment to the Colorado Constitution that prevented protected status for homosexuals or bisexuals was unconstitutional because it was not rationally related to a legitimate state interest.
Lawrence v. Texas — 2003 case holding same-sex intimate conduct cannot be criminalized
Hollingsworth v. Perry — 2013 case on constitutionality of California Proposition 8's constitutional ban on same-sex marriage
Obergefell v. Hodges — 2015 case holding state same-sex marriage bans unconstitutional.
List of United States Supreme Court cases, volume 570
List of United States Supreme Court cases by the Roberts Court
LGBT rights in the United States
Same-sex marriage in the United States
State Marriage Defense Act


== Notes ==


== References ==


== Further reading ==
Archibald, Catherine Jean (2013). "Two Wrongs Don't Make a Right: Implications of the Sex Discrimination Present in Same-Sex Marriage Exclusions for Supreme Court Cases Hollingsworth v. Perry and United States v. Windsor". Northern Illinois University Law Review. 34 (Forthcoming). SSRN 2255240.
Carter, W. Burlette (2013). "The Federal Law of Marriage: Deference, Deviation and DOMA" (PDF). Journal of Gender, Social Policy & the Law. 21 (4): 705–95.
Kaplan, Roberta (2015). Then Comes Marriage: United States v. Windsor and the Defeat of DOMA. W. W. Norton & Company. ISBN 978-0-393-24867-8.
Laycock, Douglas; Berg, Thomas C. (2013). "Protecting Same-Sex Marriage and Religious Liberty" (PDF). Virginia Law Review Online. 99 (1): 1–9.
Levy, Ariel (September 30, 2013). "The perfect wife : how Edith Windsor fell in love, got married, and won a landmark case for gay marriage". Profiles. The New Yorker. 89 (30): 54–63. Retrieved March 2, 2015. 


== External links ==
Text of United States v. Windsor, 570 U.S. 744 (2013) is available from:  CourtListener  Google Scholar  Justia  Oyez (oral argument audio)  Supreme Court (slip opinion) 
Windsor v. United States – Complaint in District Court
Windsor v. United States – District Court Decision
Windsor v. United States – United States Court of Appeals for the 2nd Circuit Decision
DOJ's Petition for Certiorari in the U.S. Supreme Court
Windsor's Petition for Certiorari in the U.S. Supreme Court
Merit and amicus briefs in the case
Edie & Thea: A Very Long Engagement (2009 documentary film)
NYU Alumni Magazine, Fall 2011
To A More Perfect Union: United States v. Windsor (2017 documentary film)