The long-term effects of the arrival of the Spanish on the population of South America were simply catastrophic. While this is the case for every group of Native-Americans that were invaded by Europeans from the fifteenth century onwards, the Incan population suffered a dramatic and quick decline following contact. It is estimated that parts of the empire, notably the Central Andes, suffered a population decline ratio of 58:1 during the years of 1520–1571.The single greatest cause of the decimation of native populations was infectious disease. Old World Eurasian diseases, which had long been endemic on the Continent, were carried by colonists and conquistadors. As these were new to the natives, they had no acquired immunity and suffered very high rates of death. More died of disease than any army or armed conflict. As the Inca did not have as strong a writing tradition as the Aztec or Maya, it is difficult for historians to estimate population decline or any events after conquest. But, it is sometimes argued, and equally disputed among scholars. that the Inca began to contract these diseases several years before the Spanish appeared in the region, as it was possibly carried to their empire by traders and travelers. The outbreak, argued to be hemorrhagic smallpox, reached the Andes in 1524. While numbers are unavailable, Spanish records indicate that the population was so devastated by disease that they could hardly resist the foreign forces.
Historians differ as to whether the illness of the 1520s was smallpox; a minority of scholars claim that the epidemic was due to an indigenous illness called Carrion's disease. In any case, a 1981 study by N. D. Cook the shows that the Andes suffered from three separate population declines during colonization. The first was of 30–50 percent during the first outbreak of smallpox. When a measles outbreak occurred, there was another decline of 25–30 percent. Finally, when smallpox and measles epidemics occurred together, which occurred from 1585 to 1591, a decline of 30–60 percent occurred. Collectively these declines amounted to a decline of 93 percent from the pre-contact population in the Andes region. Mortality was particularly high among children, ensuring that the impact of the epidemics would extend to the next generation.Beyond the devastation of the local populations by disease, they suffered considerable enslavement, pillaging and destruction from warfare. The Spanish took thousands of women from the local natives to use as servants and concubines. As Pizarro and his men took over portions of South America, they plundered and enslaved countless people. Some local populations entered into vassalage willingly, to defeat the Inca. Native groups such as the Huanca, Cañari, Chanka and Chachapoya fought alongside the Spanish as they opposed Inca rule. The basic policy of the Spanish towards local populations was that voluntary vassalage would yield safety and coexistence, while continued resistance would result in more deaths and destruction.Another significant effect on the people in South America was the spread of Christianity. As Pizarro and the Spanish subdued the continent and brought it under their control, they forcefully converted many to Christianity, claiming to have educated them in the ways of the "one true religion." With the depopulation of the local populations along with the capitulation of the Inca Empire, the Spanish missionary work after colonization began was able to continue unimpeded. It took just a generation for the entire continent to be under Christian influence.


== In fiction ==
Peter Shaffer's play The Royal Hunt of the Sun (1964) dramatizes the conquest of the Incas. In the play, Pizarro, Atahualpa, Valverde and other historical figures appear as characters.
The conquest is also used as a starting point for the Matthew Reilly novel Temple, where the siege of Cusco is used. Many historical figures are mentioned, especially Pizarro who is mentioned as the pursuer of the protagonist.
The Inca are featured in the third Campaign in Age of Empires 3, having a Lost City hidden in the Andes. They are also in the Multiplayer, found primarily in the areas making up Chile and Argentina.
The conquest is parodied in The Simpsons TV series, in the episode "Lost Verizon", written by John Frink.Pizarro and his fellow conquistadors feature as antagonists in the 1982 animated serial The Mysterious Cities of Gold.


== Quotes ==
I wish Your Majesty to understand the motive that moves me to make this statement is the peace of my conscience and because of the guilt I share. For we have destroyed by our evil behaviour such a government as was enjoyed by these natives. They were so free of crime and greed, both men and women, that they could leave gold or silver worth a hundred thousand pesos in their open house. So that when they discovered that we were thieves and men who sought to force their wives and daughters to commit sin with them, they despised us. But now things have come to such a pass in offence of God, owing to the bad example we have set them in all things, that these natives from doing no evil have turned into people who can do no good.. I beg God to pardon me, for I am moved to say this, seeing that I am the last to die of the Conquistadors."

When has it ever happened, either in ancient or modern times, that such amazing exploits have been achieved? Over so many climes, across so many seas, over such distances by land, to subdue the unseen and unknown? Whose deeds can be compared with those of Spain? Not even the ancient Greeks and Romans.
When I set out to write for the people of today and of the future, about the conquest and discovery that our Spaniards made here in Peru, I could not but reflect that I was dealing with the greatest matters one could possibly write about in all of creation as far as secular history goes. Where have men ever seen the things they have seen here? And to think that God should have permitted something so great to remain hidden from the world for so long in history, unknown to men, and then let it be found, discovered and won all in our own time!
The houses are more than two hundred paces in length, and very well built, being surrounded by strong walls, three times the height of a man. The roofs are covered with straw and wood, resting on the walls. The interiors are divided into eight rooms, much better built than any we had seen before. Their walls are of very well cut stones and each lodging is surrounded by its masonry wall with doorways, and has its fountain of water in an open court, conveyed from a distance by pipes, for the supply of the house. In front of the plaza, towards the open country, a stone fortress is connected with it by a staircase leading from the square to the fort. Towards the open country there is another small door, with a narrow staircase, all within the outer wall of the plaza. Above the town, on the mountain side, where the houses commence, there is another fort on a hill, the greater part of which is hewn out of the rock. This is larger than the other, and surrounded by three walls, rising spirally.


== See also ==


== Footnotes ==


== Bibliography ==


== External links ==
All Empires Online History Community