A trolley-replica bus operates in the downtown area, providing transportation between the Belle Grove Historic District and the Fort Smith National Historic Site. The Fort Smith Trolley Museum operates genuine trolleys, but as a historic attraction, rather than as transportation.


=== Utilities ===

Fort Smith uses two water treatment plants (WTPs) for its drinking water; one near Lake Fort Smith in Mountainburg and one on Lee Creek.


=== Health care ===

Hospitals in Fort Smith include:

Mercy Hospital Fort Smith
Baptist Health-Fort Smith (Formerly Sparks Regional Medical Center)
HealthSouth Rehabilitation Hospital
Valley Behavioral Health System
Mercy Orthopedic Hospital


== Accolades ==
Fort Smith is named by Forbes as having the lowest cost of living in the United States.
Fort Smith is also ranked sixth on its list of "Cities in America for Cost of Doing Business".
The bathrooms at Fort Smith Regional Airport were voted as the best public restrooms in the United States in 2005.


== Notable people ==
Notable figures who were born in, lived in, or are otherwise associated with Fort Smith.


=== Athletes ===
Martine Bercher, former University of Arkansas All-American defensive back.
Ron Brewer, former National Basketball Association player.
Kodi Burns, former Auburn University quarterback, now coaching at Auburn.
Ravin Caldwell, former National Football League player.
Glen Condren, former National Football League player, New York Giants and Atlanta Falcons; born in Fort Smith, 1942.
Harry Feldman, former Major League Baseball player.
Jim Files, former National Football League player.
Jack Fleck, professional golfer, 1955 US Open winner.
Ryan Franklin, pitcher for St. Louis Cardinals and Olympic gold medalist.
Craig Gentry, Major League Baseball player.
Brett Goode, National Football League player.
Neale Henderson, Negro League Baseball player.
Priest Holmes, former National Football League player.
Jim King, former National Basketball Association player and NBA All-Star.
Jahlil Okafor, Professional basketball player, Philadelphia 76ers and Brooklyn Nets; born in Fort Smith, lived in nearby Moffett, Oklahoma until the age of 9.
Bryant Reeves, former National Basketball Association player.
Scotty Robertson, coached at C.E. Byrd High School in Shreveport, Louisiana, Louisiana Tech University in Ruston, and for four NBA teams; born in Fort Smith in 1930.


=== Actors, musicians, and media ===
Katharine Alexander (1898–1981), actress.
James Cotten, film director, actor, writer, producer.
Juliette Danielle, actress.
Charlie Jones, sportscaster.
Douglas C. Jones, author of historical fiction.
Brandon Keener, actor.
Jerry Keller, singer.
Laurence Luckinbill, actor.
Rudy Ray Moore, singer and actor.
Rossi Morreale, reality show star, actor, and television host.
Brad Neely, modern web artist.
Marty Stouffer, creator of Wild America TV series.
Alphonso Trent, jazz bandleader and musician.


=== Politicians, statesmen, legislators, lawyers, judges ===
Fay W. Boozman (1946–2005), Republican nominee for the United States Senate in 1998.
John Boozman (born 1950), United States Senator and former United States Representative for Arkansas's 3rd congressional district; Northside High School graduate and football player for the Arkansas Razorbacks; brother of Fay Boozman.
Justin Boyd, Republican member of the Arkansas House of Representatives from Fort Smith since 2015; pharmacist in Alma, Arkansas.
Virgil Bozeman (1912-2007), Illinois state representative and lawyer
Charles Winchester Breedlove, Los Angeles City Council member, 1933–45, born in Fort Smith.
Clifton R. Breckinridge (1846–1932), a Democratic alderman, congressman, diplomat, businessman and veteran of the Confederate States of America Army and Navy.
William Lee Cazort (1887–1969), former Lieutenant Governor of Arkansas, graduated from high school in Fort Smith.
W. H. H. Clayton (1840-1920), soldier, attorney, judge, justice of the Central District Court in Indian Territory; lived in Fort Smith 1873–1893, while serving under Judge Isaac Parker, before moving to McAlester, Oklahoma; buried in Fort Smith National Cemetery.
Mark Darr (born 1973), former Lieutenant Governor of Arkansas, was born in Fort Smith.
Jake Files (born 1972), state senator from Fort Smith since 2011; former member of the Arkansas House of Representatives.
William Meade Fishback (November 5, 1831 – February 9, 1903) was a Democratic Governor of Arkansas and selected to be a member of the United States Senate but was not allowed to serve.
Charlene Fite (born 1950), educator in Fort Smith and Republican state representative from Crawford and Washington counties.
B. G. Hendrix (born c. 1923), former state representative for Fort Smith.
Bruce Holland (born 1968), Republican state senator from Sebastian County; born in Fort Smith.
Asa Hutchinson (born 1950), Republican Governor of Arkansas starting in 2015, Republican former U.S. representative, Drug Enforcement Administration head, Under Secretary of Homeland Security, U.S. Senate nominee in 1986, and Arkansas gubernatorial nominee in 2006.
Carol Kelso (born 1945), former member of the Wisconsin State Assembly and Executive of Brown County, Wisconsin.
Marilyn Lloyd (born 1929), Democratic Congresswoman from Tennessee's 3rd congressional district, 1975–1995; was born in Fort Smith
Stephanie Malone (born 1978), Republican member of the Arkansas House of Representatives from Sebastian County, 2009–2015; succeeded by Justin Boyd.
George E. Nowotny (born 1932), Republican member of the Arkansas House of Representatives for Sebastian County from 1967 to 1972; resident of Tulsa, Oklahoma.
Carolyn Pollan (born 1937), former member of Arkansas House of Representatives, longest-serving Republican and longest-serving woman member of the chamber.
Isaac C. Parker (1838–1896), the "Hanging Judge".
Mathew Pitsch (born c. 1963), Republican member of the Arkansas House of Representatives for Sebastian County since 2015
William L. Spicer (1918-1991), chairman of the Arkansas Republican Party from 1962 to 1964, who quarreled with Winthrop Rockefeller; owner of a chain of drive-in theaters.


=== Other ===
Benjamin Bonneville (1796–1878), explorer of the American West.
John R. Clarke, author and Scientific Director at the United States Navy Experimental Diving Unit
Charles M. Cooke, Jr., World War II admiral, naval strategist, Commander of the USS Pennsylvania during the attack at Pearl Harbor.
William O. Darby (1911–1945), heroic World War II general.
Alyse Eady (born 1988), Miss Arkansas, 2011 Miss America first runner-up.
Jeff Gillan (born 1957), journalist
Bob Griffin (born 1934), broadcast journalist and sportscaster in Shreveport, Louisiana, since 1961; originally from Fort Smith
Ozro Thurston "O.T." Jones, Sr. (1891-1972), second Senior Bishop of the Church of God in Christ
Mame Stewart Josenberger (c1870-1964), businesswoman and club leader in Fort Smith
Bass Reeves (1838–1910), thought to be one of the first African Americans to have received a commission as a U.S. Deputy Marshal west of the Mississippi River.
Cap Tilles (1865–1951), capitalist and philanthropist.
Frederick Hinde Zimmerman (1864-1924), businessman, and founder of the Grand Rapids Hotel.


== Sister cities ==
 Cisterna, Italy
 Jining, Shandong, China


== See also ==
 United States portal
List of cities and towns in Arkansas


== References ==


== External links ==
City of Fort Smith
Fort Smith Convention & Visitors Bureau - Current Calendar of Events, Lodging, Things to Do, Attractions, History, Museums, Restaurants, Conventions, Tours and Special Events
"The Real Fort Smith: the Fact and Fiction Behind True Grit" Posted on AwardsDaily, 11/17/2010. A look at the veracity of the True Grit novel and both film adaptations, from a Fort Smith history perspective.
"Fort Smith" . Collier's New Encyclopedia. 1921.