The Orange County Register consistently names Huntington Dog Beach as the best dog park in Orange County. Some popular events that take place at Dog Beach are Surf City Surf Dog and So Cal Corgi Nation Beach Days.Preservation Society of Huntington Dog Beach works to keep the beach clean and safe. This 501(c)3 non-profit organization was founded in 1997 and has a five volunteers who serve on the board. The mission statement of the Preservation Society of Huntington Dog Beach, taken from their website, is as follows: "to protect and preserve access to the beach for dogs and their people, as well as to promote responsible dog ownership in order to make our canine companions welcome members of society."The society receives no public financing and relies completely on private donations from dog-lovers who value this public good. This non-profit provides many valuable services that minimize the impact of the negative externalities caused by dog waste and unfriendly dogs which must be addressed in order to protect the environment and keep visitors safe. One of the main reasons dogs are not usually allowed on beaches is that owners do not pick up after them. Doggie waste bags are provided for free (over 3,000 are used per day during the summer) and dog owners are encouraged to immediately dispose of their dog's waste in one of the many trash cans provided. Additionally, the society organizes a beach cleanup every Sunday where volunteers help clean up trash. To keep visitors safe, aggressive dogs are not allowed and dogs must be kept under control at all times.
The society also creates positive externalities by providing the public with valuable information on their website. This information includes, but is not limited to, rules to keep dogs safe, tips for introducing dogs to the beach for the first time, warnings about the danger of dogs drinking ocean water, and information about nearby RV parking and dog-friendly hotels. Prospective visitors should be aware of the policy regarding leashes: "Under existing city ordinance, dogs must remain leashed. However, for the past several years only unleashed, potentially dangerous dogs have been cited or removed." One important exception is that leashes are always required when entering and exiting the park to ensure safety near PCH.


== Government ==


=== Local government ===
The following table shows the current and former mayors of Huntington Beach:
According to the city's 2009 Comprehensive Annual Financial Report, the city's various funds had $295.6 million in revenues, $287.7 million in expenditures, $1,046.6 million in total assets, $202.8 million in total liabilities, and $87.1 million in cash and investments.The structure of the management and coordination of city services is as follows:


=== Huntington Beach Fire Department ===
The Huntington Beach Fire Department provides fire protection and emergency medical services for the city of Huntington Beach, California. In addition to fire services, the HBFD also provides medical transport via a fleet of five ambulances. Each ambulance is staffed by two three-year limited term EMTs and the department transports over 10,000 patients annually.The Huntington Beach Fire Department was formed as an organization in 1909 with 20 volunteers.  John Tinsley, became the first fire chief. The first fire engine was a 1923 Seagrave purchased in 1922.The Marine Safety Division of the HBFD is responsible for patrolling the 3.5 miles (5.6 km) of shoreline along Huntington Beach and Sunset Beach. The staffing levels vary from just five Marine Safety Officers during the offseason (October to March) to as many as 65 during the summer. The division staffs 30 lifeguard towers along the beach as well as Tower Zero on the Huntington Beach Pier. Members of the Marine Safety division have a wide array of equipment available for their use including 10 Toyota Tacoma patrol trucks, 3 Toyota Tundra patrol trucks, search and rescue SCUBA gear, 3 29-foot Crystaliner twin-engine rescue vessels, 3 Yamaha Waverunners, rigid-hulled inflatable boats and all-terrain vehicles.
The Huntington Beach Fire Department staffs 4-person engines and trucks. All engines are ALS-level staffing with a Fire Captain, Fire Engineer, and two Firefighter Paramedics. Trucks are BLS-level with a Fire Captain, Fire Engineer, and two Firefighter EMT's. USAR 42 is cross-staffed with Truck 42 personnel. HazMat 46 is cross-staffed with Engine 46 personnel. ET41, ET42, ET45, and ET46 are 24-hour ambulances. ET241 and ET245 are 12-hour ambulances, that only operate during the daytime hours.


=== Politics ===
In the California State Senate, Huntington Beach is in the  37th Senate District, represented by Republican John Moorlach. In the California State Assembly, it is split between the  72nd Assembly District, represented by Republican Tyler Diep, and the  74th Assembly District, represented by Democrat Cottie Petrie-Norris.In the United States House of Representatives, Huntington Beach is in California's  48th congressional district, represented by Democrat Harley Rouda.According to the California Secretary of State, as of October 22, 2018, Huntington Beach has 118,552 registered voters. Of those, 47,978 (40.47%) are registered Republicans, 34,049 (28.72%) are registered Democrats, and 30,794 (25.98%) have declined to state a political party/are independents.


== Education ==
Huntington Beach is the home of Golden West College, which offers two-year associates of arts degrees and transfer programs to four-year universities.
Huntington Beach is in the Huntington Beach Union High School District, which includes Edison High School, Huntington Beach High School, Marina High School, and Ocean View High School in the city of Huntington Beach, Fountain Valley High School in the city of Fountain Valley, and Westminster High School in the city of Westminster.
The district also has an alternative school, Valley Vista High School, and an independent study school, Coast High School.
Huntington Beach High School, which is the district's flagship school, celebrated its 100-year anniversary in 2006.
The city has four elementary school districts: Huntington Beach City School District with 9 schools and Ocean View School District with 15. A small part of the city is also served by the Fountain Valley School District and Westminster School District.
Huntington Beach is also home to The Pegasus School, a nationally recognized blue ribbon school.
Brethren Christian Junior/Senior High School was a private independent school with about 400 students living within 25 miles (40 km) of the school. It closed in 2020 after 73 years in operation.Huntington Christian School is a private K–8 school in the city
Grace Lutheran School is a private K–8 school in the city.
Lycée International de Los Angeles previously had its Orange County campus in Huntington Beach.


== Media ==
The city was featured in the TruTV series Ocean Force: Huntington Beach. The city is mentioned in the Beach Boys song "Surfin' Safari", Jan and Dean's "Surf Route 101", and "Surfer Joe" by The Surfaris.
Live cameras are set up at the Huntington Beach Pier and shown on screens at the California-themed Hollister apparel stores. The store pays the city for the cameras, with the money used to fund marine safety equipment. The cameras are also used by lifeguards.The public television station KOCE-TV operates from the Golden West College campus, in conjunction with the Golden West College Media Arts program.
Two weekly newspapers cover Huntington Beach: The Huntington Beach Independent and The Wave Section of the Orange County Register.


== Transportation ==
Most Huntington Beach households have at least one car. In 2015, only 2.6 percent of Huntington Beach households lacked a car, which decreased slightly to 2.2 percent in 2016. The national average was 8.7 percent in 2016. Huntington Beach averaged fully two cars per household in 2016, compared to a national average of 1.8.


== Notable people ==


=== Actors ===
Willie Aames, attended Edison High School
Eva Angelina, adult film actress
Ethan Embry, actor
Lauren German, actress of NBC TV series Chicago Fire
Amy Grabow, grew up in Huntington Beach; attended the Academy for the Performing Arts
Jenna Jameson, famed pornographic actress; resided in Huntington Harbour with Tito Ortiz
Jack Kelly, most noted for the role of Bart Maverick on the Maverick TV series; during the 1980s and early 1990s, served as city councilman and mayor in Huntington Beach
Jason Lee, actor, who portrays the title character in TV series My Name is Earl; grew up in Huntington Beach and attended Ocean View High School
Dennis Woodruff,  Los Angeles based actor, producer, and director


=== Athletes ===

Huntington Beach is the home to pro skateboarders Christian Hosoi, Geoff Rowley, Arto Saari, Tosh Townend, Mark Appleyard, Brian Sumner, Ed Templeton, and Nyjah Huston.
Former NHL hockey player John Blue is from Huntington Beach, as is professional soccer player Sacha Kljestan.
It is home of mixed martial artists: Tito "The Huntington Beach Bad Boy" Ortiz, Kimo Leopoldo, Tank Abbott and James Irvin.
Collin Balester, baseball player, attended Huntington Beach High School
Hank Conger, baseball player, attended Huntington Beach High School
Jessie Godderz, professional bodybuilder with the World Natural Body Building Federation, contestant on Big Brother 10 and Big Brother 11, and professional wrestler signed to Impact Wrestling
Julio César González, boxer, 1996 Olympic athlete representing Mexico, WBO light-heavyweight champion 2003, attended Edison High; killed in 2012 by a drunk driver in Baja, Mexico
Bill Green, former United States Record and NCAA Record holder in track and field, 5th in hammer throw at 1984 Summer Olympic Games, lives in Huntington Beach
Tony Gonzalez, formerly of NFL's Atlanta Falcons, TV commentator, attended Huntington Beach High School
Kyle Higashioka, Major League Baseball catcher
Ian Kennedy, San Diego Padres pitcher, was born in Huntington Beach
Jeff Kent, retired baseball player and recipient of baseball's 2000 National League MVP award, was raised in Huntington Beach and attended Edison High School.
Jürgen Klinsmann, soccer player, coach of the German national soccer team and former coach of the United States men's national soccer team; moved with his family in 2008 to Munich, Germany to become the coach of FC Bayern Munich. Klinsmann currently resides in Newport Beach.
Chris Kluwe, football punter
Iris Kyle, 10-time overall Ms. Olympia professional bodybuilder
Scott Lipsky, professional tennis player, lives in Huntington Beach
Abner Mares, boxer
David Martin, professional tennis player, lives in Huntington Beach
Paul McBeth, five-time disc golf world champion
Peter Mel, surfer
Henry Owens, baseball player
Nick Pratto, baseball player, first-round selection in 2017 MLB Draft
Joe Seanoa (ring name Samoa Joe), professional wrestler signed to WWE
Tom Shields, swimmer, 2009 graduate of Edison High School, gold medalist in 400 medley relay for U.S. at 2015 World Swimming Championships in Kazan, Russia
Brett Simpson, surfer
Zane Smith, NASCAR Xfinity Series driver
Peter "PT" Townend, surfer, resided in Huntington Beach
Joan Weston, star of Roller Derby
Bob Wolcott, former Seattle Mariners pitcher, was born in Huntington Beach


=== Musicians ===
Members of the rock/metal band Avenged Sevenfold grew up and currently reside here. Lead guitarist Synyster Gates has said he enjoys nothing more than cruising Huntington Beach on his chopper. Original drummer and founding member The Rev was buried here following his death.
Dexter Holland from The Offspring lived in Huntington Beach.
Kevin "Noodles" Wasserman from The Offspring lives in Huntington Beach
The ska punk rock band Reel Big Fish formed here in 1992.
Dean Torrence, from the 1960s pop group Jan and Dean, who co-wrote "Surf City" (#1 in 1963), said that Huntington Beach embodies the song's spirit of freedom and California fun.
Christian Jacobs, the MC Bat Commander of The Aquabats, resides in Huntington Beach.
Matt Costa, folk pop singer, was born in Huntington Beach.
(Hed) P.E., a punk rock/hip hop group, was formed in Huntington Beach.
The Vandals, a punk rock band formed in Huntington Beach
Alien Ant Farm lead singer Dryden Mitchell resides in Huntington Beach.
David Silveria, formerly from the rock band Korn resides in Huntington Beach.
Doug Webb, saxophonist
Scott Weiland, of the Stone Temple Pilots and formerly of Velvet Revolver, attended Edison High School.
Paul Williams, composer, singer, songwriter and actor
Brett Young, country singer who was raised in Huntington Beach.
Joe and Luke McGarry of the indie band Pop Noir were born in Manchester, England, but grew up and still reside in Huntington Beach.
The reggae band, The Dirty Heads was formed in Huntington Beach.
hellogoodbye was formed in Huntington Beach in 2001.
The Suburban Legends are natives of Huntington Beach.
The alternative/pop band Emblem3 moved to Huntington Beach to pursue their musical career.
Beau Bokan, American singer for metal band blessthefall was born in Huntington Beach.
Buckethead, American guitarist and multi-instrumentalist was born in Huntington Beach.
Yung Pinch, a rapper known for his beach boy image, grew up in Huntington Beach.


=== Other ===
Pete Conrad, astronaut
Violet Cowden, aviator and member of the Women Airforce Service Pilots during World War II.
Kenneth True Norris Jr., industrialist and philanthropist
Donald Lu, diplomat


== Safety ==

Fire protection in Huntington Beach is provided by the Huntington Beach Fire Department. Law enforcement is provided by the Huntington Beach Police Department. Huntington Beach Marine Safety Officers and its seasonal lifeguards are recognized as some of the best in the world with a top-notch safety record. It has an active Community Emergency Response Team training program, that trains citizens as Disaster Service Workers certified by Federal Emergency Management Agency (FEMA) as a part of a free program run by the fire department's Office of Emergency Services.
Emergency services are also provided at State Beach locations. Peace Officers and lifeguards can be found at Bolsa Chica and Huntington State Beach. Such services consist of aquatic rescues, boat rescues, first aid and law enforcement. All services are provided by the State of California, Dept. Parks & Recreation.In 1926, the Santa Ana River dam failed, and flash-flooded its entire delta. The southern oceanic terminus of this delta is now a settled area of Huntington Beach. The distant dam is still functional, but silting up, which is expected to reduce its storage volume, and therefore its effectiveness at flood-prevention. The flood and dam-endangered areas are protected by a levee, but lenders require expensive flood insurance in the delta. There have been serious discussions to eliminate the need for flood insurance and this requirement has already been waived in some areas and may one day no longer be considered a credible threat.
Since it is a seaside city, Huntington Beach has had tsunami warnings, storm surge (its pier has been rebuilt three times), sewage spills, tornadoes and waterspouts. The cold offshore current prevents hurricanes. The Pier that was rebuilt in the 1990s was engineered to withstand severe storms or earthquakes.
Large fractions of the settled delta are in soil liquefaction zones above known active faults. Most of the local faults are named after city streets.
Many residents (and even city hall) live within sight and sound of active oil extraction and drilling operations. These occasionally spew oil, causing expensive clean-ups. Large parts of the developed land have been contaminated by heavy metals from the water separated from oil.
The local oil has such extreme mercury contamination that metallic mercury is regularly drained from oil pipelines and equipment. Oil operations increase when the price of oil rises. Some oil fields have been approved for development. The worst-polluted areas have been reclaimed as parks. At least one Superfund site, too contaminated to be a park, is at the junction of Magnolia and Hamilton streets, near Edison High School.


== Sister cities ==
Huntington Beach has the following sister city relationships, according to the Huntington Beach Sister City Association:
 Anjo, Aichi Prefecture, Japan
 Manly, New South Wales, Australia (unofficial)


== See also ==

Historic Wintersburg in Huntington Beach, California
Largest cities in Southern California
List of largest California cities by population
List of United States cities by population


== References ==


== Further reading ==
Heywood, Mike (2008). Century of Service: A History of Huntington Beach. ISBN 978-1-60643-981-4.
Urashima, Mary F. Adams (2014). Historic Wintersburg in Huntington Beach. Charleston, South Carolina: The History Press. ISBN 978-1-62619-311-6.


== External links ==
Official website
Huntington Beach Chamber of Commerce
Huntington Beach Conference and Visitors Bureau
Carnegie Libraries' Web Site Entry for Huntington Beach
Huntington Beach Parade photos and information
Huntington Beach Historical Information
City of Huntington Beach at the Wayback Machine (archived October 22, 2002)