Calgary ( (listen)) is a city in the western Canadian province of Alberta. It is situated at the confluence of the Bow River and the Elbow River in the south of the province, in an area of foothills and prairie, about 80 km (50 mi) east of the front ranges of the Canadian Rockies, roughly 299 km (186 mi) south of the provincial capital of Edmonton and approximately 240 km (150 mi) north of the Canada–United States border. The city anchors the south end of the Statistics Canada-defined urban area, the Calgary–Edmonton Corridor.The city had a population of 1,285,711 in 2019, making it Alberta's most-populous city and the most-populous in western Canada. In 2016, Calgary had a metropolitan population of 1,392,609, making it the fourth-largest census metropolitan area (CMA) in Canada and second-largest in western Canada (after Vancouver).
Calgary's economy includes activity in the energy, financial services, film and television, transportation and logistics, technology, manufacturing, aerospace, health and wellness, retail, and tourism sectors. The Calgary Metropolitan Region is home to Canada's second-highest number of corporate head offices among the country's 800 largest corporations. In 2015 Calgary had the highest number of millionaires per capita of any major Canadian city. In 1988 it became the first Canadian city to host the Winter Olympic Games.
The Economist Intelligence Unit ranked Calgary the most livable city in North America in both 2018 and 2019. Calgary has been a top 5 contender for this title for the last 10 years. Calgary was also ranked the best city in the world for drivers in 2019.


== Etymology ==
Calgary was named after Calgary on the Isle of Mull, Scotland, United Kingdom. In turn, the name originates from a compound of kald and gart, similar Old Norse words, meaning "cold" and "garden", likely used when named by the Vikings who inhabited the Inner Hebrides. Alternatively, the name might be Gaelic Cala ghearraidh, meaning "beach of the meadow (pasture)", or Gaelic for either "clear running water" or "bay farm".The indigenous peoples of Southern Alberta referred to the Calgary area as "elbow", in reference to the sharp bend made by the Bow River and the Elbow River. In some cases, the area was named after the reeds that grew along the riverbanks, reeds which had been used to fashion bows. In the Blackfoot language (Siksiká), the area was known as Mohkínstsis akápiyoyis, meaning "elbow many houses", reflecting its strong settler presence. The shorter form of the Blackfoot name, Mohkínstsis, simply meaning "elbow", has been the popular Indigenous term for the Calgary area. In the Nakoda (Stoney) language, the area is known as Wincheesh-pah or Wenchi Ispase, both meaning "elbow". In the Nehiyaw (Cree) Language, the area was known as Otôskwanihk (ᐅᑑᐢᑲᐧᓂᕁ) meaning "house at the elbow" or Otôskwunee meaning "elbow". In the Tsuut'ina (Sarcee) language, the area is known as Guts’ists’i (older orthography, Kootsisáw) meaning "elbow". In the Slavey language, the area was known as Klincho-tinay-indihay meaning "many horse town", referring to the Calgary Stampede and the city's settler heritage.There have been several attempts to revive the indigenous names of Calgary. In response to the Truth and Reconciliation Commission, local post-secondary institutions have adopted "official acknowledgements" of indigenous territory using the Blackfoot name of the City, Mohkínstsis. In 2017, the Stoney Nakoda sent an application to the Government of Alberta, to rename Calgary as Wichispa Oyade meaning "elbow town"; however, this has been challenged by the Piikani Blackfoot.


== History ==


=== Early history ===
The Calgary area was inhabited by pre-Clovis people whose presence has been traced back at least 11,000 years. The area has been inhabited by the Niitsitapi (Blackfoot Confederacy; Siksika, Kainai, Piikani), îyârhe Nakoda, the Tsuut'ina First Nations peoples and Métis Nation, Region 3. As Mayor Naheed Nenshi (A'paistootsiipsii; Iitiya) describes, "There have always been people here. In Biblical times there were people here. For generations beyond number, people have come here to this land, drawn here by the water. They come here to hunt and fish; to trade; to live; to love; to have great victories; to taste bitter disappointment; but above all to engage in that very human act of building community."In 1787, cartographer David Thompson spent the winter with a band of Peigan encamped along the Bow River. He was a Hudson's Bay Company trader and the first recorded European to visit the area. John Glenn was the first documented European settler in the Calgary area, in 1873.

In 1875, the site became a post of the North-West Mounted Police (now the Royal Canadian Mounted Police or RCMP). The NWMP detachment was assigned to protect the western plains from US whisky traders, and to protect the fur trade. Originally named Fort Brisebois, after NWMP officer Éphrem-A. Brisebois, it was renamed Fort Calgary in 1876 by Colonel James Macleod.
When the Canadian Pacific Railway reached the area in 1883, and a rail station was constructed, Calgary began to grow into an important commercial and agricultural centre. Over a century later, the Canadian Pacific Railway headquarters moved to Calgary from Montreal in 1996. Calgary was officially incorporated as a town in 1884, and elected its first mayor, George Murdoch. In 1894, it was incorporated as "The City of Calgary" in what was then the North-West Territories. The Calgary Police Service was established in 1885 and assumed municipal, local duties from the NWMP.The Calgary Fire of 1886 occurred on November 7, 1886. Fourteen buildings were destroyed with losses estimated at $103,200. Although no one was killed or injured, city officials drafted a law requiring all large downtown buildings be built with Paskapoo sandstone, to prevent this from happening again.After the arrival of the railway, the Dominion Government started leasing grazing land at minimal cost (up to 100,000 acres (400 km2) for one cent per acre per year). As a result of this policy, large ranching operations were established in the outlying country near Calgary. Already a transportation and distribution hub, Calgary quickly became the centre of Canada's cattle marketing and meatpacking industries.By late 19th century, the Hudson's Bay Company (HBC) expanded into the interior and established posts along rivers that later developed into the modern cities of Winnipeg, Calgary and Edmonton. In 1884, the HBC established a sales shop in Calgary. HBC also built the first of the grand "original six" department stores in Calgary in 1913; others that followed are Edmonton, Vancouver, Victoria, Saskatoon, and Winnipeg.


=== Modern history (1900–present) ===

Between 1896 and 1914 settlers from all over the world poured into the area in response to the offer of free "homestead" land. Agriculture and ranching became key components of the local economy, and remain so into the 21st century.  The world-famous Calgary Stampede, still held annually in July, was started by four wealthy ranchers as a small agricultural show in 1912. It is now known as the "greatest outdoor show on earth".Calgary experienced Alberta's first oil boom when Calgary Petroleum Products Co found oil just southwest of the city at Turner Valley in 1914. Western Canada's first commercial oilfield boomed again in 1924 and 1936 and by WWII the Turner Valley oilfield was producing more than 95 per cent of the oil in Canada. As a result, major oil companies searched elsewhere in Alberta and in 1947 Imperial Oil discovered new reserves near Leduc, south of Edmonton. But Calgary was already the centre of Alberta oil and the new discovery caused the city to boom again. Calgary's economy grew when oil prices increased with the Arab Oil Embargo of 1973. The population increased by 272,000 in the eighteen years between 1971 (403,000) and 1989 (675,000) and another 345,000 in the next eighteen years (to 1,020,000 in 2007). During these boom years, skyscrapers were constructed and the relatively low-rise downtown quickly became dense with tall buildings.Calgary's economy was so closely tied to the oil industry that the city's boom peaked with the average annual price of oil in 1981. The subsequent drops in oil prices were cited by industry as reasons for a collapse in the oil industry and consequently the overall Calgary economy. Low oil prices prevented a full recovery until the 1990s.

With the energy sector employing a huge number of Calgarians, the fallout from the economic slump of the early 1980s was significant, and the unemployment rate soared. By the end of the decade, however, the economy was in recovery. Calgary quickly realized that it could not afford to put so much emphasis on oil and gas, and the city has since become much more diverse, both economically and culturally. The period during this recession marked Calgary's transition from a mid-sized and relatively nondescript prairie city into a thriving Canadian working centre. This transition culminated in the city's hosting Canada's first Winter Olympics in 1988. The success of these Games essentially put the city on the world stage.
Thanks in part to escalating oil prices, the economy in Calgary and Alberta was booming until the end of 2009, and the region of nearly 1.1 million people was home to the fastest growing economy in the country. While the oil and gas industry comprise an important part of the economy, the city has invested a great deal into other areas such as tourism and high-tech manufacturing. Over 3.1 million people now visit the city annually for its many festivals and attractions, especially the Calgary Stampede. The nearby mountain resort towns of Banff, Lake Louise, and Canmore are also becoming increasingly popular with tourists, and are bringing people into Calgary as a result. Other modern industries include light manufacturing, high-tech, film, e-commerce, transportation, and services.
Widespread flooding throughout southern Alberta, including on the Bow and Elbow rivers, forced the evacuation of over 75,000 city residents on June 21, 2013, and left large areas of the city, including downtown, without power.


== Geography ==

Calgary is located at the transition zone between the Canadian Rockies foothills and the Canadian Prairies. The city lies within the foothills of the Parkland Natural Region and the Grasslands Natural Region. Downtown Calgary is about 1,042.4 m (3,420 ft) above sea level, and the airport is 1,076 m (3,531 ft). In 2011, the city covered a land area of 825.29 km2 (318.65 sq mi).Two rivers run through the city and two creeks. The Bow River is the larger and it flows from the west to the south. The Elbow River flows northwards from the south until it converges with the Bow River at the historic site of Fort Calgary near downtown. Nose Creek flows into Calgary from the northwest then south to join the Bow River several kilometres east of the Elbow-Bow confluence. Fish Creek flows into Calgary from the southwest and converges with the Bow River near McKenzie Towne.
The City of Calgary, 848 km2 (327 sq mi) in size, consists of an inner city surrounded by suburban communities of various density. The city is immediately surrounded by two municipal districts – the Municipal District of Foothills No. 31 to the south and Rocky View County to the north, west and east. Proximate urban communities beyond the city within the Calgary Metropolitan Region include: the City of Airdrie to the north; the City of Chestermere, the Town of Strathmore and the Hamlet of Langdon to the east; the towns of Okotoks and High River to the south; and the Town of Cochrane to the northwest. Numerous rural subdivisions are located within the Elbow Valley, Springbank and Bearspaw areas to the west and northwest. The Tsuu T'ina Nation Indian Reserve No. 145 borders Calgary to the southwest.Over the years, the city has made many land annexations to facilitate growth. In the most recent annexation of lands from Rocky View County, completed in July 2007, the city annexed Shepard, a former hamlet, and placed its boundaries adjacent to the Hamlet of Balzac and City of Chestermere, and very close to the City of Airdrie.


=== Flora and fauna ===
Numerous plant and animal species are found within and around Calgary. The Rocky Mountain Douglas-fir (Pseudotsuga menziesii var. glauca) comes near the eastern limit of its range at Calgary. Another conifer of widespread distribution found in the Calgary area is the White Spruce (Picea glauca).  Some notable animals that can be found in and around Calgary include: deer, coyote, moose, bat, rabbit, mink, weasel, black bear, raccoon, skunk, and cougar.


=== Neighbourhoods ===

The downtown region of the city consists of five neighbourhoods: Eau Claire (including the Festival District), the Downtown West End, the Downtown Commercial Core, Chinatown, and the Downtown East Village (also part of the Rivers District). The commercial core is itself divided into a number of districts including the Stephen Avenue Retail Core, the Entertainment District, the Arts District and the Government District. Distinct from downtown and south of 9th Avenue is Calgary's densest neighbourhood, the Beltline. The area includes a number of communities such as Connaught, Victoria Crossing and a portion of the Rivers District. The Beltline is the focus of major planning and rejuvenation initiatives on the part of the municipal government to increase the density and liveliness of Calgary's centre.Adjacent to, or directly radiating from the downtown are the first of the inner-city communities. These include Crescent Heights, Hounsfield Heights/Briar Hill, Hillhurst/Sunnyside (including Kensington BRZ), Bridgeland, Renfrew, Mount Royal, Scarboro, Sunalta, Mission, Ramsay and Inglewood and Albert Park/Radisson Heights directly to the east. The inner city is, in turn, surrounded by relatively dense and established neighbourhoods such as Rosedale and Mount Pleasant to the north; Bowness, Parkdale, Shaganappi and Glendale to the west; Park Hill, South Calgary (including Marda Loop), Bankview, Altadore, and Killarney to the south; and Forest Lawn/International Avenue to the east. Lying beyond these, and usually separated from one another by highways, are suburban communities including Evergreen, Somerset, Auburn Bay, Country Hills, Sundance, Chaparral, Riverbend, and McKenzie Towne. In all, there are over 180 distinct neighbourhoods within the city limits.Several of Calgary's neighbourhoods were initially separate municipalities that were annexed by the city as it grew. These include Bowness, Montgomery, and Forest Lawn.


=== Climate ===
Calgary experiences a humid continental climate (Köppen climate classification Dwb) within eastern parts of the city and a subarctic climate (Köppen climate classification Dwc) within western parts of the city due to an increase in elevation. The city has warm summers and cold, dry winters. It falls into the NRC Plant Hardiness Zone 4a.
According to Environment Canada, average daily temperatures in Calgary range from 16.5 °C (61.7 °F) in July to −6.8 °C (19.8 °F) in December.

Winters are cold and the air temperature can drop to or below −20 °C (−4 °F) on average of 22 days of the year and −30 °C (−22 °F) on average of 3.7 days of the year, and are often broken up by warm, dry Chinook winds that blow into Alberta over the mountains. These winds can raise the winter temperature by 20 °C (36 °F), and as much as 30 °C (54 °F) in just a few hours, and may last several days. As well, Calgary's proximity to the Rocky Mountains affects winter temperature average mean temperature with a mixture of lows and highs, and tends to result in a mild winter for a city in the Prairie Provinces. Temperatures are also affected by the wind chill factor; Calgary's average wind speed is 14.2 km/h (8.8 mph), one of the highest in Canadian cities.In summer, daytime temperatures range from 10 to 25 °C (50 to 77 °F) and sometimes exceed 30 °C (86 °F) an average of 5.1 days anytime in June, July, and August, and occasionally as late as September or as early as May, and in winter drop below or at −30 °C (−22 °F) 3.7 days of the year. As a consequence of Calgary's high elevation and aridity, summer evenings tend to cool off, with monthly average low temperatures below 10 °C (50 °F) throughout the summer months.Calgary has the most sunny days year round of Canada's 100 largest cities, with just over 332 days of sun; it has on average 2,396 hours of sunshine annually, with an average relative humidity of 55% in the winter and 45% in the summer (15:00 MST).Calgary International Airport in the northeastern section of the city receives an average of 418.8 mm (16.49 in) of precipitation annually, with 326.4 mm (12.85 in) of that occurring in the form of rain, and 128.8 cm (50.7 in) as snow. The most rainfall occurs in June and the most snowfall in March. Calgary has also recorded snow every month of the year. It last snowed in July on July 15, 1999.Thunderstorms can be frequent and sometimes severe with most of them occurring in the summer months. Calgary lies within Alberta's Hailstorm Alley and is prone to damaging hailstorms every few years. A hailstorm that struck Calgary on September 7, 1991, was one of the most destructive natural disasters in Canadian history, with over $400 million in damage. Being west of the dry line on most occasions, tornadoes are rare in the region.
The highest temperature ever recorded in Calgary was 36.7 °C (98.1 °F) on August 10, 2018. The coldest temperature ever recorded was −45.0 °C (−49.0 °F) on February 4, 1893.


== Demographics ==

The population of the City of Calgary according to its 2019 municipal census is 1,285,711, a change of 
1.4% from its 2018 municipal census population of 1,267,344.In the 2016 Census of Population conducted by Statistics Canada, the City of Calgary recorded a population of 1,239,220 living in 466,725 of its 489,650 total private dwellings, a change of 13% from its 2011 population of 1,096,833. With a land area of 825.56 km2 (318.75 sq mi), it had a population density of 1,501.1/km2 (3,887.7/sq mi) in 2016. Calgary was ranked first among the three cities in Canada that saw their population grow by more than 100,000 people between 2011 and 2016. During this time Calgary saw a population growth of 142,387 people, followed by Edmonton at 120,345 people and Toronto at 116,511 people.

In the 2011 Census, the City of Calgary had a population of 1,096,833 living in 423,417 of its 445,848 total dwellings, a change of 10.9% from its 2006 adjusted population of 988,812. With a land area of 825.29 km2 (318.65 sq mi), it had a population density of 1,329.0/km2 (3,442.2/sq mi) in 2011. According to the 2011 Statistics Canada Census, persons aged 14 years and under made up 17.9% of the population, and those aged 65 and older made up 9.95%. The median age was 36.4 years. In 2011, the city's gender population was 49.9% male and 50.1% female.The Calgary census metropolitan area (CMA) is the fourth-largest CMA in Canada and largest in Alberta. It had a population of 1,392,609 in the 2016 Census compared to its 2011 population of 1,214,839. Its five-year population change of 14.6 percent was the highest among all CMAs in Canada between 2011 and 2016. With a land area of 5,107.55 km2 (1,972.04 sq mi), the Calgary CMA had a population density of 272.7/km2 (706.2/sq mi) in 2016. Statistics Canada's latest estimate of the Calgary CMA population, as of July 1, 2017, is 1,488,841.In 2015, the population within an hour commuting distance of the city is 1,511,755.As a consequence of the large number of corporations, as well as the presence of the energy sector in Alberta, Calgary has a median family income of $104,530.Christians make up 54.9% of the population, while 32.3% have no religious affiliation. Other religions in the city are Muslims (5.2%), Sikhs (2.6%) and Buddhists (2.1%).


=== Ethnicity ===
According to the 2016 Census, 59.5% of Calgary's population was of European origin, 4% was of Aboriginal heritage, and 36.2% of the population belonged to a visible minority (that is, non-white, non-aboriginal) group. Among those of European origin, the most frequently reported ethnic backgrounds were British, German, Irish, French, and Ukrainian. Among visible minorities, South Asians (mainly from India) make up the largest group (9.5%), followed by Chinese (6.8%) and Filipinos (5.5%). 5.4% were of African or Caribbean origin, 3.5% was of West Asian or Middle Eastern origin, while 2.6% of the population was of Latin American origin. Of the largest Canadian cities, Calgary ranked fourth in proportion of visible minorities, behind Toronto, Vancouver, and Winnipeg. 20.7% of the population identified as "Canadian" in ethnic origin.


== Economy ==

Calgary is recognized as a leader in the Canadian oil and gas industry, and its economy expanded at a significantly higher rate than the overall Canadian economy (43% and 25%, respectively) over the ten-year period from 1999 to 2009. Its high personal and family incomes, low unemployment and high GDP per capita have all benefited from increased sales and prices due to a resource boom, and increasing economic diversification.
Calgary benefits from a relatively strong job market in Alberta, is part of the Calgary–Edmonton Corridor, one of the fastest growing regions in the country. It is the head office for many major oil and gas related companies, and many financial service business have grown up around them. Small business and self-employment levels also rank amongst the highest in Canada. Calgary is a distribution and transportation hub with high retail sales.Calgary's economy is decreasingly dominated by the oil and gas industry, although it is still the single largest contributor to the city's GDP. In 2006, Calgary's real GDP (in constant 1997 dollars) was C$52.386 billion, of which oil, gas and mining contributed 12%. The larger oil and gas companies are BP Canada, Canadian Natural Resources Limited, Cenovus Energy, Encana, Imperial Oil, Suncor Energy, Shell Canada, Husky Energy, TransCanada, and Nexen, making the city home to 87% of Canada's oil and natural gas producers and 66% of coal producers.As of November 2016, the city had a labour force of 901,700 (a 74.6% participation rate) and 10.3% unemployment rate.In 2013, Calgary's four largest industries by employee count were "Trade" (with 112,800 employees), "Professional, Scientific and Technical Services" (100,800 employees), "Health Care and Social Assistance" (89,200 employees), and "Construction" (81,500 employees).In 2006, the top three private sector employers in Calgary were Shaw Communications (7,500 employees), Nova Chemicals (4,945) and Telus (4,517). Companies rounding out the top ten were Mark's Work Wearhouse, the Calgary Co-op, Nexen, Canadian Pacific Railway, CNRL, Shell Canada and Dow Chemical Canada. The top public sector employers in 2006 were the Calgary Zone of the Alberta Health Services (22,000), the City of Calgary (12,296) and the Calgary Board of Education (8,000). Public sector employers rounding out the top five were the University of Calgary and the Calgary Roman Catholic Separate School Division.In Canada, Calgary has the second-highest concentration of head offices in Canada (behind Toronto), the most head offices per capita, and the highest head office revenue per capita. Some large employers with Calgary head offices include Canada Safeway Limited, Westfair Foods Ltd., Suncor Energy, Agrium, Flint Energy Services Ltd., Shaw Communications, and Canadian Pacific Railway. CPR moved its head office from Montreal in 1996 and Imperial Oil moved from Toronto in 2005. Encana's new 58-floor corporate headquarters, the Bow, became the tallest building in Canada outside of Toronto. In 2001, the city became the corporate headquarters of the TSX Venture Exchange.
WestJet is headquartered close to the Calgary International Airport, and Enerjet has its headquarters on the airport grounds. Prior to their dissolution, Canadian Airlines and Air Canada's subsidiary Zip were also headquartered near the city's airport. Although its main office is now based in Yellowknife, Canadian North, purchased from Canadian Airlines in September 1998, still maintains operations and charter offices in Calgary.According to a report by Alexi Olcheski of Avison Young published in August 2015, vacancy rates rose to 11.5 per cent in the second quarter of 2015 from 8.3 per cent in 2014. Oil and gas company office spaces in downtown Calgary are subleasing 40 per cent of their overall vacancies. H&R Real Estate Investment Trust, which owns the 58-storey, 158,000-square-metre Bow Tower, claims the building was fully leased. Tenants such as Suncor "have been letting staff and contractors go in response to the downturn".


== Arts and culture ==
Calgary was designated as one of the cultural capitals of Canada in 2012. While many Calgarians continue to live in the city's suburbs, more central districts such as 17 Avenue, Kensington, Inglewood, Forest Lawn, Marda Loop and the Mission District have become more popular and density in those areas has increased.Libraries

The Calgary Public Library is the city's public library network, with 21 branches loaning books, e-books, CDs, DVDs, Blu-rays, audio books, and more. Based on borrowing, the library is the second largest in Canada, and sixth-largest municipal library system in North America. The new flagship branch, the 22,000-square-metre (240,000 sq ft) Calgary Central Library in Downtown East Village, opened on November 1, 2018.Arts Venues

