Calgary is the site of the Southern Alberta Jubilee Auditorium performing arts, culture and community facility. The auditorium is one of two "twin" facilities in the province, the other is the Northern Alberta Jubilee Auditorium located in Edmonton, each being locally known as the "Jube." The 2,538-seat auditorium was opened in 1957 and has been host to hundreds of Broadway musical, theatrical, stage and local productions. The Calgary Jube is the resident home of the Alberta Ballet Company, the Calgary Opera, and the annual civic Remembrance Day ceremonies. Both auditoriums operate 365 days a year, and are run by the provincial government. Both received major renovations as part of the province's centennial in 2005.
The city is also home to a number of performing arts spaces, such as Arts Commons, which is a 400,000 square foot performing arts complex housing the Jack Singer Concert Hall, Martha Cohen Theatre, Max Bell Theatre, Big Secret Theatre, and Motel Theatre, the Pumphouse Theatre, which houses the Victor Mitchell and Joyce Doolittle theatres, Theatre Junction GRAND, the Bella Concert Hall, the Wright Theatre, Vertigo Theatre, Stage West Theatre, Lunchbox Theatre, and several other smaller venues.
Arts Companies
Some major companies in Calgary include One Yellow Rabbit, which shares the Arts Commons building with the Calgary Philharmonic Orchestra, as well as Theatre Calgary, Alberta Theatre Projects and Theatre Junction GRAND, which is a culture house dedicated to the contemporary live arts. Calgary was also the birthplace of the improvisational theatre games known as Theatresports.
Every three years, Calgary hosts the Honens International Piano Competition (formerly known as the Esther Honens International Piano Competition). The finalists of the competition perform piano concerti with the Calgary Philharmonic Orchestra; the laureate is awarded a cash prize (currently $100,000.00 CDN, the largest cash award of any international piano competition), and a three-year career development program. Honens is an integral component of the classical music scene in Calgary.
Visual and conceptual artists like the art collective United Congress are active in the city. There are a number of art galleries in the downtown along Stephen Avenue; the SoDo (South of Downtown) Design District; the 17 Avenue corridor; the neighbourhood of Inglewood, including the Esker Foundation. There are also various arts installations in the +15 system in downtown Calgary.A number of marching bands are based in Calgary. They include the Calgary Round-Up Band, the Calgary Stetson Show Band, the Bishop Grandin Marching Ghosts, and the six-time World Association for Marching Show Bands champions, the Calgary Stampede Showband, as well as military bands including the Band of HMCS Tecumseh, the King's Own Calgary Regiment Band, and the Regimental Pipes and Drums of The Calgary Highlanders. There are many other civilian pipe bands in the city, notably the Calgary Police Service Pipe Band.The Alberta Ballet is the third largest dance company in Canada. Under the artistic direction of Jean Grand-Maître, the Alberta Ballet is at the forefront both at home and internationally. Jean Grand-Maître has become well known for his successful portrait series collaborations with pop-artists like Joni Mitchell, Elton John, and Sarah McLachlan. The Alberta Ballet resides in the Nat Christie Centre. Other dance companies include Springboard Performance, which hosts the annual Fluid Movement Arts Festival, Decidedly Jazz Danceworks, which opened its new $25-million facility in 2016 in collaboration with the Kahanoff Foundation, as well as a host of others, including European folk dance ensembles, Afro-based dance companies, and diasporic dance companies. Calgary is also home to a choral music community, including a variety of amateur, community, and semi-professional groups. Some of the mainstays include the Mount Royal Choirs from the Mount Royal University Conservatory, the Calgary Boys' Choir, the Calgary Girls Choir, the Youth Singers of Calgary, the Cantaré Children's Choir, Luminous Voices Music Society, Spiritus Chamber Choir, and pop-choral group Revv52.Calgary is also home to several post-secondary institutions that provide credit or non-credit instruction in the arts, including the Alberta University of the Arts (formerly Alberta College of Art and Design), the School of Creative and Performing Arts at the University of Calgary, the Mount Royal University Conservatory, and Ambrose University.
Festivals

Calgary hosts a number of annual festivals and events. These include the Calgary International Film Festival, the Calgary Folk Music Festival, the Calgary Performing Arts Festival (formerly Kiwanis Music Festival), FunnyFest Calgary Comedy Festival, Sled Island music festival, Beakerhead, the Calgary Folk Music Festival, the Greek festival, Carifest, Wordfest, the Lilac Festival, GlobalFest, Otafest, the Calgary Comic and Entertainment Expo, FallCon, the Calgary Fringe Festival, Summerstock, Expo Latino, Calgary Pride, Calgary International Spoken Word Festival, and many other cultural and ethnic festivals. The Calgary International Film Festival is also held annually as well as the International Festival of Animated Objects.Calgary's best-known event is the Calgary Stampede, which has occurred each July, with the exception of the year 2020, since 1912. It is one of the largest festivals in Canada, with a 2005 attendance of 1,242,928 at the 10-day rodeo and exhibition.Museums
Several museums are located in the city. The Glenbow Museum is the largest in western Canada and includes an art gallery and First Nations gallery. Other major museums include the Chinese Cultural Centre (at 6,500 m2 (70,000 sq ft), the largest stand-alone cultural centre in Canada), Canada's Sports Hall of Fame (at Canada Olympic Park), The Military Museums, the National Music Centre and The Hangar Flight Museum.
Film and television
Numerous films have been shot in Calgary and the surrounding area. Notable films shot in and around the city include: The Assassination of Jesse James, Brokeback Mountain, Dances with Wolves, Doctor Zhivago, Inception, Legends of the Fall, Unforgiven, and The Revenant. The Paul Rudd led Ghostbusters: Afterlife was filmed in downtown Calgary and Inglewood in 2019. Television shows include Fargo (TV series), Black Summer (TV series), Wynonna Earp (TV series)  and Wild Roses (TV series).Media
The Calgary Herald and the Calgary Sun are the main newspapers in Calgary. Global, City, CTV and CBC television networks have local studios in the city.


== Attractions ==

Downtown features an eclectic mix of restaurants and bars, cultural venues, public squares (including Olympic Plaza) and shopping. Notable shopping areas include such as The Core Shopping Centre (formerly Calgary Eaton Centre/TD Square), Stephen Avenue and Eau Claire Market. Downtown tourist attractions include the Calgary Zoo, the Telus Spark, the Telus Convention Centre, the Chinatown district, the Glenbow Museum, the Calgary Tower, the Art Gallery of Calgary (AGC), The Military Museums and Arts Commons. At 1.0 hectare (2.5 acres), the Devonian Gardens is one of the largest urban indoor gardens in the world, and it is located on the 4th floor of The Core Shopping Centre (above the shopping). The downtown region is also home to Prince's Island Park, an urban park located just north of the Eau Claire district. Directly to the south of downtown is Midtown and the Beltline. At the district's core is the popular 17 Avenue, known for its many bars and nightclubs, restaurants, and shopping venues. During the Calgary Flames' Stanley Cup run in 2004, 17 Avenue was frequented by over 50,000 fans and supporters per game night. The concentration of red jersey-wearing fans led to the street's playoff moniker, the "Red Mile". Downtown is easily accessed using the city's CTrain light rail (LRT) transit system.
Attractions on the west side of the city include the Heritage Park Historical Village, depicting life in pre-1914 Alberta and featuring working historic vehicles such as a steam train, paddle steamer and electric streetcar. The village itself comprises a mixture of replica buildings and historic structures relocated from southern Alberta. Just west of the city limits is Calaway Park, Western Canada's largest outdoor family amusement park, and just north of the park across the Trans Canada Highway is the Springbank/Calgary Airport where the Wings over Springbank Airshow is held every July 18 & 19. Other major city attractions include Canada Olympic Park, which features Canada's Sports Hall of Fame, and Spruce Meadows. In addition to the many shopping areas in the city centre, there are a number of large suburban shopping complexes in the city. Among the largest are Chinook Centre and Southcentre Mall in the south, Westhills and Signal Hill in the southwest, South Trail Crossing and Deerfoot Meadows in the southeast, Market Mall in the northwest, Sunridge Mall in the northeast, and the newly built CrossIron Mills and New Horizon Mall just north of the Calgary city limits, and south of the City of Airdrie.  The Peace Bridge is an iconic bridge and iconic symbol of the city spanning over the Bow River between Sunnyside and Eau Claire near downtown Calgary.  


=== Skyline ===

Downtown Calgary has a prominent and recognizable skyline that includes Brookfield Place, The Bow, the TELUS Sky, the Suncor Energy Centre, Eighth Avenue Place and the Calgary Tower. It stretches approximately 16 city blocks from east to west and is visible from many of the city's surrounding suburban communities. Office towers are mostly concentrated to the east end of downtown, while many residential and mixed-use towers are located toward the west end of downtown and in the Beltline, south of the city centre. 
There are 14 towers that are at least 150 metres (approximately 40 storeys) or taller in downtown Calgary.  The city’s skyline is rapidly evolving. As of March 2019, there are 10 skyscrapers over 100 metres (328 ft) under construction, along with another 34 skyscrapers over 100 metres (328 ft) approved or proposed, with another 56 towers over 35 metres (115 ft) under construction or approved for construction. Calgary’s tallest skyscraper is the 247-metre (810 ft) Brookfield Place. In second place, the Bow stands at 236 m (774 ft) with 60 storeys, and 222-metre (728 ft) TELUS Sky is the third tallest. Bankers Hall Towers in central downtown are the tallest twin towers in Canada.


== Sports and recreation ==

Within Calgary there are approximately 8,000 ha (20,000 acres) of parkland available for public usage and recreation. These parks include Fish Creek Provincial Park, Inglewood Bird Sanctuary, Bowness Park, Edworthy Park, Confederation Park, Prince's Island Park, Nose Hill Park, and Central Memorial Park. Nose Hill Park is one of the largest municipal parks in Canada at 1,129 ha (2,790 acres). The park has been subject to a revitalization plan that began in 2006. Its trail system is currently undergoing rehabilitation in accordance with this plan. The oldest park in Calgary, Central Memorial Park, dates back to 1911. Similar to Nose Hill Park, revitalization also took place in Central Memorial Park in 2008–2009 and reopened to the public in 2010 while still maintaining its Victorian style. An 800 km (500 mi) pathway system connects these parks and various neighbourhoods. Calgary also has multiple private sporting clubs including the Glencoe Club and the Calgary Winter Club.

In large part due to its proximity to the Rocky Mountains, Calgary has traditionally been a popular destination for winter sports. Since hosting the 1988 Winter Olympics, the city has also been home to a number of major winter sporting facilities such as Canada Olympic Park (bobsleigh, luge, cross-country skiing, ski jumping, downhill skiing, snowboarding, and some summer sports) and the Olympic Oval (speed skating and hockey). These facilities serve as the primary training venues for a number of competitive athletes. Also, Canada Olympic Park serves as a mountain biking trail in the summer months.
In the summer, the Bow River is very popular among river rafters and fly-fishermen. Golfing is also an extremely popular activity for Calgarians and the region has a large number of courses. The Century Downs Racetrack and Casino is a 5 1/2 furlong horse track located just north of the city.Calgary hosted the 2009 World Water Ski Championship Festival in August, at the Predator Bay Water Ski Club, approximately 40 km (25 mi) south of the city.As part of the wider Battle of Alberta, the city's sports teams enjoy a popular rivalry with their Edmonton counterparts, most notably the rivalries between the National Hockey League's Calgary Flames and Edmonton Oilers, and the Canadian Football League's Calgary Stampeders and Edmonton Eskimos.

Calgary is the hometown of the Hart wrestling family and the location of the Hart family "Dungeon", where the patriarch of the Hart Family, Stu Hart, trained numerous professional wrestlers including Superstar Billy Graham, Brian Pillman, the British Bulldogs, Edge, Christian, Greg Valentine, Chris Jericho, Jushin Thunder Liger and many more. Also among the trainees were the Hart family members themselves, including WWE Hall of Fame member and former WWE champion Bret Hart and his brother, the 1994 WWF King of the Ring, Owen Hart.In 1997 Calgary hosted The World Police & Fire Games hosting over 16,000 athletes from all over the world.


== Government ==
The city is a corporate power-centre, a high percentage of the workforce is employed in white-collar jobs. The high concentration of oil and gas corporations led to the rise of Peter Lougheed's Progressive Conservative Party in 1971. However, as Calgary's population has increased, so has the diversity of its politics.


=== Municipal politics ===

The City of Calgary is a municipal corporation with a council–manager government structure consisting of a fifteen member Council elected every four years. The Council itself consists of an at-large Mayor and fourteen Councillors who represent geographic regions of the city. The legal authority to govern as a "creature of the province" is derived from various regulations and legislation of the Alberta Legislature, of which the Municipal Government Act and the City of Calgary Charter, 2018 Regulation provide many of the powers and responsibilities for the city. The current Mayor Naheed Nenshi was first elected in the 2010 municipal election, and subsequently re-elected in 2013 and 2017.
Three school boards operate independently of each other in Calgary, the public, the separate (catholic) and francophone systems. Both the public and separate boards have 7 elected trustees each representing 2 of 14 wards. The School Boards are considered part of municipal politics in Calgary as they are elected at the same time as City Council.


=== Provincial politics ===
As a result of the 2019 provincial election, Calgary is represented by twenty-six MLAs, including twenty three United Conservative Party and three New Democratic Party of Alberta.


=== Federal politics ===
On October 19, 2015, Calgary elected its first two Liberal federal MPs since 1968, Darshan Kang for Calgary Skyview and Kent Hehr for Calgary Centre. The remaining MPs are members of the Conservative Party of Canada (CPC). Before 2015, the Liberals had only elected three MPs from Calgary ridings in their entire history-- Manley Edwards (1940–1945), Harry Hays (1963–1965) and Pat Mahoney (1968–1972).The federal riding of Calgary Heritage was held by former Prime Minister and CPC leader Stephen Harper. That seat was also held by Preston Manning, the leader of the Reform Party of Canada; it was known as Calgary Southwest at the time. Harper is the second Prime Minister to represent a Calgary riding; the first was R. B. Bennett from Calgary West, who held that position from 1930 to 1935. Joe Clark, former Prime Minister and former leader of the Progressive Conservative Party of Canada (also a predecessor of the CPC), held the riding of Calgary Centre during his second stint in Parliament from 2000 to 2004.
The Green Party of Canada has also made inroads in Calgary, exemplified by results of the 2011 federal election where they achieved 7.7% of the vote across the city, ranging from 4.7% in Calgary Northeast to 13.1% in Calgary Centre-North.


=== Crime ===

The Calgary census metropolitan area (CMA) had a crime severity index of 60.4 in 2013, which is lower than the national average of 68.7. A slight majority of the other CMAs in Canada had crime severity indexes greater than Calgary's 60.4. Calgary had the sixth-most homicides in 2013 at 24.


=== Military ===

The presence of the Canadian military has been part of the local economy and culture since the early years of the 20th century, beginning with the assignment of a squadron of Strathcona's Horse. After many failed attempts to create the city's own unit, the 103rd Regiment (Calgary Rifles) was finally authorized on April 1, 1910. Canadian Forces Base (CFB) Calgary was established as Currie Barracks and Harvie Barracks following the Second World War. The base remained the most significant Department of National Defence (DND) institution in the city until it was decommissioned in 1998, when most of the units moved to CFB Edmonton. Despite this closure there is still a number of Canadian Forces Reserve units, and cadet units garrisoned throughout the city. They include HMCS Tecumseh Naval Reserve unit, The King's Own Calgary Regiment, The Calgary Highlanders, both headquartered at the Mewata Armouries, 746 Communication Squadron, 41 Canadian Brigade Group, headquartered at the former location of CFB Calgary, 14 (Calgary) Service Battalion, 15 (Edmonton) Field Ambulance Detachment Calgary, 14 (Edmonton) Military Police Platoon Calgary, 41 Combat Engineer Regiment detachment Calgary (33 Engineer Squadron), along with a small cadre of Regular Force support. As of 2013, 746 Communication Squadron is now known as 41 Signals 3 Squadron. Several units have been granted Freedom of the City.
The Calgary Soldiers' Memorial commemorates those who died during wartime or while serving overseas. Along with those from units currently stationed in Calgary it represents the 10th Battalion, CEF and the 50th Battalion, CEF of the Canadian Expeditionary Force.


== Infrastructure ==


=== Transportation ===


==== Public transit and light-rail ====

Calgary Transit provides public transportation services throughout the city with buses and light rail. Calgary's light rail system, known as the CTrain, was one of the first such systems in North America (behind Edmonton LRT). It consists of two lines (Red Line and Blue Line), 44 stations and 58.2 km (36.2 mi) of track. The Calgary LRT is one of the continent's busiest carrying 270,000 passengers per weekday and approximately half of Calgary downtown workers take the transit to work. The CTrain is also North America's first and only LRT to run on 100% renewable, wind generated energy. In early 2020, city council approved construction of the Calgary Green Line, the third light-rail line in the city’s rapid transit network. It will be the first rail line in Calgary to operate low-floor trains and is the largest public works project in the history of Calgary, about three-and-a-half times bigger than the second-largest project.


==== Airports ====

Calgary International Airport (YYC), in the city's northeast, is a major transportation and cargo hub for much of central and western Canada. It is Canada's fourth busiest airport, serving 18 million passengers in 2019. The airport serves as the primary gateway into Banff National Park, located 90 minutes west, and the entire Canadian Rocky Mountain Parks system. Non-stop destinations include cities throughout Canada, the United States, Europe, Central America, and Asia. Calgary/Springbank Airport, Canada's eleventh busiest, serves as a reliever for the Calgary International taking the general aviation traffic and is also a base for aerial firefighting aircraft. 


==== Pedestrian and cycling ====

As an alternative to the over 260 km (160 mi) of shared bikeways on streets, the city has a network of multi-use (bicycle, walking, rollerblading, etc.) paths spanning over 935 km (581 mi). The Peace Bridge provides pedestrians and cyclists, access to the downtown core from the north side of the Bow river. The bridge ranked among the top 10 architectural projects in 2012 and among the top 10 public spaces of 2012.


==== Skyway ====

In the 1960s, Calgary started to develop a series of pedestrian bridges connecting many downtown buildings. Today, these bridges connect between most of the city’s downtown office towers and make up the world's most extensive skyway network (elevated indoor pedestrian bridges), officially called the +15. The system shields pedestrians from the city’s extreme cold winter temperatures. The name derives from the fact that the bridges are usually 15 ft (4.6 m) above ground.


==== Roads and highways ====
Calgary lies at the crossroads of Highway 2 and the Trans-Canada Highway, making it an important hub for the transit of goods across Canada and along the CANAMEX Corridor. Stoney Trail forms a nearly completed ring road around the city that will be fully finished in 2022 when the final section opens in west Calgary. Freeways and expressways are mostly called "trails". Highway 2, named Deerfoot Trail, is the main north-south route through Calgary and one of the busiest highways in Canada. Much of Calgary's street network is on a grid where roads are numbered with avenues running east—west and streets running north—south. Until 1904 the streets were named; after that date, all streets were given numbers radiating outwards from the city centre. Roads in predominantly residential areas as well as freeways and expressways do not generally conform to the grid and are usually not numbered. However, it is a developer and city convention in Calgary that non-numbered streets within a new community have the same name prefix as the community itself.


==== Rail ====
Calgary's presence along the Canadian Pacific Railway (CPR) mainline (which includes the CPR Alyth Yard) makes the city an important hub of freight rail throughout the province. There is currently no inter-city or regional passenger rail serving the city. In June 2020, the Canada Infrastructure Bank signed a memorandum of understanding with the Government of Alberta to build a 130 kilometre inter-city rail line from downtown Calgary to Banff, and an express line from Calgary International Airport to downtown Calgary.Between 1955 and 1978, CPR operated a transcontinental passenger rail service called the Canadian, running between Toronto and Vancouver via CPR's right-of-way through Calgary. In 1978, VIA Rail assumed responsibility over CPR's Canadian rail service. In the aftermath of another round of deep budget cuts made to Via Rail on January 15, 1990, VIA permanently discontinued the Super Continental and rerouted the Canadian along the Super Continental's CN route, bypassing Regina and Calgary in favour of Saskatoon and Edmonton. Since then, there has been no intercity rail service to or from Calgary. But two new rail-tour lines have opened along the now open CPR right-of-way: Rocky Mountaineer and Royal Canadian Pacific. The latter still operates rail-tour services to Calgary, while the former has terminated its westbound services at Banff, two hours to the west.


=== Health care ===
Medical centres and hospitals

Calgary has four major adult acute care hospitals and one major pediatric acute care site: the Alberta Children's Hospital, the Foothills Medical Centre, the Peter Lougheed Centre, the Rockyview General Hospital and the South Health Campus. They are all overseen by the Calgary Zone of the Alberta Health Services, formerly the Calgary Health Region. Calgary is also home to the Tom Baker Cancer Centre (located at the Foothills Medical Centre), the Grace Women's Health Centre, which provides a variety of care, and the Libin Cardiovascular Institute. In addition, the Sheldon M. Chumir Centre (a large 24-hour assessment clinic), and the Richmond Road Diagnostic and Treatment Centre (RRDTC), as well as hundreds of smaller medical and dental clinics operate in Calgary. The Faculty of Medicine of the University of Calgary also operates in partnership with Alberta Health Services, by researching cancer, cardiovascular, diabetes, joint injury, arthritis and genetics. The Alberta children's hospital, built in 2006, replaced the old Children's Hospital.
The four largest Calgary hospitals have a combined total of more than 2,100 beds, and employ over 11,500 people.


== Education ==


=== Primary and secondary ===
