In response to these failures and to offer a way forward, Carmichael discusses the concept of coalition with regard to the Civil Rights Movement. The leadership of the movement had affirmed that anyone who truly believed in their cause was welcome to join and march. Carmichael offered a different vision. Influenced by Fanon's ideas in The Wretched of the Earth, wherein two groups were not "complementary" (could have no overlap) until they were mutually exclusive (were on an equal power footing economically, socially, politically, etc.), Carmichael said that U.S. blacks had to unite and build their power independent of the white structure, or they would never be able to build a coalition that would function for both parties, not just the dominant one. He said, "we want to establish the grounds on which we feel political coalitions can be viable." For this to happen, Carmichael argued that blacks had to address three myths regarding coalition: "that the interests of black people are identical with the interests of certain liberal, labor, or other reform groups"; that a viable coalition can be created between "the politically and economically secure and the politically and economically insecure"; and that a coalition can be "sustained on a moral, friendly, sentimental basis; by appeals to conscience." He believed that each of these myths showed the need for two groups to be mutually exclusive, and on relatively equal footing, to be in a viable coalition.
This philosophy, grounded in the independence literature of Africa and Latin America, became the basis for a great deal of Carmichael's work. He believed the Black Power Movement had to be developed outside the white power structure.
Carmichael also continued as a strong critic of the Vietnam War and imperialism in general. During this period he traveled and lectured extensively throughout the world, visiting Guinea, North Vietnam, China, and Cuba. He became more clearly identified with the Black Panther Party as its "Honorary Prime Minister." During this period, he acted more as a speaker than an organizer, traveling throughout the country and internationally advocating for his vision of Black Power.Carmichael lamented the 1967 execution of Marxist revolutionary Che Guevara, saying:

The death of Che Guevara places a responsibility on all revolutionaries of the World to redouble their decision to fight on to the final defeat of Imperialism. That is why in essence Che Guevara is not dead, his ideas are with us.
Carmichael visited the United Kingdom in July 1967 to attend the Dialectics of Liberation conference. After recordings of his speeches were released by the organizers, the Institute of Phenomenological Studies, he was banned from reentering Britain. In August 1967, a Cuban government magazine reported that Carmichael met with Fidel Castro for three days and called it "the most educational, most interesting, and the best apprenticeship of [my] public life." Because relations with Cuba were prohibited at the time, after his return to the US, the government withdrew his passport. In December 1967, he traveled to France to attend an antiwar rally. There he was detained by police and ordered to leave the next day, but government officials eventually intervened and allowed him to stay.


=== 1968 D.C. riots ===
Carmichael was present in Washington, D.C. on April 5, 1968, the night after the assassination of Martin Luther King Jr. He led a group through the streets, demanding that businesses close out of respect. He tried to prevent violence, but the situation escalated beyond his control. Due to his reputation as a provocateur, the news media blamed Carmichael for the ensuing violence as mobs rioted along U Street and other areas of black commercial development.Carmichael held a press conference the next day at which he predicted mass racial violence in the streets. Since moving to Washington, he had been under nearly constant FBI surveillance. After the riots, FBI director J. Edgar Hoover instructed a team of agents to find evidence connecting Carmichael to them. He was also subjected to COINTELPRO's bad-jacketing technique. Huey P. Newton suggested Carmichael was a CIA agent, slander that led to Carmichael's break with the Panthers and his exile from the U.S. the following year.


== 1969–98: Travel to Africa ==
Carmichael soon began to distance himself from the Panthers, mainly over white activist  participation in the movement. The Panthers believed that white activists could help the movement, while Carmichael had come to agree with Malcolm X that white activists should organize their own communities before trying to lead black people.
In 1968, he married Miriam Makeba, a noted singer from South Africa. They left the US for Guinea the next year. Carmichael became an aide to Guinean president Ahmed Sékou Touré, and a student of the exiled Ghanaian president Kwame Nkrumah. Makeba was appointed Guinea's official delegate to the United Nations. Three months after his arrival in Guinea, in July 1969, Carmichael published a formal rejection of the Black Panthers, condemning them for not being separatist enough and for their "dogmatic party line favoring alliances with white radicals".Carmichael changed his name to Kwame Ture in 1978 to honor Nkrumah and Touré, who had become his patrons. At the end of his life, friends called him by both names, "and he doesn't seem to mind".Carmichael's suspicions about the CIA were confirmed in 2007 by declassified documents revealing that the agency had tracked him from 1968 as part of their surveillance of black activists abroad. The surveillance continued for years.Carmichael remained in Guinea after his separation from the Black Panther Party. He continued to travel, write, and speak in support of international leftist movements. In 1971 he published his collected essays in a second book, Stokely Speaks: Black Power Back to Pan-Africanism. This book expounds an explicitly socialist Pan-African vision, which he retained for the rest of his life. From the late 1970s till his death, he answered his phone by announcing, "Ready for the revolution!"In 1986, two years after Sékou Touré's death, the military regime that took his place arrested Carmichael for his association with Touré, and jailed him for three days on suspicion of attempting to overthrow the government. Although Touré was known for jailing and torturing his opponents (some 50,000 people are believed to have been killed under his regime) Carmichael had never publicly criticized the man he named himself after.


=== All-African People's Revolutionary Party ===
For the final 30 years of his life, Kwame Ture was devoted to the All-African People's Revolutionary Party (A-APRP). His mentor Nkrumah had many ideas for unifying the African continent, and Ture extended the scope of these ideas to the entire African diaspora. He was a Central Committee member during his association with the A-APRP and made many speeches on the party's behalf.Ture did not simply study with Sékou Touré and Kwame Nkrumah. The latter had been designated honorary co-president of Guinea after he was deposed by the US-backed coup in Ghana. Ture worked overtly and covertly to "Take Nkrumah Back to Ghana" (according to the movement's slogan). He became a member of the Democratic Party of Guinea (PDG), the revolutionary ruling party. He sought Nkrumah's permission to launch the All-African People's Revolutionary Party (A-APRP), which Nkrumah had called for in his book Handbook of Revolutionary Warfare. After several discussions, Nkrumah gave his blessing.
Ture was convinced that the A-APRP was needed as a permanent mass-based organization in all countries where people of African descent lived. For the last decades of his life, a period often ignored by popular media, Ture worked full-time as an organizer of the party. He spoke on its behalf on several continents, at college campuses, community centers, and other venues. He was instrumental in strengthening ties between the African/Black liberation movement and several revolutionary or progressive organizations, both African and non-African. Notable among them were the American Indian Movement (AIM) of the United States, New Jewel Movement (Grenada), National Joint Action Committee (NJAC) of Trinidad and Tobago, Palestine Liberation Organization (PLO), the Pan Africanist Congress (South Africa) and the Irish Republican Socialist Party.
Routinely, Ture was regarded as the leader of the A-APRP, but his only titles were "Organizer" and Central Committee member. Beginning in the mid-1970s, the A-APRP began each May to sponsor African Liberation Day (ALD), a continuation of the African Freedom Day Nkrumah began in 1958 in Ghana. Although the party was involved in or was primary or co-sponsor of other ALD annual observances, marches, and rallies around the world, the best-known and largest event was held annually in Washington, DC, usually at Meridian Hill Park (also known as Malcolm X Park) at 16th and W Streets, NW.
While making his home in Guinea, Ture traveled frequently. Britain and his birth country, Trinidad and Tobago, barred him from speaking at one time or another for fear that he would arouse African-descended people in those countries. In the last quarter of the 20th century, Ture became the world's most active and prominent exponent of pan-Africanism, defined by Nkrumah and the A-APRP as "The Liberation and Unification of Africa Under Scientific Socialism".
Ture often returned to speak to audiences of thousands (including students and townspeople) at his alma mater, Howard University, and other campuses. The Party worked to recruit students and other youth, and Ture hoped to attract them with his speeches. He also worked to raise the political consciousness of African/Black people in general. He formed the A-APRP with the initial goal of putting "Africa" on the lips of Black people throughout the diaspora, knowing that many did not consciously or positively relate to their ancestral homeland. Ture was convinced that the party significantly raised international black "consciousness" of Pan-Africanism.
Under his leadership, the A-APRP organized the All African Women's Revolutionary Union and the Sammy Younge Jr. Brigade (named after the first black college student to die during the 1960s Civil Rights Movement) as component organizations.
Ture and Cuban president Fidel Castro admired each other, sharing a common opposition to imperialism. In Ture's final letter, he wrote:

It was Fidel Castro who before the OLAS (Organization of Latin American States) Conference said "if imperialism touches one grain of hair on his head, we shall not let the fact pass without retaliation." It was he, who on his own behalf, asked them all to stay in contact with me when I returned to the United States to offer me protection.
Ture was ill when he gave his final speech at Howard University. A standing-room-only crowd in Rankin Chapel paid tribute to him, and he spoke boldly, as usual. A small group of student leaders from Howard and a former Party member traveled to Harlem (Sugar Hill) in New York City to bid Ture farewell shortly before his final return to Guinea. Also present that evening were Kathleen Cleaver and another Black Panther, Dhoruba bin Wahad. Ture was in good spirits though in pain. The group included men and women born in Africa, South America, the Caribbean, as well as the USA.


== Illness and death ==
After his diagnosis of prostate cancer in 1996, Ture was treated for a period in Cuba, while receiving some support from the Nation of Islam. Benefit concerts for Ture were held in Denver; New York; Atlanta; and Washington, D.C., to help defray his medical expenses. The government of Trinidad and Tobago, where he was born, awarded him a grant of $1,000 a month for the same purpose. He went to New York, where he was treated for two years at the Columbia-Presbyterian Medical Center, before returning to Guinea.In a final interview given in April 1998 to The Washington Post, Ture criticized the limited economic and electoral progress made by African Americans in the U.S. during the previous 30 years. He acknowledged that blacks had won election to the mayor's office in major cities, but said that, as the mayors' power had generally diminished over earlier decades, such progress was essentially meaningless.
In 1998 Ture died of prostate cancer at the age of 57 in Conakry, Guinea. He had said that his cancer "was given to me by forces of American imperialism and others who conspired with them." He claimed that the FBI had infected him with cancer in an assassination attempt.The civil rights leader Jesse Jackson spoke in celebration of Ture's life, saying: "He was one of our generation who was determined to give his life to transforming America and Africa. He was committed to ending racial apartheid in our country. He helped to bring those walls down". NAACP Chair Julian Bond said that Carmichael "ought to be remembered for having spent almost every moment of his adult life trying to advance the cause of black liberation."


== Personal life ==
Carmichael married Miriam Makeba, the noted singer from South Africa, in the US in 1968. They divorced in Guinea after separating in 1973.
Later he married Marlyatou Barry, a Guinean doctor. They divorced some time after having a son, Bokar, in 1981. By 1998, Marlyatou Barry and Bokar were living in Arlington County, Virginia, near Washington, DC. Using a statement from the All-African People's Revolutionary Party as a reference, Carmichael's 1998 obituary in The New York Times referred to his survivors as two sons, three sisters, and his mother, without further details.


== Legacy ==
Ture, along with Charles V. Hamilton, is credited with coining the phrase "institutional racism", defined as racism that occurs through institutions such as public bodies and corporations, including universities. In the late 1960s Ture defined "institutional racism" as "the collective failure of an organization to provide an appropriate and professional service to people because of their color, culture or ethnic origin".In his book on King, David J. Garrow criticizes Ture's handling of the Black Power movement as "more destructive than constructive". Garrow describes the period in 1966 when Ture and other SNCC members managed to register 2,600 African American voters in Lowndes County as the most consequential period in Ture's life "in terms of real, positive, tangible influence on people's lives". Evaluations by Ture's associates are also mixed, with most praising his efforts and others criticizing him for failing to find constructive ways to achieve his objectives. SNCC's final chair, Phil Hutchings, who expelled Ture over a dispute about the Black Panther Party, wrote, "Even though we kidded and called him 'Starmichael', he could sublimate his ego to get done what was needed to be done....He would say what he thought, and you could disagree with it but you wouldn't cease being a human being and someone with whom he wanted to be in relationship." Washington Post staff writer Paula Span described Carmichael as someone who was rarely hesitant to push his own ideology. Tufts University historian Peniel Joseph's biography, Stokely: A Life, says that Black Power activist Ruby Doris Smith Robinson, the first to call him as "Stokely Starmichael," gave him the nickname in protest of his growing ego and that other SNCC staff shared her view.Joseph credits Ture with expanding the parameters of the civil rights movement, asserting that his black power strategy "didn't disrupt the civil rights movement. It spoke truth to power to what so many millions of young people were feeling. It actually cast a light on people who were in prisons, people who were welfare rights activists, tenants' rights activists, and also in the international arena." Tavis Smiley calls Ture "one of the most underappreciated, misunderstood, undervalued personalities this country's ever produced".In 2002, the American-born scholar Molefi Kete Asante listed Ture as one of his 100 Greatest African Americans.Ture is also remembered for his actions in James Meredith's March Against Fear in June 1966, when he issued the call for Black Power. When Meredith got shot, Carmichael came up with the phrase and gathered a crowd to chant it in Greenwood, Mississippi. Already, earlier that day, he had been arrested for the 27th time; he spoke to over 3,000 people that day in the park. Ture was angry that day because black people had been "chanting" freedom for almost six years with no results, so he wanted to change the chant. He also participated in and contributed to the Black Freedom Struggle. Many people have overlooked his involvement in the movement. He never switched from left to right in his politics as he got older, and his trajectory both marked and influenced the course of black militancy in the United States. The outrage that most affected him was King's assassination.


== Controversies ==


=== Views on Adolf Hitler ===
Although he stated in his posthumously published memoirs that he had never been anti-semitic, in 1970 Carmichael proclaimed: "I have never admired a white man, but the greatest of them, to my mind, was Hitler." However, Carmichael in the same speech condemned Hitler on moral grounds, Carmichael himself stating:

Adolph Hitler—I'm not putting a judgment on what he did—if you asked me for my judgment morally, I would say it was bad, what he did was wrong, was evil, etc. But I would say he was a genius, nevertheless . . . . You say he's not a genius because he committed bad acts. That's not the question. The question is, he does have genius. Now when we condemn him morally or ethically, we will say, well, he was absolutely wrong, he should be killed, he should be murdered, etc., etc. . . . But if we're judging his genius objectively, we have to admit that the man was a genius. He forced the entire world to fight him. He was fighting America, France, Britain, Russia, Italy once— then they switched sides—all of them at the same time, and whipping them. That's a genius, you cannot deny that.


=== Views on women ===
In November 1964 Carmichael made a joking remark in response to a SNCC position paper written by his friends Casey Hayden and Mary E. King on the position of women in the movement. In the course of an irreverent comedy monologue he performed at a party after SNCC's Waveland conference, Carmichael said, "The position of women in the movement is prone." A number of women were offended. In a 2006 The Chronicle of Higher Education article, historian Peniel E. Joseph later wrote:

While the remark was made in jest during a 1964 conference, Carmichael and black-power activists did embrace an aggressive vision of manhood — one centered on black men's ability to deploy authority, punishment, and power. In that, they generally reflected their wider society's blinders about women and politics.
Carmichael's colleague, John Lewis, stated in his autobiography, March, that the comment was a joke, uttered as Carmichael and other SNCC officials were "blowing off steam" following the adjournment of a meeting at a staff retreat in Waveland, Mississippi. When asked about the comment, former SNCC field secretary Casey Hayden stated: "Our paper on the position of women came up, and Stokely in his hipster rap comedic way joked that 'the proper position of women in SNCC is prone'. I laughed, he laughed, we all laughed. Stokely was a friend of mine." In her memoir, Mary E. King wrote that Carmichael was "poking fun at his own attitudes" and that "Casey and I felt, and continue to feel, that Stokely was one of the most responsive men at the time that our anonymous paper appeared in 1964."Carmichael appointed several women to posts as project directors during his tenure as chairman of SNCC; by the latter half of the 1960s (considered to be the "Black Power era"), more women were in charge of SNCC projects than during the first half.


== In popular culture ==


=== Film ===
In Spike Lee's 2018 film BlacKkKlansman, Kwame Ture is portrayed by Corey Hawkins.
In Mario Van Peebles' 1995 film Panther based on Melvin Van Peebles' screenplay, Stokley Carmichael is portrayed by Mario Van Peebles.


=== Exhibition ===
In 2018 a national tribute  'the fight of a lifetime'  is dedicated to him during a one-month exhibition at the Gamal Abdel Nasser University of Conakry.


== See also ==
List of civil rights leaders


== References ==


== Further reading ==
Carmichael, Stokely (1966). "Toward Black Liberation". The Massachusetts Review. 7 (4): 639–651. JSTOR 25087498.
Carmichael, Stokely (and Michael Thelwell), Ready for Revolution: The Life and Struggles of Stokely Carmichael (Kwame Ture). New York: Scribner, 2005.
Carmichael, Stokely (and Charles V. Hamilton), Black Power: The Politics of Liberation. Vintage; reissued 1992.
Carmichael, Stokely, Stokely Speaks: Black Power Back to Pan-Africanism. Random House, 1971, 292 pages.
Joseph, Peniel E., Waiting 'Til The Midnight Hour: A Narrative History of Black Power in America. Henry Holt, 2007.
Joseph, Peniel E. Stokely: A Life. New York: Basic Books, 2014.


== External links ==
SNCC Digital Gateway: Stokely Carmichael, Documentary website created by the SNCC Legacy Project and Duke University, telling the story of the Student Nonviolent Coordinating Committee & grassroots organizing from the inside-out
Stokely Carmichael on IMDb
Stokely Carmichael at Curlie
Stokely Carmichael
Stokely Carmichael page. Stokely Carmichael spoke to an enthusiastic crowd at Garfield High School in Seattle, Washington, on April 19, 1967. Audio and slideshow. Retrieved May 3, 2005.
Stokely Carmichael FBI Records - Stokely Carmichael records at FBI's The Vault Project.
Image of Stokely Carmichael, speaking with a crowd of more than 6500 at Will Rogers Park in Los Angeles, California, 1966. Los Angeles Times Photographic Archive (Collection 1429). UCLA Library Special Collections, Charles E. Young Research Library, University of California, Los Angeles.


=== Research resources ===
Stokely Carmichael-Lorna D. Smith Collection, 1964–1972 (5 linear ft.) is housed in the Department of Special Collections and University Archives at Stanford University Libraries


=== Videos ===
Montgomey Interview video at The Jack Rabin Collection of Alabama Civil Rights and Southern Activists [1]
Kwame Ture on Zionism
February 17, 1968 on PBS.org
Consciousness and Unconsciousness
With H. Rap Brown, Oakland, 1968 (longer version of PBS clip)
From Protest to Resistance: A Critical Look at the New Left. A 1968 TV movie with interviews and footage of Carmichael's speeches, made by Saul Landau
Appearances on C-SPAN
University of Nebraska Omaha, 1993
Eyes on the Prize interview (1986) in the American Archive of Public Broadcasting