Palm Beach is an incorporated town in Palm Beach County, Florida, United States. Located on an island in east-central Palm Beach County, the town is separated from several nearby cities including West Palm Beach and Lake Worth Beach by the Intracoastal Waterway to its west, though Palm Beach borders a small section of the latter and South Palm Beach at its southern boundaries. As of 2010 census, Palm Beach had a year-round population of 8,348 and an estimated population of 8,816 in 2019, with an increase to approximately 25,000 people between November and April.
Settlers began arriving in modern-day Palm Beach as early as 1872 and opened a post office about five years later. Elisha Newton "Cap" Dimick, later the town's first mayor, established Palm Beach's first hotel, the Cocoanut Grove House, in 1880. However, it was Standard Oil tycoon Henry Flagler who became instrumental in transforming the island of jungles and swamps into a winter resort for the wealthy. Flagler and his workers constructed the Royal Poinciana Hotel in 1894, The Breakers in 1896, and Whitehall in 1902; extended the Florida East Coast Railway southward to the area by 1894; and developed a separate city to house hotel workers, which later became West Palm Beach. The town of Palm Beach officially incorporated on April 17, 1911. Addison Mizner also contributed significantly to the town's history, designing 67 structures, including El Mirasol, the Everglades Club, La Querida, the William Gray Warden House, and Via Mizner, which is a section of Worth Avenue.
Forbes reported in 2017 that Palm Beach had at least 30 billionaires, with the town ranking as the 27th-wealthiest place in the United States in 2016 according to Bloomberg News. Many famous and wealthy individuals have resided in the town, including United States presidents John F. Kennedy and Donald Trump. Palm Beach is also noted for upscale shopping districts such as Worth Avenue, Royal Poinciana Plaza, and the Royal Poinciana Way Historic District.


== History ==
Settlers began arriving in modern-day Palm Beach by 1872. Hiram F. Hammon made the first homestead claim in 1873 along Lake Worth. At the time, the lake area had a population of less than 12 people. By 1877, the Tustenegee Post Office was established in modern-day Palm Beach, becoming the lake area's first post office. Along the coast of Palm Beach, the Providencia wrecked in 1878 with a cargo of 20,000 coconuts, which were quickly planted. In 1880, Elisha Newton "Cap" Dimick converted his private residence to a hotel known as the Cocoanut Grove House. At the time of its opening, the Cocoanut Grove House was the only hotel along Florida's east coast between Titusville and Key West. The hotel would be destroyed by a fire in October 1893. The Star Route, also known as the Barefoot mailman route, began serving the area in 1885. Carriers would deliver mail by foot or boat from Palm Beach and other nearby communities to as far south as Miami, a round trip distance of 136 miles (219 km). The first schoolhouse in southeast Florida (also known as the Little Red Schoolhouse) opened in Palm Beach in 1886.Henry Flagler, a Standard Oil tycoon, made his first visit to Palm Beach in 1893 and described the area as a "veritable paradise." That same year, Flagler hired George W. Potter to plot 48-blocks for West Palm Beach – a city to house workers at his hotels – and construction began on the Royal Poinciana Hotel. The Royal Poinciana Hotel opened for business on February 11, 1894. Flagler, also owner of the Florida East Coast Railway, extended the railroad southward to West Palm Beach by the following month. In 1896, Flagler opened a second hotel originally known as Wayside Inn, before being renamed Palm Beach Inn, and later becoming The Breakers. Fires would later burn down the hotel in 1903 and 1925, but it would be rebuilt twice. The Palm Beach Daily News began publication in 1897 originally under the name Daily Lake Worth News.The first pedestrian bridge across the Intracoastal Waterway opened near the modern-day Flagler Bridge in 1901, replacing the original railroad spur. Flagler's house lots were bought by the beneficiaries of the Gilded Age, and in 1902 Flagler himself built a Beaux-Arts mansion, Whitehall, designed by the New York-based firm Carrère and Hastings and helped establish the Palm Beach "winter season". Telephone service was established in Palm Beach in 1908, with 18 customers initially. Prior to the 1910s, many African Americans in the area lived in a segregated section of Palm Beach called the "Styx", with an estimated population of 2,000 at its peak. However, between 1910 and 1912, African Americans were evicted from the Styx. Most of the displaced residents relocated to the northern West Palm Beach neighborhoods of Freshwater, Northwest, and Pleasant City.

In January 1911, it became known that West Palm Beach intended to annex the island of Palm Beach in the upcoming Florida Legislative session. Residents objected and hired an attorney from Miami to officially become incorporated. Dimick, Louis Semple Clarke, and 31 other male property owners congregated at Clarke's house and signed a charter to officially incorporate the town of Palm Beach on April 17, 1911. Dimick became the first mayor, John McKenna became town clerk, and Joseph Borman became town marshal, while J. B. Donnelly, William Fremd, John Doe, Enoch Root, and J.J. Ryman served as the first council members. Also in 1911, Dimick built the Royal Park Bridge, with its first incarnation being a wooden structure. Passage from West Palm Beach to Palm Beach on the bridge originally required a toll – 25 cents per vehicle and 5 cents per pedestrian.Between 1919 and 1924, American resort architect Addison Mizner designed 67 structures in Palm Beach. Some of Mizner's clients included Anthony Joseph Drexel Biddle Jr., Paul Moore Sr., Gurnee Munn, John Shaffer Phipps, Edward Shearson, Eva Stotesbury. Rodman Wanamaker, and Barclay Harding Warburton II. His designed works included the Costa Bella, El Mirasol, Everglades Club (in collaboration with Paris Singer), El Solano, La Bellucia, La Querida, Via Mizner, Villa Flora, and William Gray Warden House. Via Mizner was the first shopping complex along Worth Avenue, which was then a mostly residential street. In February 1924, the town council allotted $100,000 toward construction of a new municipal building. Harvey and Clarke architectural firm designed the building, while Newlon and Stephens constructed the structure after bidding $160,200 for the contract. The Palm Beach Town Hall opened on December 18, 1925, and is still used for town council meetings. Prior to its completion, the council meetings were held in one story wooden building on Royal Poinciana Way. Also in 1925, citywide construction revenue reached $14 million, attributed to Florida land boom. The 1928 Okeechobee hurricane made landfall in the town of Palm Beach with sustained winds of 145 mph (235 km/h). High winds and storm surge caused damage to 610 businesses, 60 homes, and 10 hotels, as well as to the Public Service Corporation and Ocean Boulevard. Damage in 1928 USD totaled $10 million in Palm Beach.

The population of Palm Beach grew from 1,707 in 1930 to 3,747 in 1940, a 119.5 percent increase. The Royal Poinciana Hotel, damaged heavily in the 1928 hurricane, also suffered greatly during the Great Depression, and was demolished in 1935. Around 4,000 people purchased the salvageable remains of the hotel. The Palm Beach-Post Times estimated that some 500 homes could be built from the scraps of the hotel. Residents of Palm Beach established the Society of the Four Arts on January 14, 1936, with Hugh Dillman becoming the first president. The 1930s decade also saw the construction of the Flagler Memorial Bridge, the northernmost bridge linking Palm Beach and West Palm Beach, completed on July 1, 1938. Palm Beach mayor James M. Owens acted as master of ceremonies for the bridge's opening, while then-U.S. senator Charles O. Andrews and former U.S. senator Scott Loftin gave speeches during the event.Early in World War II, the United States Army established a Ranger camp at the northern tip of the island, which could accommodate 200 men. The Palm Beach Civilian Defense Council ordered blackouts in Palm Beach beginning on April 11, 1942. Throughout the war, German U-boats sank twenty-four ships offshore Florida, with eight capsized offshore Palm Beach County between February and May 1942. The Army converted The Breakers into the Ream General Army Hospital, while the Navy converted the Palm Beach Biltmore Hotel into a U.S. Naval Special Hospital. On September 15, 1950, the Southern Boulevard Bridge opened, the third and southernmost bridge linking Palm Beach and West Palm Beach. Residents of Palm Beach elected Claude Dimick Reese (son of former mayor T.T. Reese and grandson of Dimick) as mayor in 1953. He became the only native-born mayor of Palm Beach in its history. In the 1950s, the town's population grew approximately 55.8%, from 3,866 in 1950 to 6,055 in 1960.

John F. Kennedy was elected President of the United States in 1960 and selected La Querida as his Winter White House, which his father bought in 1933. In December 1960, police in Palm Beach averted a retired postal worker's attempt to assassinate then president-elect Kennedy. The president would also spend the last weekend of his life in Palm Beach, several days before his assassination in November 1963. Yvelyne "Deedy" Marix became the first woman elected to the town council in February 1970 and later became the first woman elected mayor of Palm Beach in 1983. Between 1971 and 1977, Earl E.T. Smith served as mayor of Palm Beach. He was previously an Ambassador of the United States to Cuba. Preservationist Barbara Hoffstot published a book titled "Landmark Architecture in Palm Beach" in 1974. She  personally photographed and summarized many older buildings in the town. The book also called for more awareness of and improvements to a system for protecting historic landmarks. The town council responded in 1979 by approving an ordinance establishing the Landmarks Preservation Commission, which identifies and works to protect historic structures.General Foods and Post Cereals heiress Marjorie Merriweather Post bequeathed Mar-a-Lago to the United States upon her death in 1973, hoping it would be used as a Winter White House. The residence would be returned to the Post family in 1981, before being purchased by then-businessman Donald Trump in 1985 for approximately $10 million. He would convert the estate into a club by 1995 and has used Mar-a-Lago as a Winter White House since the beginning of his presidency in 2017. A nor'easter in November 1984 caused the MV Mercedes I to crash into the seawall of Mollie Wilmot's estate. Wilmot's staff served the 10 sailors sandwiches and freshly brewed coffee in her gazebo and offered martinis to journalists reporting on the incident.On October 31, 1991, the Perfect Storm produced waves 20 feet (6.1 m) in height in Palm Beach. About 1,200 feet (370 m) of seawall at Worth Avenue was destroyed, while some parts of the town experienced coastal flooding, especially along Ocean Boulevard. By that afternoon, police allowed only residents to enter the town. The trial of William Kennedy Smith, a member of the Kennedy family, drew international media attention in 1991. Smith had been accused of committing rape at La Querida, but a trial at the Palm Beach County Court resulted in his acquittal on December 11, 1991. Another notable mayor, Paul Ilyinsky, son of Grand Duke Dmitri Pavlovich of Russia and heiress Audrey Emery, was elected to the office in February 1993. The town's population peaked at 10,468 people in the 2000 census. In March 2005, the Palm Beach Police Department – under the guidance of Police Chief Michael Reiter – began the first inquiry into the crimes committed by infamous sex trafficker Jeffrey Epstein, leading to his arrest and indictment in July 2006. Despite an FBI investigation discovering at least 40 victims, the State Attorney of Palm Beach County would only charge Epstein with soliciting a prostitute and soliciting a minor for prostitution in June 2008. He plead guilty on both counts and received a controversial plea deal.The town had a population of 8,348 people in 2010, a decrease of 20.3 percent from the previous census. Palm Beach celebrated its centennial on April 17, 2011. Approximately 1,200 people attended a parade, with the parade route beginning at the Flagler Museum (Whitehall). Between February and December 2015, the Town Square, which includes the Addison Mizner Memorial Fountain and the town hall, underwent a $5.7 million restoration. The fountain's restoration would be named "project of the year" by the American Public Works Association's Florida chapter.


=== Name ===
The January 1878 wreck of the Providencia is credited with giving Palm Beach its name. The Providencia was traveling from Havana to Cádiz, Spain, with a cargo of coconuts harvested in the Crown Colony of Trinidad and Tobago in the British West Indies, when the ship wrecked near Palm Beach. Many of the coconut naturalized or were planted along the Palm Beach coast. A lush grove of palm trees soon grew on what would later be named Palm Beach.


== Geography ==

Palm Beach is one of the easternmost towns in Florida, though the state's easternmost point is located in Palm Beach Shores, just north of Lake Worth Inlet. The town is located on an 18-mile (29 km) long barrier island between the Intracoastal Waterway (locally known as the Lake Worth Lagoon) on the west and the Atlantic Ocean on the east. At no point is the island wider than three-quarters of a mile (1.2 km), and in places it is only 500 feet (150 m) wide. The northern boundary of Palm Beach is the Lake Worth Inlet, though it adjoined with Singer Island until the permanent dredging of the inlet in 1918. To the south, a section of Lake Worth Beach occupies the island in the vicinity of State Road 802, though an exclave of Palm Beach extends farther southward until the northern limits of South Palm Beach. According to the U.S. Census Bureau, the town has a total area of approximately 8.12 sq mi (21.0 km2), with land accounting for approximately 4.20 sq mi (10.9 km2) and water covering the remaining 3.92 sq mi (10.2 km2). The average elevation of the town is 7 ft (2.1 m); the highest point is 30 ft (9.1 m) above sea level on the golf course at the Palm Beach Country Club.Geologically, the island is a sand-covered ridge of coquina rock. In the pre-settlement period, the island was environmentally characterized with a pronounced coastal ridge bordering the Atlantic Ocean. The Intracoastal Waterway coast was primarily low-lying and swampy; marshly sloughs generally lay between the two features, though an oolitic limestone ridge stood along some parts of the island's westward side. Since 1883, the environment has been significantly altered by developing land, the filling of the sloughs, and a receding coastline due to erosion. However, the Atlantic ridge is still the dominating topographical feature of the island and acts as a seaward barrier. The former slough areas are flood prone.The town and entire barrier island are located within Evacuation Zone B and evacuations are often ordered if a hurricane is forecast to impact the area, mostly recently in anticipation of Hurricane Dorian in 2019. Palm Beach town officials may deploy law enforcement officers to strategically place roadblocks to limit access to the island during unsafe conditions.As of 2016, land use of the town is 60% residential, 13% rights-of-way, 10% private group uses, 3% recreational, 3% commercial, 2% public uses, 1% hotels (not including The Breakers), and less than 1% conservation, while The Breakers is a planned unit development accounting for 6% of land use. The remaining 2% of land was vacant. Palm Beach does not have any land dedicated to agricultural or industrial purposes. The town is essentially built-out and cannot extend its boundaries.Conservation is mainly confined to Bingham Island, Fishermen's Island, and Hunter's Island. Functioning as bird sanctuaries and rookeries, the islands are leased by the National Audubon Society, though State Trustees of the Internal Improvement Fund and the Blossom Estate holds the titles to the islands. A part of Blossom Estate Subdivision just south of Southern Boulevard is also designated a conservation area.


=== Climate ===
According to the Köppen climate classification, Palm Beach has a tropical savanna climate with hot, humid summers and warm, dry winters. The annual average precipitation is 62.3 in (1,580 mm), most of which occurs during the summer season from May through October. In the wet summer season, short-lived heavy afternoon thunderstorms are common. Palm Beach reports more than 2,900 hours of sunshine annually. Although tropical cyclones can impact Palm Beach, strikes are rare, with the last direct hit in 1928.The wet season is from May to October, when convective thunderstorms and downpours are common. Average high temperatures in Palm Beach are 83 to 91 °F (28 to 33 °C) with lows of 68 to 76 °F (20 to 24 °C), though low temperatures at or above 80 °F (27 °C) are not uncommon. During this period, more than half of the summer days bring occasional afternoon thunderstorms and seabreezes that somewhat cool the rest of the day. The winter brings dry, sunny, and much less humid weather. Between December and February, average high temperatures range from 74 to 82 °F (23 to 28 °C) and low temperatures average between 57 and 68 °F (14 and 20 °C). High temperatures occasionally drop below 70 °F (21 °C), while at other times highs occasionally reach 90 °F (32 °C) in mid-winter. The highest recorded temperature, 101 °F (38 °C), occurred on July 21, 1941, while the lowest observed temperature, 24 °F (−4 °C), occurred on December 29, 1894. In some years, the dry season can become quite dry, and water restrictions are imposed.


== Demographics ==
Palm Beach ranks as the 16th largest municipality in Palm Beach County in terms of population, with 8,816 permanent residents according to 2019 estimates by the United States Census Bureau. The town's peaked at 10,468 people in the 2000 census but fell by 20.3% to 8,348 people in 2010. However, during the "winter season", defined as November through April, the population of Palm Beach swells to approximately 25,000. The town's affluence and its recreational facilities, shops, restaurants, social scene, and "community-oriented sensibility" were cited when it was selected in June 2003 as America's "Best Place to Live" by Robb Report magazine.Between 2014 and 2018, the median household income in Palm Beach was $133,026, more than twice the county mean of $59,943 and the state average of $53,267. Per capita income over the same time period in Palm Beach was $178,568, far higher than the county average of $37,998 and the state average of $30,197. Palm Beach ranked as the 27th-wealthiest place in the United States in 2016 according to Bloomberg News. In the following year, Forbes reported that the town had 30-plus billionaires. Palm Beach also has a considerably smaller percentage of minority populations in comparison to the county and state averages. Estimates in 2018 by the American Community Survey indicated that 92.9% of the town's population was non-Hispanic white, versus 54.1% for Palm Beach County and 53.5% for Florida.


=== 2010 census ===
As of the 2010 census, there were 8,348 people, 4,799 households, and 2,453 families residing in the town. The population density was 1,997.6 inhabitants per square mile (771.3/km2). There were 9,091 housing units at an average density of 2,164.5 inhabitants per square mile (835.7/km2). The racial makeup of the city was 97.4% White, 0.6% African American, less than 0.1% Native American, 1.0% Asian, less than 0.1% Pacific Islander, 0.5% from other races, and 0.5% from two or more races. Hispanic or Latino of any race were 3.9% of the population.Over half the population of the town (55.8%) were 65 years of age or older, with a median age of 67.4 years. Approximately 6.9% were under the age of 18, 4.9% were from 18 to 24, 4.6% were from 25 to 44, and 27.8% from 45 to 64. For every 100 males, there were 123 females. For every 100 males age 18 and over, there were 125.8 females. Around 9.4% of the households in 2010 had children under the age of 18 living with them, 27.2% were married couples living together, 2.7% had a female householder with no spouse present, and 47.8% were non-families. About 48.9% of all households were made up of individuals, and 65.8% had someone living alone who was 65 years of age or older. The average household size was 1.74 and the average family size was 2.28.


=== 2000 census ===
As of the 2000 census, there were 10,468 people, 5,789 households, and 3,022 families residing in the town. The population density was 2,669.2 inhabitants per square mile (1,030.6/km2). There were 9,948 housing units at an average density of 2,368.6 per square mile (914.5/km2). The racial makeup of the city was 96% White, 2.6% African American, less than 0.1% Native American, 0.5% Asian, less than 0.1% Pacific Islander, 0.2% from other races, and 0.6% from two or more races. Hispanic or Latino of any race were 2.6% of the population.Over half the population of the town (52.7%) were 65 years of age or older, with a median age of 67 years. About 9.4% were under the age of 18, 1.5% were from 18 to 24, 11.5% were from 25 to 44, and 25.0% from 45 to 64. For every 100 females, there were 79.3 males. For every 100 females age 18 and over, there were 77.0 males. Approximately 7.7% of the households in 2000 had children under the age of 18 living with them, 48.1% were married couples living together, 3.3% had a female householder with no spouse present, and 47.8% were non-families. About 42.6% of all households were made up of individuals, and 66.0% had someone living alone who was 65 years of age or older. The average household size was 1.81 and the average family size was 2.38.English was the first language of 87.81% of all residents in 2000, while French comprised 4.48%, Spanish consisted of 3.65%, German made up 2.16%, Italian speakers made up 0.45%, Yiddish made up 0.36%, Russian was at 0.30%, Arabic and Swedish at 0.25%, and Polish was the mother tongue of 0.24% of the population.Palm Beach had the 40th highest percentage of Russian residents in the United States in 2010, with 10.30% of the populace – tied with Pomona, New York, and the township of Lower Merion, Pennsylvania. It also had the 26th highest percentage of Austrian residents in the United States, at 2.10% of the town's population, tied with 19 other municipalities in the United States.In 2000, the household income for the town was $109,219. Males had a median income of $71,685 versus $42,875 for females. 5.3% of the population and 2.4% of families were below the poverty line. 4.6% of those under the age of 18 and 2.9% of those 65 and older were living below the poverty line. Palm Beach had a median household income of $124,562 and a median family income of $137,867.


== Economy ==

In 2018, the town of Palm Beach had an estimated labor force of 2,788 people. Palm Beach has an unemployment rate of just 2.3%, although 66% of the town's population is not in the labor force. The most common professions among the town's labor force are finance, insurance, real estate, rental, and leasing (24.1%); professional, scientific, management, administrative, and waste management services (23.6%); retail (12.2%); and educational services, health care, and social assistance (10.5%). However, as of 2017, only 4.1% of jobs in Palm Beach were held by residents of the town, with the most common other home destinations being West Palm Beach (15.4%), Palm Beach Gardens (3.9%), Lake Worth Beach (3.7%), Wellington (3.3%), and Greenacres (3.1%).Tourism is a major industry in the town, bringing in approximately $5 billion in annual revenue. Palm Beach has several historical and luxurious hotels and lodgings, most notably The Brazilian Court, The Breakers, the Palm Beach Hotel (now the Palm Beach Hotel Condominium), the Tideline Ocean Resort & Spa, and the Vineta Hotel. The Breakers alone employs more than 2,200 people from around the world. The town of Palm Beach also contains Worth Avenue, an upscale shopping and dining district. Known for selling high-quality merchandise since the 1920s, Worth Avenue includes about 250 high-end shops, boutiques, restaurants, and art galleries. Other commercial districts of note include Royal Poinciana Plaza and Royal Poinciana Way Historic District, with the latter being listed on the National Register of Historic Places in 2015 due to its status as "the town's original Main Street", as noted by the Palm Beach Daily News.


== Arts and events ==

