Paltan (transl. Platoon; Hindi pronunciation: [pəlʈən]) is a 2018 Indian Hindi-language action-war film written, directed and produced by J. P. Dutta, based on 1967 Nathu La and Cho La clashes along the Sikkim border after 1962 Sino-Indian War. It stars an ensemble cast with Jackie Shroff, Arjun Rampal, Sonu Sood, Harshvardhan Rane, Esha Gupta, Sonal Chauhan and many more. The film was theatrically released on 7 September 2018 .


== Plot ==
The Film is Based on Clashes between Indian and Chinese Troops in the regions of Nathu La and Cho La in 1967 where Indian troops defeated Chinese Troops and stopped their attempts to encroach on Indian territory.


== Cast ==
Jackie Shroff as Maj. General Sagat Singh, General Officer Commanding (GOC) 17 Mountain Division
Arjun Rampal as Lt. Col. Raj Singh Yadav, CO 2 Grenadiers
Sonu Sood as Maj. Bishen Singh, 2IC 2 Grenadiers
Gurmeet Choudhary as Capt. Prithi Singh Dagar, 2 Grenadiers
Abhilash Chaudhary as Hav. Lakshmi Chand, 2 Grenadiers
Harshvardhan Rane as Maj. Harbhajan Singh, 18 Rajput Regiment now 13 Mechanised Infantry
Siddhanth Kapoor as Hawaldar Parashar, Intelligence Corps
Luv Sinha as Second Lieutenant Attar Singh, 2 Grenadiers
Rohit Roy as Maj. Cheema, Corps of Engineers
Abdul Quadir Amin as Army Officer 
Abhilash Chaudhary as Hawaldar Lakhmi Chand Yadav, 2 Grenadiers
Nagender Choudhary as Nb.Sub. Raghav Prasad Pandey, 18 Rajput Regiment now 13 Mechanized Infantry
Liao Sheng Hua Nelson as Chinese Commissar
Allan Liao Kuo Chi as Chinese Officer
Bijou Thaangjam as Chinese Soldier
Wolf Rajput as Chinese Major Law King
Chien Ho Liao as a Chinese Soldier
Esha Gupta as Lt. Col. Rai Singh Yadav’s wife
Sonal Chauhan as Maj. Bishen Singh's wife
Monica Gill as Harjot Kaur, Maj. Harbhajan Singh's girlfriend
Dipika Kakkar as Capt. Prithvi Singh Dagar's fiance
Athar Siddiqui as Indian soldier


== Soundtrack ==
The background score of the film is composed by Sanjoy Chowdhury and songs are composed by Anu Malik. The lyrics are written by Javed Akhtar. The first song "Paltan Title Track" was released on 13 August 2018. The second song "Raat Kitni" was released on 21 August 2018.
The music in the Paltan song is borrowed from the theme music of iconic 1957 hollywood blockbuster The Bridge on the River Kwai.


== Reception ==
The movie received very good reviews from the families of the soldiers who participated in the war who thanked J P Dutta, the film producer for presenting the life story of the unsung army officers.The movie also received very good reviews from army circles and officials from the Defence Ministry of India for revealing the true incidents from the lesser known battle of 1967 war at the Sikkim border.Audience and critics found the film's execution largely ineffective for a war film with caricature characters and extremely long runtime.  Ronak Kotecha of The Times of India gave it 3/5 stars calling it a long-drawn war-drama that picks up only during the final moments.


== References ==


== External links ==
Paltan on IMDb
Paltan at Bollywood Hungama