Éamon de Valera ( AY-mən DEV-ə-LAIR-ə, -⁠LEER-, Irish: [ˈeːmˠən̪ˠ dʲɛ ˈvˠalʲəɾʲə]; first registered as George de Valero; changed some time before 1901 to Edward de Valera; 14 October 1882 – 29 August 1975) was a prominent statesman and political leader in 20th-century Ireland, serving several terms as head of government and head of state, with a prominent role introducing the Constitution of Ireland.Prior to de Valera's political career, he was a commandant at Boland's Mill during the 1916 Easter Rising. He was arrested, sentenced to death but released for a variety of reasons, including the public response to the British execution of Rising leaders. He returned to Ireland after being jailed in England and became one of the leading political figures of the War of Independence. After the signing of the Anglo-Irish Treaty, de Valera served as the political leader of Anti-Treaty Sinn Féin until 1926, when he, along with many supporters, left the party to set up Fianna Fáil, a new political party which abandoned the policy of abstentionism from Dáil Éireann.
From there, de Valera went on to be at the forefront of Irish politics until the turn of the 1960s. He took over as President of the Executive Council from W. T. Cosgrave and later Taoiseach, with the passing of the Constitution of Ireland in 1937. He served as Taoiseach on three different occasions; from 1937 to 1948, from 1951 to 1954 and finally from 1957 to 1959. He remains the longest serving Taoiseach by total days served in the post. He resigned in 1959 upon his election as President of Ireland. By then, he had been Leader of Fianna Fáil for 33 years, and he, along with older founding members, began to take a less prominent role relative to newer ministers such as Jack Lynch, Charles Haughey and Neil Blaney. He would serve as President of Ireland from 1959 to 1973, two full terms in office.
De Valera's political beliefs evolved from militant Irish republicanism to strong social, cultural and fiscal conservatism. He has been characterised by a stern, unbending, devious demeanour. His roles in the Civil War have also portrayed him as a divisive figure in Irish history. Biographer Tim Pat Coogan sees his time in power as being characterised by economic and cultural stagnation, while Diarmaid Ferriter argues that the stereotype of de Valera as an austere, cold and even backward figure was largely manufactured in the 1960s and is misguided.


== Early life ==
Éamon de Valera was born on 14 October 1882 in New York City, the son of Catherine Coll, who was originally from Bruree, County Limerick, and Juan Vivion de Valera, described on the birth certificate as a Spanish artist born in 1853 in the Basque Country, Spain. He was born at the Nursery and Child's Hospital, Lexington Avenue, a home for destitute orphans and abandoned children. His parents were reportedly married on 18 September 1881 at St Patrick's Church in Jersey City, New Jersey, but archivists have not located any marriage certificate or any birth, baptismal, or death certificate information for anyone called Juan Vivion de Valera (nor for "de Valeros", an alternative spelling). On de Valera's original birth certificate, his name is given as George de Valero and his father is listed as Vivion de Valero. Although he was known as Edward de Valera before 1901, a fresh birth certificate was issued in 1910, in which his first name was officially changed to Edward and his father's surname given as "de Valera". As a child, he was known as "Eddie" or "Eddy".According to Coll, Juan Vivion died in 1885 leaving Coll and her child in poor circumstances. Éamon was taken to Ireland by his uncle Ned at the age of two. When his mother remarried in the mid-1880s, he was not brought back to live with her, but was reared by his grandmother, Elizabeth Coll, her son Patrick and her daughter Hannie, in Bruree, County Limerick. He was educated locally at Bruree National School, County Limerick and C.B.S. Charleville, County Cork. Aged sixteen, he won a scholarship. He was not successful in enrolling at two colleges in Limerick, but was accepted at Blackrock College, Dublin, at the instigation of his local curate.He played rugby at Blackrock and Rockwell College, then for the Munster rugby team around 1905. He remained a lifelong devotee of rugby, attending international matches even towards the end of his life when he was nearly blind.At the end of his first year at Blackrock College he was student of the year. He also won further scholarships and exhibitions and in 1903 was appointed teacher of mathematics at Rockwell College, County Tipperary. It was here that de Valera was first given the nickname "Dev" by a teaching colleague, Tom O'Donnell. In 1904, he graduated in mathematics from the Royal University of Ireland. He then studied for a year at Trinity College Dublin but, owing to the necessity of earning a living, did not proceed further and returned to teaching, this time at Belvedere College. In 1906, he secured a post as a teacher of mathematics at Carysfort Teachers' Training College for women in Blackrock, Dublin. His applications for professorships in colleges of the National University of Ireland were unsuccessful, but he obtained a part-time appointment at Maynooth and also taught mathematics at various Dublin schools, including Castleknock College (1910–1911; under the name Edward de Valera) and Belvedere College.There were occasions when de Valera seriously contemplated the religious life like his half-brother, Fr. Thomas Wheelwright, but ultimately he did not pursue this vocation. As late as 1906, when he was 24 years old, he approached the President of Clonliffe Seminary in Dublin for advice on his vocation. De Valera was throughout his life portrayed as a deeply religious man, and in death asked to be buried in a religious habit. His biographer, Tim Pat Coogan, speculated that questions surrounding de Valera's legitimacy may have been a deciding factor in his not entering religious life. Being illegitimate would have been a bar to receiving priestly orders, but not to becoming a lay member of a religious order.As a young Gaeilgeoir (Irish speaker), de Valera became an activist for the Irish language. In 1908, he joined the Árdchraobh of Conradh na Gaeilge (the Gaelic League), where he met Sinéad Flanagan, a teacher by profession and four years his senior. They were married on 8 January 1910 at St Paul's Church, Arran Quay, Dublin.
The couple had five sons: Vivion (1910–1982), Éamon (1913–1986), Brian (1915–1936), Rúaidhrí (1916–1978), and Terence (Terry; 1922–2007); and two daughters: Máirín (1912–1984) and Emer (1918–2012). Brian de Valera predeceased his parents.


=== Early political activity ===

While he was already involved in the Gaelic Revival, de Valera's involvement in the political revolution began on 25 November 1913, when he joined the Irish Volunteers. The organisation was formed to oppose the Ulster Volunteers and ensure the enactment of the Irish Parliamentary Party's Third Home Rule Act won by its leader John Redmond. After the outbreak of World War I in August 1914, de Valera rose through the ranks and it was not long before he was elected captain of the Donnybrook branch. Preparations were pushed ahead for an armed revolt, and he was made commandant of the Third Battalion and adjutant of the Dublin Brigade. He took part in the Howth gun-running. He was sworn by Thomas MacDonagh into the oath-bound Irish Republican Brotherhood, which secretly controlled the central executive of the Volunteers. He opposed secret societies, but this was the only way he could be guaranteed full information on plans for the Rising.


== Revolutionary years ==


=== 1916 Easter Rising ===

On 24 April 1916, the Easter Rising began. Forces commanded by de Valera occupied Boland's Mill on Grand Canal Street in Dublin. His chief task was to cover the southeastern approaches to the city. After a week of fighting, the order came from Pádraig Pearse to surrender. De Valera was court-martialled, convicted, and sentenced to death, but the sentence was immediately commuted to penal servitude for life.
De Valera was among the few republican leaders the British did not execute. It has been argued that his life was saved by four facts. First, he was one of the last to surrender and he was held in a different prison from other leaders, thus his execution was delayed by practicalities. Second, the US Consulate in Dublin made representations before his trial (i.e., was he actually a United States citizen and if so, how would the United States react to the execution of one of its citizens?) while the full legal situation was clarified. The UK was trying to bring the US into the war in Europe at the time, and the Irish American vote was important in US politics. Third, when Lt-Gen Sir John Maxwell reviewed his case he said, "Who is he? I haven't heard of him before. I wonder would he be likely to make trouble in the future?" On being told that de Valera was unimportant, he commuted the court-martial's death sentence to life imprisonment. De Valera had no Fenian family or personal background and his MI5 file in 1916 was very slim, detailing only his open membership in the Irish Volunteers. Fourth, by the time de Valera was court-martialled on 8 May, political pressure was being brought to bear on Maxwell to halt the executions; Maxwell had already told British Prime Minister H. H. Asquith that only two more were to be executed, Seán Mac Diarmada and James Connolly, although they were court-martialled the day after de Valera. His late trial, representations made by the American Consulate, his lack of Fenian background and political pressure all combined to save his life, though had he been tried a week earlier he would probably have been shot.

De Valera's supporters and detractors argue about his bravery during the Easter Rising. His supporters claim he showed leadership skills and a capacity for meticulous planning. His detractors claim he suffered a nervous breakdown during the Rising. According to accounts from 1916, de Valera was seen running about, giving conflicting orders, refusing to sleep and on one occasion, having forgotten the password, almost getting himself shot in the dark by his own men. According to one account, de Valera, on being forced to sleep by one subordinate who promised to sit beside him and wake him if he was needed, suddenly woke up, his eyes "wild", screaming, "Set fire to the railway! Set fire to the railway!" Later in the Ballykinlar internment Camp, one de Valera loyalist approached another internee, a medical doctor, recounted the story, and asked for a medical opinion as to de Valera's condition. He also threatened to sue the doctor, future Fine Gael TD and Minister, Dr. Tom O'Higgins, if he ever repeated the story. The British reportedly, however, considered de Valera's forces the best-trained and best-led among the rebels. De Valera's latest biographer, Anthony J. Jordan, writes of this controversy, "Whatever happened in Boland's Mills, or any other garrison, does not negate or undermine in any way the extraordinary heroism of "Dev" and his comrades".After imprisonment in Dartmoor, Maidstone and Lewes prisons, de Valera and his comrades were released under an amnesty in June 1917. On 10 July 1917, he was elected a member of parliament (MP) for East Clare (the constituency which he represented until 1959) in a by-election caused by the death of the previous incumbent Willie Redmond, brother of the Irish Party leader John Redmond who had died fighting in World War I. In the 1918 general election he was elected both for that seat and Mayo East. But because most other Irish rebellion leaders were dead, in 1917 he was elected President of Sinn Féin, the party which had been blamed incorrectly for provoking the Easter Rising. This party became the political vehicle through which the survivors of the Easter Rising channelled their republican ethos and objectives. The previous President of Sinn Féin, Arthur Griffith, had championed an Anglo-Irish dual-monarchy based on the Austro-Hungarian model, with independent legislatures for both Ireland and Britain.


=== President of Dáil Éireann ===

Sinn Féin won a huge majority in the 1918 general election, largely thanks to the British executions of the 1916 leaders, the threat of conscription with the Conscription Crisis of 1918 and the first-past-the-post ballot. They won 73 out of 105 Irish seats, with about 47% of votes cast. 25 seats were uncontested. On 21 January 1919, 27 Sinn Féin MPs (the rest were imprisoned or impaired), calling themselves Teachtaí Dála (TDs), assembled in the Mansion House in Dublin and formed an Irish parliament, known as Dáil Éireann (translatable into English as the Assembly of Ireland). The Ministry of Dáil Éireann was formed, under the leadership of the Príomh Aire (also called President of Dáil Éireann) Cathal Brugha. De Valera had been re-arrested in May 1918 and imprisoned and so could not attend the January session of the Dáil. He escaped from Lincoln Gaol, England in February 1919. As a result, he replaced Brugha as Príomh Aire in the April session of Dáil Éireann.
In the hope of securing international recognition, Seán T. O'Kelly was sent as envoy to Paris to present the Irish case to the Peace Conference convened by the great powers at the end of World War I. When it became clear by May 1919 that this mission could not succeed, de Valera decided to visit the United States. The mission had three objectives: to ask for official recognition of the Irish Republic, to float a loan to finance the work of the Government (and by extension, the Irish Republican Army), and to secure the support of the American people for the republic. His visit lasted from June 1919 to December 1920 and had mixed success, including a visit to Fenway Park in Boston in front of 50,000 supporters. One negative outcome was the splitting of the Irish-American organisations into pro- and anti-de Valera factions. He met the young Harvard-educated leader from Puerto Rico, Pedro Albizu Campos, and forged a lasting and useful alliance with him. It was during this American tour that he recruited his long-serving personal secretary, Kathleen O'Connell, an Irish emigrant who would return to Ireland with him.De Valera managed to raise $5,500,000 from American supporters, an amount that far exceeded the hopes of the Dáil. Of this, $500,000 was devoted to the American presidential campaign in 1920, helping him gain wider public support there. In 1921, it was said that $1,466,000 had already been spent, and it is unclear when the net balance arrived in Ireland. Recognition was not forthcoming in the international sphere. He also had difficulties with various Irish-American leaders, such as John Devoy and Judge Daniel F. Cohalan, who resented the dominant position he established, preferring to retain their control over Irish affairs in the United States.
Meanwhile, in Ireland, the conflict between the British authorities and the Dáil (which the British declared illegal in September 1919), escalated into the Irish War of Independence. De Valera left day-to-day government, during his eighteen-month absence in the United States, to Michael Collins, his 29-year-old Minister for Finance. De Valera and Collins would later become opponents during the Irish Civil War.


=== President of the Republic ===

In January 1921, in his first appearance in the Dáil, after his return to a country gripped by the War of Independence, de Valera introduced a motion calling on the IRA to desist from ambushes and other tactics that were allowing the British to successfully portray it as a terrorist group, and to take on the British forces with conventional military methods. This they strongly opposed, and de Valera relented, issuing a statement expressing support for the IRA, and claimed it was fully under the control of the Dáil. He then, along with Cathal Brugha and Austin Stack, brought pressure to bear on Michael Collins to undertake a journey to the United States himself, on the pretext that only he could take up where de Valera had left off. Collins successfully resisted this move and stayed in Ireland. In the elections of May 1921, all candidates in Southern Ireland were returned unopposed, and Sinn Féin secured some seats in Northern Ireland. Following the Truce of July 1921 that ended the war, de Valera went to see Prime Minister David Lloyd George in London on 14 July. No agreement was reached, and by then the Parliament of Northern Ireland had already met. It became clear that neither a republic, nor independence for all 32 counties, was going to be offered; Lloyd George told de Valera he could "put a soldier in Ireland for every man, woman and child in it" if the IRA did not immediately agree to stop fighting. In August 1921, de Valera secured Dáil Éireann approval to change the 1919 Dáil Constitution to upgrade his office from prime minister or chairman of the cabinet to a full President of the Republic. Declaring himself now the Irish equivalent of King George V, he argued that as Irish head of state, in the absence of the British head of state from the negotiations, he too should not attend the peace conference called the Treaty Negotiations (October–December 1921) at which British and Irish government leaders agreed to the effective independence of twenty-six of Ireland's thirty-two counties as the Irish Free State, with Northern Ireland choosing to remain under British sovereignty. It is generally agreed by historians that whatever his motives, it was a mistake for de Valera not to have travelled to London.Having effected these changes, a boundary commission came into place to redraw the Irish border. Nationalists expected its report to recommend that largely nationalist areas become part of the Free State, and many hoped this would make Northern Ireland so small it would not be economically viable. A Council of Ireland was also provided in the Treaty as a model for an eventual all-Irish parliament. Hence neither the pro- nor anti-Treaty sides made many complaints about partition in the Treaty Debates.


=== Anglo-Irish Treaty ===
The Republic's delegates to the Treaty Negotiations were accredited by President de Valera and his cabinet as plenipotentiaries (that is, negotiators with the legal authority to sign a treaty without reference back to the cabinet), but were given secret cabinet instructions by de Valera that required them to return to Dublin before signing the Treaty. The Treaty proved controversial in Ireland insofar as it replaced the Republic by a dominion of the British Commonwealth with the King represented by a Governor-General of the Irish Free State. The Irish delegates Arthur Griffith, Robert Barton, and Michael Collins supported by Erskine Childers as Secretary-General set up their delegation headquarters at 22 Hans Place in Knightsbridge. It was there, at 11.15 am on 5 December 1921, that the decision was made to recommend the Treaty to Dáil Éireann; the Treaty was finally signed by the delegates after further negotiations which closed at 02:20 on 6 December 1921.
De Valera baulked at the agreement. His opponents claimed that he had refused to join the negotiations because he knew what the outcome would be and did not wish to receive the blame. De Valera claimed that he had not gone to the treaty negotiations because he would be better able to control the extremists at home, and that his absence would allow leverage for the plenipotentiaries to refer back to him and not be pressured into any agreements. Because of the secret instructions given to the plenipotentiaries, he reacted to news of the signing of the Treaty not with anger at its contents (which he refused even to read when offered a newspaper report of its contents), but with anger over the fact that they had not consulted him, their president, before signing. His ideal drafts, presented to a secret session of the Dáil during the Treaty Debates and publicised in January 1922, were ingenious compromises but they included dominion status, the Treaty Ports, the fact of partition subject to veto by the parliament in Belfast, and some continuing status for the King as head of the Commonwealth. Ireland's share of the imperial debt was to be paid.After the Treaty was narrowly ratified by 64 to 57, de Valera and a large minority of Sinn Féin TDs left Dáil Éireann. He then resigned and Arthur Griffith was elected President of Dáil Éireann in his place, though respectfully still calling him 'The President'. On a speaking tour of the more republican province of Munster, starting on 17 March 1922, de Valera made controversial speeches at Carrick on Suir, Lismore, Dungarvan and Waterford, saying that: "If the Treaty were accepted, [by the electorate] the fight for freedom would still go on, and the Irish people, instead of fighting foreign soldiers, will have to fight the Irish soldiers of an Irish government set up by Irishmen." At Thurles, several days later, he repeated this imagery and added that the IRA: "..would have to wade through the blood of the soldiers of the Irish Government, and perhaps through that of some members of the Irish Government to get their freedom." In a letter to the Irish Independent on 23 March de Valera accepted the accuracy of their report of his comment about "wading" through blood, but deplored that the newspaper had published it.De Valera objected to the statement of fidelity that the treaty required Irish parliamentarians to take an oath of allegiance to the King. He also was concerned that Ireland could not have an independent foreign policy as part of the British Commonwealth when the British retained several naval ports (see Treaty Ports) around Ireland's coast. As a compromise, de Valera proposed "external association" with the British Empire, which would leave Ireland's foreign policy in her own hands and a republican constitution with no mention of the British monarch (he proposed this as early as April, well before the negotiations began, under the title "Document No. 2"). Michael Collins was prepared to accept this formula and the two wings (pro- and anti-Treaty) of Sinn Féin formed a pact to fight the 1922 Irish general election together and form a coalition government afterwards. Collins later called off the pact on the eve of the election. De Valera's opponents won the election and civil war broke out shortly afterwards in late June 1922.


=== Civil War ===

Relations between the new Irish government, which was backed by most of the Dáil and the electorate, and the anti-Treatyites under the nominal leadership of de Valera, now descended into the Irish Civil War (June 1922 to May 1923), in which the pro-treaty Free State forces defeated the anti-Treaty IRA. Both sides had wanted to avoid civil war, but fighting broke out over the takeover of the Four Courts in Dublin by anti-Treaty members of the IRA. These men were not loyal to de Valera and initially were not even supported by the executive of the anti-Treaty IRA. However, Michael Collins was forced to act against them when Winston Churchill threatened to re-occupy the country with British troops unless action was taken. When fighting broke out in Dublin between the Four Courts garrison and the new Free State Army, republicans backed the IRA men in the Four Courts and civil war broke out. De Valera, though he held no military position, backed the anti-Treaty IRA or "Irregulars" and said that he was re-enlisting in the IRA as an ordinary volunteer. On 8 September 1922, he met in secret with Richard Mulcahy in Dublin to try to halt the fighting. However, according to de Valera, they "could not find a basis" for agreement.Though nominally head of the anti-Treatyites, de Valera had little influence. He does not seem to have been involved in any fighting and had little or no influence with the military republican leadership – headed by IRA Chief of Staff, Liam Lynch. De Valera and the anti-Treaty TDs formed a "republican government" on 25 October 1922 from anti-Treaty TDs to "be temporarily the Supreme Executive of the Republic and the State, until such time as the elected Parliament of the Republic can freely assemble, or the people being rid of external aggression are at liberty to decide freely how they are to be governed". However, it had no real authority and was a pale shadow of the republican Dáil government of 1919–21, which had provided an alternative government to the British administration.
