In March 1923, de Valera attended the meeting of the IRA Army Executive to decide on the future of the war. He was known to be in favour of a truce but he had no voting rights and it was narrowly decided to continue hostilities. The leader of the Free State, W. T. Cosgrave, insisted that there could be no acceptance of a surrender without disarming.On 30 May 1923, the IRA's new Chief of Staff Frank Aiken (Lynch had been killed) called a ceasefire and ordered volunteers to "dump arms". De Valera, who had wanted an end to the internecine fighting for some time, backed the ceasefire order with a message in which he called the anti-Treaty fighters "the Legion of the Rearguard", saying that "The Republic can no longer be successfully defended by your arms. Further sacrifice on your part would now be in vain and the continuance of the struggle in arms unwise in the national interest and prejudicial to the future of our cause. Military victory must be allowed to rest for the moment with those who have destroyed the Republic. Other means must be sought to safeguard the nation's right."After this point many of the republicans were arrested in Free State round-ups when they had come out of hiding and returned home. De Valera remained in hiding for several months after the ceasefire was declared; however, he emerged in August to stand for election in County Clare. Making a campaign appearance in Ennis on 15 August, de Valera was arrested on the platform and interned at Arbour Hill prison until 1924.


== Founding of Fianna Fáil ==
After the IRA dumped their arms rather than surrender them or continue a now fruitless war, de Valera returned to political methods. In 1924, he was arrested in Newry for "illegally entering Northern Ireland" and held in solitary confinement for a month in Crumlin Road Gaol, Belfast.
During this time, de Valera came to believe that abstentionism was not a workable tactic in the long term. He now believed that a better course would be to try to gain power and turn the Free State from a constitutional monarchy into a republic. He tried to convince Sinn Féin to accept this new line. However, a vote to accept the Free State Constitution (contingent on the abolition of the Oath of Allegiance) narrowly failed. Soon afterwards, de Valera resigned from Sinn Féin and seriously considered leaving politics.
However, one of his colleagues, Seán Lemass, convinced de Valera to found a new republican party. In March 1926, with Lemass, Constance Markievicz and others, de Valera formed a new party, Fianna Fáil (The Warriors of Destiny), a party that was to dominate 20th-century Irish politics. While Sinn Féin still held to an abstentionist line, Fianna Fáil was dedicated to republicanising the Free State from within if it gained power.
Having attracted most of Sinn Féin's branches due to Lemass' organisational skill, the new party made swift electoral gains in the general election on 9 June 1927. In the process, it took much of Sinn Féin's previous support, winning 44 seats to Sinn Féin's five. It refused to take the Oath of Allegiance (portrayed by opponents as an 'Oath of Allegiance to the Crown' but actually an Oath of Allegiance to the Irish Free State with a secondary promise of fidelity to the King in his role in the Treaty settlement).The oath was largely the work of Michael Collins and based on three sources: British oaths in the dominions, the oath of the Irish Republican Brotherhood, and a draft oath prepared by de Valera in his proposed treaty alternative, "Document No. 2"). De Valera began a legal case to challenge the requirement that members of his party take the Oath, but the assassination of the Vice-President of the Executive Council (deputy prime minister) Kevin O'Higgins on 10 July 1927 led the Executive Council under W. T. Cosgrave to introduce a Bill on 20 July requiring all Dáil candidates to promise on oath that if they were elected they would take the Oath of Allegiance. Forced into a corner, and faced with the option of staying outside politics forever or taking the oath and entering, de Valera and his TDs took the Oath of Allegiance on 12 August 1927, though de Valera himself described the Oath as "an empty political formula".De Valera never organised Fianna Fáil in Northern Ireland and it was not until 7 December 2007 that Fianna Fáil was registered there by the UK Electoral Commission.


== President of the Executive Council ==

In the 1932 general election Fianna Fáil secured 72 seats and became the largest party in the Dáil, although without a majority. Some Fianna Fáil members arrived at the first sitting of the new Dáil carrying arms, amid fears that Cumann na nGaedheal would not voluntarily surrender power. However, the transition was peaceful. De Valera was elected President of the Executive Council (Prime Minister) by the Dáil by a vote of 81–68, with the support of the Labour Party and Independent politicians, and took office on 9 March.He at once initiated steps to fulfill his election promises to abolish the oath and withhold land annuities owed to the UK for loans provided under the Irish Land Acts and agreed as part of the 1921 Treaty. This launched the Anglo-Irish Trade War when the UK in retaliation imposed economic sanctions against Irish exports. De Valera responded in kind with levies on British imports. The ensuing "Economic War" lasted until 1938.After De Valera had urged King George V to dismiss McNeill as Governor-General, the King suggested an alternative course of action: that McNeill, instead, carry on a while longer as viceroy and only then resign, which he did on 1 November 1932. Subsequently, a 1916 veteran, Domhnall Ua Buachalla, was appointed Governor-General. To strengthen his position against the opposition in the Dáil and Seanad, de Valera directed the Governor-General to call a snap election in January 1933 and de Valera's party won 77 seats, giving Fianna Fáil an overall majority. Under de Valera's leadership, Fianna Fáil won further general elections in 1937, 1938, 1943, and 1944.
De Valera took charge of Ireland's foreign policy as well by also acting as Minister for External Affairs. In that capacity, he attended meetings of the League of Nations. He was president of the Council of the League on his first appearance at the league in Geneva, Switzerland, in 1932 and, in a speech that made a worldwide impression, appealed for genuine adherence by its members to the principles of the covenant of the league. In 1934, he supported the admission of the Soviet Union into the league. In September 1938, he was elected nineteenth president of the Assembly of the League, a tribute to the international recognition he had won by his independent stance on world questions.De Valera's government followed the policy of unilaterally dismantling the treaty of 1921. In this way he would be pursuing republican policies and lessening the popularity of republican violence and the IRA. De Valera encouraged IRA members to join the Irish Defence Forces and the Gardaí. He also refused to dismiss from office those Cumann na nGaedheal, Cosgrave supporters, who had previously opposed him during the Civil War. He did, however, dismiss Eoin O'Duffy from his position as Garda Commissioner after a year. Eoin O'Duffy was then invited to be head of the Army Comrades Association (ACA) formed to protect and promote the welfare of its members, previously led by J.F. O'Higgins, Kevin O'Higgins's brother. This organisation was an obstacle to de Valera's power as it supported Cumann na nGaedheal and provided stewards for their meetings. Cumann na nGaedheal meetings were frequently disrupted by Fianna Fáil supporters following the publication of the article: No Free Speech for Traitors by Peadar O'Donnell, an IRA member.
The ACA changed its name to the National Guard under O'Duffy and adopted the uniform of black berets and blue shirts, using the straight-armed salute, and were nicknamed the Blueshirts. They were outwardly fascist and planned a march in August 1933 through Dublin to commemorate Michael Collins, Kevin O'Higgins, and Arthur Griffith. This march struck parallels with Mussolini's march on Rome (1922), in which he had created the image of having toppled the democratic government in Rome. De Valera revived a military tribunal, which had been set up by the previous administration, to deal with the matter. O'Duffy backed down when the National Guard was declared an illegal organisation and the march was banned. Within a few weeks, O'Duffy's followers merged with Cumann na nGaedhael and the Centre Party to form United Ireland, or Fine Gael, and O'Duffy became its leader. Smaller local marches were scheduled for the following weeks, under different names. Internal dissension set in when the party's TDs distanced themselves from O'Duffy's extreme views, and his movement fell asunder.


== Taoiseach (1937–1948) ==
Fianna Fáil having won the 1937 election held the same day as the plebiscite that ratified the constitution, de Valera continued as President of the Executive Council until 29 December 1937, when the new constitution was enacted. On that date, de Valera's post automatically became that of Taoiseach which was a considerably more powerful office. Notably, he could advise the President to dismiss Ministers individually – advice that the President was bound to follow by convention. The old Executive Council had to be dissolved and reformed en bloc if its President wanted to remove a Minister. Additionally, he could request a parliamentary dissolution on his own authority. Previously, the right to seek a dissolution was vested with the Council as a whole.
In social policy, de Valera's first period as Taoiseach saw the introduction (in 1947) of means-tested allowances for people suffering from infectious diseases.


=== Anglo-Irish Trade Agreement ===
With the new constitution in place, de Valera determined that the changed circumstances made swift resolution to Ireland's ongoing trade war with the UK more desirable for both sides — as did the growing probability of the outbreak of war across Europe. In April 1938, de Valera and British Prime Minister Neville Chamberlain signed the Anglo-Irish Trade Agreement, lifting all duties imposed during the previous five years and ending British use of the Treaty Ports it had retained in accordance with the Anglo-Irish Treaty. The return of the ports was of particular significance, since it ensured Irish neutrality during the coming Second World War.


=== Constitution of Ireland ===
During the 1930s, de Valera systematically stripped the Irish Free State constitution – a constitution originally drafted by a committee under the nominal chairmanship of his rival, Michael Collins – of features tying Ireland to the United Kingdom, limiting its independence and the republican character of its state. De Valera was able to carry out this program of constitutional change by taking advantage of three earlier modifications of constitutional arrangements. First, though the 1922 constitution originally required a public plebiscite for any amendment enacted more than eight years after its passage, the Free State government under W. T. Cosgrave had amended that period to sixteen years. This meant that, until 1938, the Free State constitution could be amended by the simple passage of a Constitutional Amendment Act through the Oireachtas. Secondly, while the Governor-General of the Irish Free State could reserve or deny Royal Assent to any legislation, from 1927, the power to advise the Governor-General to do so no longer rested with the British government in London but with His Majesty's Government in the Irish Free State, which meant that, in practice, the Royal Assent was automatically granted to legislation; the government was hardly likely to advise the governor-general to block the enactment of one of its own bills. Thirdly, though in its original theory, the constitution had to be in keeping with the provisions of the Anglo-Irish Treaty as the fundamental law of the state, that requirement had been abrogated a short time before de Valera gained power.
The Oath of Allegiance was abolished, as were appeals to the Judicial Committee of the Privy Council. The opposition-controlled Senate, when it protested and slowed down these measures, was also abolished. In 1931, the British Parliament passed the Statute of Westminster, which established the legislative equal status of the self-governing Dominions of the then British Commonwealth, including the Irish Free State, to one another and the United Kingdom. Though a few constitutional links between the Dominions and the United Kingdom remained, this is often seen as the moment at which the Dominions became fully sovereign states.
De Valera, in his capacity as Prime Minister of His Majesty's Government in the Irish Free State, wrote in July 1936 to King Edward VIII in London indicating that he planned to introduce a new constitution, the central part of which was to be the creation of an office de Valera provisionally intended to call President of Saorstát Éireann (Irish: Uachtarán Shaorstát Éireann), which would replace the Governor-General. De Valera used the sudden abdication of Edward VIII as King to pass two bills: one amended the constitution to remove all mention of the monarch and Governor-General, while the second brought the monarch back, this time through statute law, for use in representing the Irish Free State at a diplomatic level. With the implementation of the Constitution of Ireland (Irish: Bunreacht na hÉireann), the title ultimately given to the president was President of Ireland (Irish: Uachtarán na hÉireann).
The constitution contained reforms and symbols intended to assert Irish sovereignty. These included:

a new name for the state, "Éire" (in Irish) and "Ireland" (in English);
a claim that the national territory was the entire island of Ireland, thereby challenging Britain's partition settlement of 1921;
the removal of references to the King of Ireland and the replacement of the monarch's representative, the governor-general, with a popularly elected President of Ireland, who takes "precedence over all other persons in the State and who shall exercise and perform the powers and functions conferred on the President by this Constitution and by law";
recognition of the "special position" of the Catholic Church;
a recognition of the Catholic concept of marriage which excluded civil divorce, even though civil marriage was retained;
the declaration that the Irish language was the "national language" and the first official language of the nation although English was also included as "a" second official language;
the use of Irish language terms to stress Irish cultural and historical identity (e.g., Uachtarán, Taoiseach, Tánaiste, etc.)Criticisms of some of the above constitutional reforms include that:

the anti-partition articles needlessly antagonised Unionists in Northern Ireland, while simultaneously attracting criticism from hardline republicans by recognising the de facto situation.
similarly, the recognition of the "special position" of the Catholic Church was inconsistent with the identity and aspirations of northern Protestants (leading to its repeal in the 1970s), while simultaneously falling short of the demands of hardline Catholics for Catholicism to be explicitly made the state religion.
the affirmation of Irish as the national and primary official language neither reflected contemporary realities nor led to the language's revival
though the King was removed from the text of the constitution, he retained a leading role in the state's foreign affairs, and the legal position of the President of Ireland was accordingly uncertain; there was also concern that the presidency would evolve into a dictatorial position
elements of Catholic social teaching incorporated into the text, such as the articles on the role of women, the family and divorce, were inconsistent both with the practice of the Protestant minority and with contemporary liberal opinionAs Bew concludes, in the constitution of 1937, de Valera was "trying to placate left-wing Republicans with national phrases and pious people with expressly Catholic bits [and] patriarchal Catholicism."The Constitution was approved in a plebiscite on 1 July 1937 and came into force on 29 December 1937.


=== The Emergency (World War II) ===

By September 1939, a general European war was imminent. On 2 September, de Valera advised Dáil Éireann that neutrality was the best policy for the country. This policy had overwhelming political and popular support, though some advocated Irish participation in the War on the Allied side, while others, believing that "England's difficulty is Ireland's opportunity", were pro-German. Strong objections to conscription in the North were voiced by de Valera. In June 1940, to encourage the neutral Irish state to join with the Allies, Winston Churchill indicated to de Valera that the United Kingdom would push for Irish unity, but believing that Churchill could not deliver, de Valera declined the offer. The British did not inform the Government of Northern Ireland that they had made the offer to the Irish government, and De Valera's rejection was not publicised until 1970. The government secured wide powers for the duration of the Emergency, such as internment, censorship of the press and correspondence, and the government control of the economy. The Emergency Powers Act lapsed on 2 September 1946, though the State of Emergency declared under the constitution was not lifted until the 1970s. This status remained throughout the war, despite pressure from Chamberlain and Churchill. However, de Valera did respond to a request from Northern Ireland for fire tenders to assist in fighting fires following the  1941 Belfast Blitz.
Persistent claims that de Valera sent a personal note of congratulation to Subhas Chandra Bose upon his declaration of the Azad Hind (Free India) government in 1943, have been shown to be inaccurate, and largely a misrepresentation by Japanese consular staff in Dublin of a statement by a small and unofficial Republican group unconnected to the Irish government.Controversially, de Valera formally offered his condolences to the German Minister in Dublin on the death of Adolf Hitler in 1945, in accordance with diplomatic protocol. This did some damage to Ireland, particularly in the United States – and soon afterwards de Valera had a bitter exchange of words with Winston Churchill in two famous radio addresses after the end of the war in Europe. De Valera denounced reports of Bergen-Belsen concentration camp as "anti-national propaganda"; according to Bew, this was not out of disbelief but rather because the Holocaust undermined the assumptions underlying Irish neutrality: moral equivalence between the Allies and the Axis, and the idea that the Irish were the most persecuted people in Europe.The de Valera government was reputedly harsh with Irish Army deserters who had enlisted to fight with the Allied Armies against the Axis. The legislation in question was the Emergency Powers (No. 362) order which was passed in August 1945. On 18 October 1945, Thomas F. O'Higgins moved to annul the order. He did not condone desertion, but felt that the order was specifically harsh on those deserters who had served in the Allied forces. General Richard Mulcahy also spoke against the Order, disagreeing with the way in which it applied to enlisted men and not to officers. It was revoked with effect from 1 August 1946, but was in effect continued by section 13 of the Defence Forces (Temporary Provisions) Act, 1946.


== Post–war period: Taoiseach/Opposition leader ==


=== Opposition leader: 1948–51 ===
After de Valera had spent sixteen years in power without answering the crucial questions of partition and republican status the public demanded a change from Fianna Fáil government. In the 1948 election, de Valera lost the outright majority he had enjoyed since 1933. It initially looked as if the National Labour Party would give Fianna Fáil enough support to stay in office as a minority government, but National Labour insisted on a formal coalition agreement, something de Valera was unwilling to concede. However, while Fianna Fáil was six seats short of a majority, it was still by far the largest party in the Dáil, with 37 more TDs than the next largest party and rival, Fine Gael (the successor to Cumann na nGaedheal). Conventional wisdom held that de Valera would remain Taoiseach with the support of independent deputies.
This belief came to nought when (after the final votes were counted) the other parties realised that if they banded together, they would have only one seat fewer than Fianna Fáil, and would be able to form a government with the support of at least seven independents. The result was the First Inter-Party Government, with John A. Costello of Fine Gael as its compromise candidate for Taoiseach. Costello was duly nominated, consigning de Valera to opposition for the first time in 16 years. The following year, Costello declared Ireland as a republic, leaving partition as the most pressing political issue of the day.De Valera, now Leader of the Opposition, left the actual parliamentary practice of opposing the government to his deputy, Seán Lemass, and himself embarked on a world campaign to address the issue of partition. He visited the United States, Australia, New Zealand and India, and in the latter country, was the last guest of the Governor-General, Lord Mountbatten of Burma, before he was succeeded by the first Indian-born Governor-General. In Melbourne, Australia, de Valera was feted by the powerful Catholic Archbishop Daniel Mannix, at the centenary celebrations of the diocese of Melbourne. He attended mass-meetings at Xavier College, and addressed the assembled Melbourne Celtic Club. In October 1950, just thirty years after his dramatic escape from Lincoln Gaol, he returned to Lincoln and received the freedom of the gaol. The Anti-Partition of Ireland League of Great Britain marked the occasion with a dinner in his honour and the toast was 'Anglo-Irish Friendship'. A key message in de Valera's campaign was that Ireland could not join the recently established North Atlantic Treaty Organization as long as Northern Ireland was in British hands; although Costello's government favoured alliance with NATO, de Valera's approach won more widespread support and prevented the state from signing the treaty.


=== Final years as Taoiseach ===

Returning to Ireland during the Mother and Child Scheme crisis that racked the First Inter-Party Government, de Valera kept silent as Leader of the Opposition, preferring to stay aloof from the controversy. That stance helped return de Valera to power in the 1951 general election, but without an overall majority. His and Fianna Fáil's popularity was short-lived, however; his government introduced severe, deflationary budgetary and economic policies in 1952, causing a political backlash that cost Fianna Fáil several seats in the Dáil in by-elections of 1953 and early 1954. Faced with a likely loss of confidence in the Dáil, de Valera instead called an election in May 1954, in which Fianna Fáil was defeated and a Second Inter-Party Government was formed with John A. Costello again as Taoiseach.On 16 September 1953, de Valera met British Prime Minister Winston Churchill for the first and only time, at 10 Downing Street. (The two men had seen each other at a party in 1949, but without speaking). He surprised the UK Prime Minister by claiming that if he had been in office in 1948 Ireland would not have left the Commonwealth.It was during this period that de Valera's eyesight began to deteriorate and he was forced to spend several months in the Netherlands, where he had six operations. In 1955, while in opposition, de Valera spoke against the formation of a European Parliament and European federalism, noting that Ireland "did not strive to get out of that British domination [...] to get into a worse [position]".Like the first coalition government, the second lasted only three years. At the general election of 1957, de Valera, then in his seventy-fifth year, won an absolute majority of nine seats, the greatest number he had ever secured. This was the beginning of another sixteen-year period in office for Fianna Fáil. A new economic policy emerged with the First Programme for Economic Expansion. In July 1957, in response to the Border Campaign (IRA), Part II of the Offences Against the State Act was re-activated and he ordered the internment without trial of Republican suspects, an action which did much to end the IRA's campaign.De Valera's final term as Taoiseach also saw the passage of numerous reforms in health and welfare. In 1952, unemployment insurance was extended to male agricultural employees, child allowances were extended to the second child, and a maternity allowance for insured women was introduced. A year later, eligibility for maternity and child services and public hospital services was extended to approximately 85% of the population.


== Presidency ==

While Fianna Fáil remained popular among the electorate, 75-year-old de Valera had begun to be seen by the electorate as too old and out of touch to remain as head of government. At the urging of party officials, de Valera decided to retire from government and the Dáil and instead seek the presidency of Ireland. He won the 1959 presidential election on 17 June 1959 and resigned as Taoiseach, Leader of Fianna Fáil and a TD for Clare, six days later, handing over power to Seán Lemass.
