Bathurst  is a city in the Central Tablelands of New South Wales, Australia. It is about 200 kilometres (120 mi) west-northwest of Sydney and is the seat of the Bathurst Regional Council. Bathurst is the oldest inland settlement in Australia and had an estimated population of 36,801 at June 2018.
Bathurst is often referred to as the Gold Country as it was the site of the first gold discovery and where the first gold rush occurred in Australia. Today education, tourism and manufacturing drive the economy. The internationally known racetrack Mount Panorama is a landmark of the city. Bathurst has a historic city centre with many ornate buildings remaining from the gold rush period of the mid to late 19th century.
The median age of the city's population is 35 years; which is particularly young for a regional centre (the state median is 38), and is related to the large education sector in the community. Population growth has reached 1.6% per annum over the five years until 2010, making Bathurst the seventh fastest growing regional city in New South Wales. This growth over recent years has resulted in increased urban development including retail precincts, sporting facilities, housing estates and expanding industrial areas.


== Geography ==
Bathurst is located on the western edge of the Great Dividing Range in the Macquarie River plain; also known as the Bathurst plains. The city is located adjacent to the Macquarie River which is part of the Murray-Darling basin, the largest river system in Australia. The city is protected by a levee bank to protect the city from occasional flood events. Mount Panorama is located 3 kilometres (1.9 mi) from the CBD and effectively within the city limits; it is 877 metres (2,877 ft) AMSL and rises 215 metres (705 ft) above the Bathurst CBD.
The Great Western Highway which begins in the centre of the city of Sydney, ends at Bathurst. Two main state highways start at Bathurst: the Mitchell Highway to Bourke and the Mid-Western Highway to Hay. Bathurst is about mid-way along a regional road route from Canberra and Goulburn to Mudgee and the Hunter Region. Bathurst is also on the Main Western railway line that starts at Sydney Central and proceeds for 242 kilometres (150 mi) by rail to Bathurst.
The Macquarie River divides Bathurst with the CBD located on the western side of the river. Four road bridges and two rail bridges span the river within the city area. From the upstream side they are: Macquarie River Railway Bridge (built in 1876) closed in 2011 (replaced with a new concrete single track rail bridge structure alongside and brought into use in 2011); the four lane Evans Bridge which opened in 1995; the Denison Bridge opened in 1870 (closed to road traffic and now a pedestrian bridge); the Gordon Edgell Bridge, a low−level bridge located on George Street; and Rankens Bridge at Eglinton.


=== Landform ===
Two physical components comprise the Bathurst region; the Bathurst Basin and the Tablelands areas. They are drained by the Macquarie, Turon, Fish and Campbells Rivers to the north and Abercrombie and Isabella Rivers to the south. The central basin area of the Bathurst area is mainly granite soils while in the north area sandstone, conglomerates, greywacke, siltstones, limestones and minor volcanos predominate. The south is more complex geology with siltstones, sandstones, greywacke, shales and chert, basalt and granite intrusions and embedded volcanic and limestones. Underlying Bathurst is the dominant feature of Bathurst granite (intruded in the Devonian period) and at Mount Panorama and Mount Stewart basalt occurs.Topography of the region ranges from slightly undulating to rough and very steep country, about 30 km to the east of Bathurst is the folded and faulted sedimentary and metamorphosed formations of the Great Dividing Range which runs roughly north–south.


=== Climate ===
Due to its elevation, Bathurst has a subtropical highland climate (Cfb), according to Köppen climate classification. Bathurst is in Australia's cool temperate climate zone which is defined as having mild to warm summers and cool to cold winters. Regular summer thunderstorms are common, resulting from the flat plains country to the west, leading into the mountainous nature of the country around Bathurst and assisting the development of storm cells. These storms rarely strike the city and instead often move either in a south east or north east direction away from Bathurst Bathurst gets 106.9 clear days annually.In winter, light to moderate snowfalls regularly occur each year on the higher peaks around Bathurst, whilst snow is relatively uncommon in the city itself—although it does occur most years. On 5 July 1900, Bathurst received its heaviest snowfall on record; measuring at 68 centimetres (27 in) in the main street. On 11 February 2017, Bathurst Ag recorded a new record high temperature of 41.5 °C (106.7 °F), although temperatures of 40 °C (104 °F) are exceedingly rare for Bathurst. However, this reading did not even slightly compare to Bathurst Gaol's 44.7 °C (112.5 °F), on 12 January 1878.


=== Bathurst Agricultural Station (1909–2020, records >1966) ===


=== Bathurst Gaol (1858–1983) ===


=== Central Business District and suburbs ===
Bathurst's central business district (CBD) is located on William, George, Howick, Russell, and Durham Streets. The CBD is about 25 hectares (62 acres) in area and covers two city blocks. Banking, government services, shopping centres, retail shops, a park (shown) and monuments are in this area. Bathurst has retained a mix of main street shopping along with enclosed shopping centres within the CBD, unlike other towns where the CBD focus has split between main street and new shopping centre developments located in the suburbs. Within the CBD lies Kings Parade; this is a park setting with several memorials of people and events in history. It is a popular location for locals to meet. Keppel Street is Bathurst's second commercial shopping area, removed from the CBD by two blocks to the south. This area developed once the railway arrived in 1876.The main suburbs of Bathurst are: Kelso, Eglinton, West Bathurst, Llanarth, South Bathurst, Gormans Hill, Windradyne, Windradyne Heights and Abercrombie Estate. One of the newer suburbs is Marsden Estate, in Kelso.


== Landmarks ==
Bathurst's place in Australia's history is evidenced by the large number of landmark monuments, buildings, and parks.

In the centre of the city is a square known as Kings Parade. Originally a market area from 1849 to 1906, it was redesignated as a public recreation ground and site for a soldiers memorial. Kings Parade now contains three memorials, an open space park and gardens.
The Bathurst War Memorial Carillon is a 30.5 metres (100 ft) tall tower structure located in the centre of Kings Parade. The Parade is located in the centre of Bathurst's CBD. The Carillon is a memorial to the soldiers who lost their lives in the two World Wars. The bell tower contains 49 cast bronze bells that are rung daily at lunchtime, and an eternal flame on the platform level of the structure. The Carillon was officially completed on Armistice Day, 11 November 1933 at a cost of £8,880.
The Evans memorial stands at the northern end of Kings Parade. Completed in 1920, the memorial commemorates the discovery of the Bathurst Plains in 1813 by George Evans, Assistant Surveyor of Lands.
The Boer War memorial stands at the southern end of Kings Parade. This memorial was unveiled in 1910 by Lord Kitchener.


== History ==
The Bathurst region was originally occupied by the Wiradjuri Aboriginal people.


=== Colonial period (1800s) to gold rush era (1860s) ===

The government surveyor, George Evans, was the first European to sight the Bathurst Plains in 1813, following the first successful European crossing of the Blue Mountains in the same year. In 1814, Governor Lachlan Macquarie approved an offer by William Cox to build a road crossing the Blue Mountains, from Emu Plains, the existing road terminus west of Sydney, to the Bathurst Plains. The first road to cross the Blue Mountains was 3.7 metres (12 ft) wide and 163.3 kilometres (101 1⁄2 mi) long, built between 18 July 1814 and 14 January 1815 using 5 freemen, 30 convict labourers and 8 soldiers as guards. Governor Macquarie surveyed the finished road in April 1815 by driving his carriage across it from Sydney to Bathurst. The Governor commended Cox and stated that the project would have taken three years if it had been done under a contract.On 7 May 1815, Governor Macquarie at the terminus of Cox's Road raised the flag, ordered a ceremonial volley to be fired and proclaimed and named the future town of Bathurst after the Secretary of State for War and the Colonies, Henry Bathurst, 3rd Earl Bathurst. Bathurst is the oldest inland town in Australia. It was intended to be the administrative centre of the western plains of New South Wales, where orderly colonial settlement was planned.

Local Wiradjuri groups under leaders such as Windradyne resisted the settlers until the Frontier Wars of the early 1820s ended the open conflict. The initial settlement of Bathurst was on the eastern side of the river in 1816. It is in today's suburb of Kelso. Ten men were granted 20 hectares (50 acres); five were men born in the colony and five were immigrants. These men were William Lee, Richard Mills, Thomas Kite, Thomas Swanbrooke, George Cheshire, John Abbott, John and James Blackman, John Neville and John Godden. In 1818, Governor Macquarie stated in his diary:

This morning I inspected 10 new settlers for Bathurst. I have agreed to grant each 50 acres of land, a servant, a cow, four bushels [141 litres] of wheat, an allotment in the new town, and to receive into the King's Store at Bathurst all the Wheat they can grow for the first 12 months.
In the early years of settlement, Bathurst was a base for many of the early explorers of the NSW inland, including George Evans in 1815, John Oxley in 1817–1818, Allan Cunningham in 1823, and Thomas Mitchell during the 1830s.

Flecks of gold were first discovered in the Fish River in February 1823, but it was 12 February 1851 in a Bathurst Hotel when Edward Hargraves announced the discovery of payable gold. Soon, gold was found at Ophir (later Sofala) and Hill End in the 1850s.
Hill End, called 'Bald Hills' in 1850, 'Forbes' in 1860 and finally Hill End in 1862 was part of the Tambaroora district. At its peak had a population of 7 000 people.  Hill End's fame is the finding of the 'Holtermann Specimen (Correctly the Beyers Holtermann Specimen)' on 20 October 1871 being the largest single mass of gold ever discovered in the world, a record that still stands today. Found in 1872 this single mass of quartz and gold weighed 630 lbs and when crushed produced and est. of 3000 troy oz (205 lbs or 93 kg) of gold, thus processed held more gold then the processed gold from largest nugget ever found, that being the Welcome Stranger from the Victorian Goldfields. Holtermann recognizing the significance of the find attempted to preserve it by buying it from the Company of which he was one of a number of directors. His efforts were in vain. It is reported that a larger mass was discovered a few days later in the same mine but was broken up underground.  Absolutely reliant on Gold, the towns decline was dramatic once the Gold ran out before the 1900s. Photo: Hotlermann with the Beyers-Holterman SpecimenIn the 1860s, the town of Bathurst began to boom. Bathurst was to become the first gold centre of Australia. The nearby gold localities would transport their gold to Bathurst then to Sydney. The mail and gold transport coaches became an obvious target for bushrangers, which became a major problem for the authorities.
The Ribbon Gang and the Bathurst Rebellion occurred in 1830, when a large group of over 80 convicts roamed the Bathurst district. They were eventually captured and charged with murder, bushranging and horse-thieving. On 2 November 1830, ten members of the Ribbon Boys were hanged in Bathurst for their crimes. The site of the first and largest public hanging in Bathurst is still marked by the laneway sign Ribbon Gang Lane in the CBD. Ben Hall, who became a notorious bushranger, was married in St Michael's Church at Bathurst in 1856. In October 1863, a gang of five (including Hall) raided Bathurst, robbing a jeweller's shop, bailed up the Sportsmans Arms Hotel and tried to steal a racehorse. They returned three days later and held up more businesses. John Peisley, another bushranger, was tried and hanged for murder at Bathurst Gaol in 1862.Bathurst's economy was transformed by the discovery of gold in 1851. One illustration of the prosperity gold brought to Bathurst is the growth and status of hotels and inns. The first licensed inn within the township was opened in 1835, the Highland Laddie. At the peak of hotel activity in 1875, coinciding with the gold rush period, there were 61 operating concurrently. A total of 89 hotel locations have been identified in the town of Bathurst, with 112 operating in the immediate district during the course of the history in Bathurst. Initially many pubs were simply a cottage with stables. As prosperity increased during the gold rush, the Hotels became typical of architecture of pubs known today.


=== Development (1860s) to Federation (1910) ===

The Cobb & Co business was a horse drawn coaching transport business originally established in Victoria but relocated to Bathurst in 1862 to follow the gold rush. The business provided gold escorts, mail services and passenger services to the towns and rural settlements. Cobb & Co. coaches were constructed in the coaching workshops located in Bathurst and the Bathurst Information Centre contains a restored Cobb & Co. coach.Bathurst later became the centre of an important coal-mining and manufacturing region. The Main Western railway line from Sydney reached Bathurst in 1876. From that time, the town became an important railway centre with workshops, crew base with locomotive depot and track and signal engineering offices. It remains today as the railway regional engineering headquarters with a large rail component manufacturing facility.
The heritage listed Bathurst Courthouse, a predominant landmark of the city centre, was constructed in 1880 based on designs by the New South Wales Colonial and Government architects, James Barnet and Walter Liberty Vernon.In 1885, Bathurst had a population of about 8,000 and an additional 20,000 people in the district. The town in 1885 was a hub for stores such as E.G. Webb & Co. with supplies and distribution occurring throughout large parts of western NSW and into Queensland and South Australia.


=== Federation (1910) and post war development (1940s) ===
This period is characterised by periods of slow to moderate population growth, with industrial and education industries developing and technology and services delivered to the town. Several major infrastructure developments arrive such as distributed town gas, electricity, town water supplies, and a sewage treatment system. Town gas had arrived in Bathurst courtesy of a private venture in 1872, with the Council providing a competing network from 1888. On 30 June 1914, the Council purchased the Wark Bros gas system and combined the gas networks. The old gasworks plant on Russell Street (now out of use) was built in 1960. In 1987 natural gas arrived via a new 240 km spur pipeline off the Moomba to Sydney pipeline. The early part of the century saw electricity arrive initially for street lighting; the city converted from gas street lighting to electric lighting on 22 December 1924, when 370 electric lights at a cost of £40,000 were switched on. Lighting spread along streets through to 1935, over time to businesses and finally private houses. Sewage treatment was an early infrastructure project funded by the state government and built in 1915. Water supply started with private wells in backyards. Eventually a waterworks was built to the south of the town on the river with the water pumped through piping laid progressively to the businesses and private dwellings. In 1931, work started on the 1,700 ML Winburndale Dam project to gravity feed water through a wood stave pipe laid to the town. The scheme was opened by the Premier of New South Wales on 7 October 1933. Later, a new larger water supply dam was built on the Campbells River. Originally known as the Campbell River Dam scheme and later renamed the Ben Chifley Dam after the late Prime Minister Ben Chifley of Bathurst. It was opened in November 1956. The Ben Chifley Dam received a major storage upgrade designed to meet the cities needs to 2050; the work was completed in 2001 increasing the capacity by 30% to 30,800 megalitres (6.8×109 imp gal; 8.1×109 US gal).An ambulance service commenced on 6 June 1925 with a new Hudson ambulance. A new ambulance station was opened 2 March 1929 and is still used by the NSW Ambulance Service. Motor cars were becoming common in the early 20th century and the need for road service patrols commenced in 1927, provided by the NRMA using a motorcycle/sidecar response vehicle. The early electronic media age arrived with the opening of commercial radio station 2BS on 1 January 1937. Bathurst Aerodrome was opened in 1942, initially to benefit the war effort providing parking for aircraft overflowing from Richmond air force base. The first commercial airline service departed for Sydney on 16 December 1946.A famous Australian brand name of frozen foods began in Bathurst. Robert Gordon Edgell arrived in Bathurst in 1902. By 1906, he was growing pears, apples and asparagus and experimenting with canning and preserving fruit and vegetables, eventually opening a small cannery in 1926. In 1930, he formed the company Gordon Edgell & Sons which became, and still is, a famous Australian food brand, now owned by Simplot.
Many attempts were made to start a University College, the earliest attempts were 1912 through to 1947 when real progress was made with plans for a state teachers college. The first intake of teacher students came at the beginning of 1951 with the official opening on 9 November 1951. The college has transformed over time into the Mitchell College of Advanced Education on 1 January 1970. The College grew and ultimately became the Charles Sturt University on 19 July 1989.
Bathurst was one of the locations to campaign to be the site of the new Federal Capital. In an essay prepared by a journalist with the Bathurst Times, Price Warung, in 1901 to promote Bathurst's candidacy, he responds to the Federal committees key requirements for the capital to have: centrality and accessibility of situation, salubrity, and capacity for impregnable defence.An Army camp was established at Bathurst in early 1940 and was intended for the Second Australian Imperial Force's 1st Armoured Division, although it was later converted to an infantry training centre due to the unsuitability of the closely settled area to armoured training. Following the war, this camp was converted to a migrant reception and training centre. The first group of migrants arrived at Bathurst in 1948; at times the centre had up to 10,000 residents.


=== Population growth ===
Bathurst's population has had rapid growth periods throughout its history; during the mid to late 19th century gold rush period, then post World War 2 when migrants from the war ravaged countries were settled in the area and returning soldiers were offered farming land, and at the start of this century has been another fast growth period corresponding in part to Sydney's congestion. Other periods have seen a slightly declining population, including the decade around the 1900s and during the 1960s. The following chart illustrates the growth from 1856 to recent times.


== Heritage listings ==
Bathurst has a number of heritage-listed sites, including:

All Saints Anglican Cathedral Church Street: All Saints Cathedral Bells
Bathurst City Library 70-78 Keppel Street: Bathurst Old School of Arts Library Collection
Bathurst Street Lamps, located throughout the central business district
Bentinck Street: Bentinck Street Elm Trees
67 and 71 Bentinck Street: Bentinck Street houses
Browning Street: Bathurst Correctional Complex
10 Busby Street: Ben Chifley's House
218 Gormans Hill Road: Merembra Homestead
Havannah Street: Bathurst railway station
Howick Street: Old Bathurst Hospital
194, 196, 198, 200 and 202 Howick Street: Howick Street houses
Kendall Avenue (Great Western Highway): Bathurst Showground
Macquarie River, Great Western Highway: Denison Bridge
Main Western railway: Bathurst Rail Bridge over Macquarie River
3249 O'Connell Road: The Grange and Macquarie Plains Cemetery
Russell Street: Bathurst Courthouse
321 Russell Street: Miss Traill's House
16 Stanley Street: Old Government Cottages Group
107 William Street: Cathedral of St Michael and St John
108 William Street: Royal Hotel


== Population ==
At June 2018 there were 36,801 people in Bathurst.
Aboriginal and Torres Strait Islander people made up 5.8% of the population.
84.1% of people were born in Australia. The next most common countries of birth were England 1.8%, New Zealand 1.1%, India 0.5%, Philippines 0.4% and Scotland 0.4%.
87.3% of people only spoke English at home.
The most common responses for religion were Catholic 31.6%, No Religion 22.7% and Anglican 18.8%.


== Governance ==


=== Local ===

Local government was trialled in the new Colony with a 'Bathurst and Carcoar District Council' established on 12 August 1843, Bathurst was proclaimed a town in 1852 and incorporated as a borough in 1862, next a municipality in 1883, then gazetted a city in on 20 March 1885. the same day as Sydney was declared a city. Bathurst Regional Council was formed on 26 May 2004 following the amalgamation of the Bathurst City Council, most of Evans Shire and a small amount of land formerly included in Oberon Shire.


=== State ===
The Electoral district of Bathurst is the state seat in the NSW Parliament. This seat covers the major centres of Bathurst and Lithgow, and all or part of Bathurst, Blayney, Cabonne, Lithgow, Mid-Western and Oberon local government areas.
Since 1859, Bathurst has existed as an electoral district in the NSW Parliament. Prior to 1856, Bathurst was a part of the Electoral district of Western Boroughs. Before the 1920s, Bathurst was a single member constituency, in the 1920s it became a multimember district with proportional representation. During the middle part of the 20th century the seat was marginal between Labor and Country Parties, from 1981 when the strong Labor town of Lithgow moved from Blue Mountains to Bathurst, the seat was dominated by Labor, except for 1988 when it was won by the Liberal Party for one 3-year term, and the 2011 election when Paul Toole of the National Party won the seat.


=== Federal ===
Bathurst is currently within the federal electoral district of Calare which includes a large part of western NSW from Lithgow in the east to Tullamore in the west. Prior to the 2010 election, Bathurst was within the Macquarie federal electoral district which was more easterly based including the Blue Mountains area with Bathurst as the western boundary of the district.


== Economy ==
Bathurst's economy is broad based with a manufacturing industry, large education sector (including agricultural) and government service sectors. In 2015, the Gross Regional Product was $1.96 billion representing 0.4% of the Gross State Product of New South Wales.To capitalise on Bathurst's growth, education facilities and youthful population, in 2011 the Regional Council announced it was progressing plans for a new Australian Centre for Science, Technology and Emerging Industries (ACSTEI), also known as the Technology Park, to be established adjacent to the Charles Sturt University Campus with the centre featuring next generation emerging industries.


=== Manufacturing and food ===
Private sector employers with large workforces in Bathurst (according to statistics published in 2009) include Devro, an international company that produces food casing products and Mars Petcare manufacturing plant are the single largest private employers of labour. Companies such as Telstra's call centre, Simplot Australia's (more recognisable as brands such as Edgells, BirdsEye, Chiko Roll, and I&J Seafood products) food processing and canning plant and Burkes Transport a local trucking and distribution company. In 1982, Clyde Engineering opened a railway component facility in Kelso, initially producing electrical equipment under licence from Hitachi. In 1982 it began manufacturing locomotives. It closed in 2013.


=== Public sector ===
Government sector employers with large local workforces include Country Energy with their District Field Office and Corporate Office, Charles Sturt University, Bathurst Regional Council, the NSW Land Registry Services that provide mapping and survey data across NSW, the Greater Western Area Health Service – Regional Office, Bathurst Correctional Centre, Department of Education and Training – Regional Office, Police Service – Chifley Local Area Command, and NSW State Forests – Regional Office. In April 1982, the State Rail Authority opened a locomotive and wagon overhaul facility in Bathurst.


=== Agriculture ===
