Bromsgrove's Member of Parliament is Sajid Javid. As a largely rural constituency with affluent residential areas, Bromsgrove District is strongly Conservative-supporting area with further seats being won by the party in the local elections at the expense of 'other' candidates.Bromsgrove constituency was last represented by Labour by Terry Davies, who defeated Conservative Hal Miller as the result of 10.1% swing in a by-election in 1971. Miller was elected to the new Bromsgrove and Redditch constituency in 1974, and represented Bromsgrove constituency from 1983 to 1992. He was succeeded by Roy Thomason, who was censured by the House of Commons Select Committee on Standards and Privileges for failing to declare loans made to him. He decided not to re-stand after the local Conservative Association opened nominations to other candidates. He was succeeded by Julie Kirkbride in 1997. She did not contest the seat in 2010 following the Westminster expenses scandal, in which she was found to have over-claimed by £29,243.Bromsgrove has its own youth branch of Conservatives called Bromsgrove Conservative Future, a Labour Party and Labour club and Liberal Democrat Party. Labour voting is strongest in the Whitford, Sidemoor and Charford wards of the town.The town was also the host in the 2000s for the annual conference of the "Bromsgrove Group", an organisation of monetary reformers, campaigning against debt-money, members of which have been suspected of far-right links.


== Demography ==
According to the 2001 census the population of Bromsgrove is 29,237 and the population for the larger Bromsgrove District is 87,837.
In Bromsgrove, White British is by far the largest race, at 96% of the district population (87,837) with 4% (3,734) from an ethnic minority.


== Geography ==
The solid geology of Bromsgrove is that of the Triassic (late Scythian to early Ladinian) Bromsgrove Sandstone. It shows red bed facies and was probably laid down by rivers flowing through an arid landscape or in ephemeral, shallow lakes. The uppermost beds were deposited by a brief marine transgression. The soil is very good for market gardening and growing vegetables due to Marl bands. The district is at a general elevation of between 200 feet (61 m) to 300 feet (91 m) above sea level.


=== Climate ===
Bromsgrove experiences an oceanic climate (Köppen climate classification Cfb) similar to almost all of the United Kingdom.


=== Landmarks ===

There is a statue of Alfred Edward Housman in the high street, which was erected in 1985. There is also a sculpture of a dryad and boar in the high street, commemorating the work of the Bromsgrove Guild.
Bromsgrove is home to Grafton Manor which dates back to the 14th century. It has a rich history, with one of the daughters of John Talbot married to Robert Wintour, who was involved in the Gunpowder plot.


== Economy ==
In 2004, 33,175 people in Bromsgrove District were in employment. Manufacturing, retail, and services were the biggest sectors of employment in 2001.Many of Bromsgrove's residents find employment in Birmingham, Redditch, Worcester and other places along the motorway network. MG Rover was a major employer of Bromsgrove residents until its collapse in May 2005. Bromsgrove is still home to LG Harris Ltd, a paint brush and decorator's tool manufacturer in Stoke Prior (known locally as "Harris Brush" or just "The Brush"). Business parks in Aston Fields and Buntsford Hill are helping to revitalise the local economy, in addition to newer developments such as Saxon and Harris Business Parks.  Bromsgrove District Council is aiming to create a technology corridor along the A38 to take advantage of the area's road links.


== Facilities ==


=== Municipal facilities ===
Bromsgrove has a public community library situated in the centre of the town. The library offers not only books but also music CDs, spoken word, foreign language tapes and videos & DVD for adults and children. There are 25 computers available with internet access.Bromsgrove has a municipal park, Sanders Park. Facilities include: basketball courts, tennis courts, a skate park, children's play area and football pitches. A bonfire night is held annually with a large fireworks display and fairground rides. Other events are held such as big band afternoons featuring bands playing in the bandstand.
There is a large public leisure centre and sports centre in the town called Bromsgrove Sports and Leisure Centre, formally known as The Dolphin Centre. It has two swimming pools and a large sports hall. Numerous activities and clubs are held here, such as the Bromsgrove Swimming Club. It is owned by Bromsgrove District Council. Formally run by Wychavon Leisure, the management of the centre was handed over to Everyone Active in 2017 as part of a £13.7 million refurbishment and renovation.


=== Transport ===

Bromsgrove is intersected by the A38 which was bypassed to the east of the town in 1980, the M5 motorway borders the west side and the M42 motorway starts at the north of the town.
Bromsgrove railway station is situated to the south of the town. It sits at the foot of the Lickey Incline which is the steepest Incline on the British mainline network meaning most freight trains require assistance from a locomotive at the rear. Between 1919 and 1956 this was operated by a purpose built locomotive known by drivers as Big Bertha. There are frequent trains to Birmingham New Street, Worcester Foregate Street and Hereford. On 4 May 2007, Network Rail announced that a new station would be built, to replace the existing structure, at a cost in the region of £10–12 million. The station opened in July 2016.  Following completion of the electrification project, Bromsgrove is served by trains on the Cross City Line towards Lichfield.  (These services previously terminated at Longbridge.)
There is also a bus station adjacent to the high street. Buses operate to Redditch, Worcester,  Birmingham,  Kidderminster, Halesowen and Stourbridge operated by various operators.  However the historic bus service 144 between Worcester and Birmingham remains in the hands of First Midland Red,  the successor to Midland Red. 
Bromsgrove is located on National Cycle Route 5 of the National Cycle Network. It is also the terminus of cycle route 46. There are a number of public bicycle stands in Bromsgrove Town Centre. These are situated on the car park adjacent to the Queen's Head pub on the North end of town, outside Bromsgrove Library, on Chapel Street (opposite Lloyd's Bank), on Church Street (next to the Bus Station) and on the southern end of the high street, near to the Golden Cross Hotel.


=== Education ===


==== State schools ====
Bromsgrove schools use a Three-tier education system (first school, middle school, high school).
Bromsgrove has 15 first schools in its district: Lickey End First School, Finstall First School, Charford First School, Dodford First School, Milfields First School, St. Peters Roman Catholic First School, Stoke Prior First School, Blackwell First School, Sidemoor First School, Catshill First School, Tardebigge CofE First School, Fairfield First School, Hanbury CofE First School and Meadows First School.
There are five Middle Schools: Alvechurch Middle School, Catshill Middle School, Aston Fields Middle School, St John's Church of England Middle School Academy, and Parkside Middle School.
There are two high schools, North Bromsgrove High School and South Bromsgrove High School opposite Charford. South Bromsgrove is a specialist school in foreign languages and I.T, noted for its extensive use of information technology. A previous headteacher, Philip McTague, was heavily involved in political action to reduce the gap in funding between Worcestershire state schools and others across the country. North Bromsgrove High School has now been classed for a specialist status in media and Creative Arts. Both were rebuilt by BAM in 2007.


==== Independent schools ====
Bromsgrove is also home to Bromsgrove School, a co-educational independent school founded in 1553 with three campuses catering for pupils from nursery to sixth-form that offers boarding facilities. Former pupils include Digby Jones, head of the CBI for many years and the actors Ian Carmichael, Richard Wattis and Trevor Eve.


==== Special schools ====
There are two special schools in Bromsgrove, one is Chadsgrove School and Specialist Sports College the other Rigby Hall School.


==== Further education ====
Bromsgrove is the main site of Heart of Worcestershire College, formerly North East Worcestershire (NEW) College until 1 August 2014 following a merger. In May 2011, NEW College built a motorcycle academy with a £1.7 million grant from Advantage West Midlands, it has been extensively equipped by Harley Davidson.


=== Sport ===
Bromsgrove is home to:

Fairfield Villa Football Club. The home of community football in Bromsgrove.
Bromsgrove Rugby Football Club, one of the oldest rugby union clubs in the country. It was formed on 28 September 1872.
Bromsgrove Sporting Football Club. Bromsgrove play their home games at The Victoria Ground.
Bromsgrove Cricket, Hockey and Tennis Club.
Mercian Divers Scuba Diving Club – affiliated to the BSAC (British Sub-Aqua Club).
North East Worcestershire Ravens rugby league club, who play in the Midlands Rugby League.
Bromsgrove Indoor Bowls Club (also providing outdoor bowls) based in Charford
Bromsgrove and Redditch Athletics Club, based at the Ryland Centre athletics track.
Bromsgrove Swimming Club, established in 1966.
Worcester City Football Club play their homes at the Victoria Ground, Bromsgrove


=== Attractions ===

Avoncroft Museum of Historic Buildings has its home in Bromsgrove. This museum includes the National telephone kiosk Collection. The Bromsgrove Museum on Birmingham Road reopened in May 2016.The Worcester and Birmingham Canal which runs close to Bromsgrove, is a destination for leisure activities such as walking and coarse fishing and there are several narrowboat hire centres situated in nearby villages. The Tardebigge lock flight, with 30 locks, is the longest in the UK. Bromsgrove is 5 miles (8.0 km) away from the historic country house Hanbury Hall, which is open to the public. The town's leisure venues include a nightclub featuring a mixture of styles, and pubs in the town centre include a Wetherspoons pub, a Slug and Lettuce pub and a number of traditional pubs.
Bromsgrove is close to the countryside attractions of the Lickey Hills, the Clent Hills, the Waseley Hills.


== Entertainment and arts ==
Bromsgrove is host to a centre for the arts, Artrix, located on Slideslow Drive. Artrix is a multi purpose arts centre that provides theatre, cinema screening recently released films and National Theatre Live performances, rock concerts, folk music, comedians and classical music concerts from Bromsgrove Concerts, ESO and Midland Sinfonia. Artrix also has a vibrant youth theatre group and a new arts outreach team. From 2012 the dance studio has been converted to hold a maximum of 90 people and provides a space for intimate music, comedy and small theatre.
The 2015 World War II film Our Father was partially filmed on location in Hanbury Woods outside Bromsgrove.


=== Bromsgrove Festival ===
Since 1960, Bromsgrove has held an annual classical music festival, with an international reputation.


== Clubs and societies ==

Although with no official function, Bromsgrove's Court Leet continues to exist as a ceremonial body, being sanctioned under the Administration of Justice Act 1977. The Bromsgrove Society is a charity formed in 1980 to protect the built and natural environment of the town. The Bromsgrove Society of Model Engineers was formed in 1982 and operates a track at the Avoncroft Museum of Historic Buildings. The Bromsgrove Photographic Society was formed in 1950 and organises talks in Stoke Prior. Bromsgrove has a Rotary Club formed in 1936 and chartered in 1937.


=== Town twinning and friendship links ===
In May 1980, Bromsgrove was twinned with the German town of Gronau. A formal friendship link document was signed between Bromsgrove and the district of Saint-Sauveur-Lendelin in Normandy, France, in July 1999. Annual exchange visits are made by Bromsgrove and District Twinning Association members to each town.Twinning

 Gronau, GermanyFriendship Link

 Saint-Sauveur-Lendelin, Manche, France
 Drumlish, Longford, Ireland


== Notable residents ==
See also: People from Bromsgrove District and People from BromsgroveThe notable residents of Bromsgrove include those educated at Bromsgrove School (see People educated at Bromsgrove School). Among the Old Bromsgrovians are a field marshal, five winners of the Victoria Cross and one winner of the George Cross.


=== Medieval ===
Richard Bromsgrove, Abbot of Evesham
Sir Sir Humphrey Stafford (1427-1486) of Grafton, in the parish of Bromsgrove, executed in at Tyburn in 1486 for the Stafford and Lovell Rebellion against King Henry VII.


=== 1500–1700 ===
Sir Gilbert Talbot, KG (died 1517/18), owner of Grafton Manor
Sir John Talbot (died 1549), owner of Grafton Manor, buried in St John the Baptist Church, Bromsgrove
Sir John Talbot (died 1611), owner of Grafton Manor, Catholic recusant suspected wrongly of involvement in the Gunpowder Plot
Francis Talbot, who died as the result of a duel at Barn Elms with the Duke of Buckingham over his wife
Anna Talbot, wife of Francis and famous beauty
William Dugard, schoolmaster, author in English and Latin, and printer of propaganda, seventeenth century
John Hall, Anglican bishop


=== 18th century ===
Sarah Bache, hymn writer, born in Bromsgrove about 1771
Charlotte Badger, considered to be the first Australian female pirate, born in Bromsgrove in 1778
William Wells, Methodist preacher, emigrated to America


=== 19th century ===

Benjamin Bomford, farmer
George Cadbury, creator of Cadbury chocolates.
Sir Thomas Frederick Chavasse (1854–1913) surgeon, member of the Chavasse family, buried in Bromsgrove. His daughter Gladys (1893–1962) was engaged to her cousin Noel Chavasse VC and Bar, MC
John Corbett, the Salt King, lived in Bromsgrove prior to building Chateau Impney.
Alfred Edward Housman, classical scholar and poet.
Clemence Housman, sister of Alfred, author and suffragette
Laurence Housman, brother of Alfred, illustrator, playwright, writer and left-wing political activist
John Lisseter Humphreys, Governor of North Borneo
Benjamin Maund, botanist and chemist, publisher and bookseller
Mabel Tolkien (1870–1904), mother of J. R. R. Tolkien, buried in Bromsgrove
Elijah Walton, artist, lived in Lickey, died there in 1880


=== 20th and 21st century ===
Singer/actor, Michael Ball, was born in Bromsgrove.
Michael Buerk, BBC News presenter and journalist, once worked for the local 'Bromsgrove Messenger' newspaper.
Dan Bull, internet activist and musician was born in Bromsgrove.
Nicola Charles, actress, was born in Bromsgrove in 1969.
Lisa Clayton (born 1958), sailor, lived in Bromsgrove with her parents
J. M. Wallace-Hadrill, academic, born in Bromsgrove
Jonathan Coe, author, was born in Lickey in 1961.
Jimmy Davis (1982–2003), footballer with Manchester United, Swindon Town and Watford F.C. was born in Bromsgrove.
Fyfe Dangerfield, musician grew up in Bromsgrove and attended Bromsgrove School
Nicholas Evans, author, best known for The Horse Whisperer. was born in Bromsgrove and attended Bromsgrove School
Declan Fitzpatrick was born in Bromsgrove.
Craig Fagan, Hull City footballer. Lived in Bromsgrove in his childhood.
Walter Gilbert (sculptor) of the Bromsgrove Guild
Rear-Admiral Sir David William Haslam (1923–2009), Royal Navy officer and Governor of Bromsgrove School, died in Bromsgrove
Geoffrey Hill (1932–2016) poet.
Anthony E. Pratt (1903–1994), the inventor of the board game Cluedo, is buried in Bromsgrove Cemetery.
Mathew Priest, Musician of the Indie rock band Dodgy.
Pat Roach (1937–2004), wrestler and actor is buried in Bromsgrove Cemetery.
Gary Rowett former professional footballer and former Manager at Birmingham City FC.
David Rudkin, playwright, taught at North Bromsgrove High School in the early 1960s.  His play Afore Night Come (1962) was inspired by his experiences in the countryside close to Bromsgrove.
Alan M. Smith (born 1962), footballer.
Andy Smith (born 1967), a professional darts player with a nickname known to fans as the 'pie-man', was born here.
Trudie Styler was born in Bromsgrove.
Jim Swire (born 1936), doctor and father of Lockerbie victim.
Matt Teale (born 1975), newsreader and journalist was born in Bromsgrove.
Sir John Vane (1927–2004), pharmacologist and winner of the Nobel Prize in Physiology or Medicine (1982); born in Tardebigge
Jessica Varnish (born 1990), track cyclist.
Mark Williams (born 1959), actor, famous for portraying Arthur Weasley in the Harry Potter film franchise, along with the title character in the BBC's Father Brown television series based on the books by G.K. Chesterton.
Russell Williams, Canadian serial killer, was born in


== Further reading ==
Cooper, Margaret (1998). Bromsgrove (Archive Photographs) (Paperback ed.). The History Press. ISBN 978-0752411460.
Kings, Bill; Cooper, Margaret E. (1999). Glory Gone: The Story of Nailing in Bromsgrove (2nd ed.). Halfshire Books. ISBN 978-1899062041.CS1 maint: ref=harv (link)
Foster, John, ed. (1981). Bygone Bromsgrove: an illustrated story of the town in days gone by. Bromsgrove Society. ISBN 9780950947143. OL 19606374M.CS1 maint: ref=harv (link); a collection of essays about aspects of local history, including Grafton Manor, local watermills, railways, canals and the nailmaking industry.
Richards, Alan (1 December 1984). The Extraordinary Adventures of Benjamin Sanders, Buttonmaker of Bromsgrove. Bromsgrove Society. ISBN 978-0-9509471-2-9. OL 11581893M.CS1 maint: ref=harv (link)
Watt, Quintin (ed.). The Bromsgrove Guild – an Illustrated History. ISBN 978-0-9509471-6-7. OL 8476161M.CS1 maint: ref=harv (link)
Willis Bund, John William; Doubleday, Herbert Arthur; Page, William, eds. (1913). "Parishes: Bromsgrove". A History of the County of Worcester. 3. London: Victoria County History. pp. 19–33.CS1 maint: ref=harv (link)
Pevsner, Nikolaus; Brookes, Alan (2007), "Bromsgrove", Worcestershire, The Buildings of England (Revised ed.), London: Yale University Press, pp. 190–207, ISBN 9780300112986, OL 10319229MCS1 maint: ref=harv (link)
Cotton, William Alfred (1881), Bromsgrove Church, London: Simpkin, Marshall, and Co., OCLC 6677955, OL 13997362M


== Sources ==


=== Medieval ===
Dyer, Christopher (2000). Bromsgrove: a small town in Worcestershire in the Middle Ages. Occasional Publications. 9. Worcestershire Historical Society. ISSN 0140-9913.CS1 maint: ref=harv (link)
Humphreys, John (1919). "Forest of Feckenham". Transactions and Proceedings. Birmingham and Warwickshire Archaeology Society. 45: 115–132.CS1 maint: ref=harv (link)
Watts, Victor Ernest, ed. (2004). The Cambridge Dictionary of English Place-Names. Cambridge University Press. ISBN 9781107196896.CS1 maint: ref=harv (link)


=== Civil War and Restoration ===
Atkin, Malcolm (2004). Worcestershire under arms. Barnsley: Pen and Sword. ISBN 1-84415-072-0. OL 11908594M.CS1 maint: ref=harv (link)
Jones, John Andrews (1849), "Francis Spilsbury", Bunhill memorials, London: James Paul, pp. 259–260, OL 19672792MCS1 maint: ref=harv (link)
Calamy, Edmund (1713), "Bromsgrove, Mr John Spilsbury MA", An account of the ministers, lecturers, masters, and fellows of colleges and schoolmasters: who were ejected or silenced after the Restoration in 1660, by or before, the Act of Uniformity., 1, London: Printed for J. Lawrence, pp. 772–73; read page 772 at archive.org
Gordon, Alexander (1917), "Spilsbury, John M.A.", Freedom after ejection: a review (1690–1692) of Presbyterian and Congregational nonconformity in England and Wales, Manchester: University Press, p. 356 – read page 356 at archive.org
Richards, Alan (1981). "A town trail".  In Foster, John (ed.). Bygone Bromsgrove: an illustrated story of the town in days gone by. Bromsgrove Society. pp. 9–40. ISBN 9780950947143. OL 19606374M.CS1 maint: ref=harv (link)
Fea, Allan (1908), The flight of the king, London: Methuen, OCLC 4871077, OL 24614752M
Pepys, Samuel (1966).  Matthews, William (ed.). Charles II's Escape from Worcester. University of California Press.


=== Nail making ===
Kings, Bill (1981). "Nailmaking".  In Foster, John (ed.). Bygone Bromsgrove: an illustrated story of the town in days gone by. Bromsgrove Society. ISBN 9780950947143. OL 19606374M.CS1 maint: ref=harv (link)
Sherard, Robert Harborough (1897). "The Nailmakers". The White Slaves of England: Being True Pictures of Certain Social Conditions in the Kingdom of England in the Year 1897. London: James Bowden. pp. 81–107. OL 7094447M.CS1 maint: ref=harv (link)
Calcraft, Henry G. (1888). "Report as to the Condition of Nail Makers and Small Chain Makers in South Staffordshire and East Worcestershire, by the Labour Correspondent of the Board of Trade". Parliamentary Papers. XCI (385).CS1 maint: ref=harv (link)
Searby, P (1968). "Great Dodford and the later history of the Chartist Land Scheme" (PDF). Agricultural History Review. British Agricultural History Society. 16 (1): 32–45. Archived from the original (PDF) on 4 September 2011.CS1 maint: ref=harv (link)
Allen, G. C (1928), The industrial development of Birmingham and the Black Country, 1860–1914 (PhD thesis), University of BirminghamCS1 maint: ref=harv (link)


=== Nineteenth century industrial ===
Briggs, Jonathan (1981). "The Watermills of Bromsgrove".  In Foster, John (ed.). Bygone Bromsgrove: an illustrated story of the town in days gone by. Bromsgrove Society. ISBN 9780950947143. OL 19606374M.CS1 maint: ref=harv (link)
Awdry, Rev W (1981). "Bromsgrove and the Lickey Incline: the railway revolution".  In Foster, John (ed.). Bygone Bromsgrove: an illustrated story of the town in days gone by. Bromsgrove Society. ISBN 9780950947143. OL 19606374M.CS1 maint: ref=harv (link)


== Notes ==


== References ==


== External links ==
Bromsgrove District Council
Bromsgrove Online