Felise Kaufusi, rugby league footballer
Mitchell Langerak, association football player, A-League championship winning player
Errol McCormack, retired Chief of Air Force (1998–2001), Officer of the Order of Australia (1998)
Rheed McCracken, 2012 Summer Paralympics, won a silver and bronze medal
Sarah McLellan, dancer and entertainer, lead singer of the group Lez Zeppelin and blogger of "The Aussie who ate the Big Apple" currently living in New York
Mal Meninga, rugby league footballer
Tom Miles, professional athlete/sprinter, Winner 1927 Stawell Gift, 1928 World Champion
Gladys Moncrieff, singer
Clinton Moore, Freestyle Motorcross Rider
Vance Palmer, writer
Jayant Patel, the alleged "Doctor Death" of the Bundaberg Base Hospital
Ian Quinn, Golden Guitar winner & singer/songwriter
Chris Sarra, 2004 Queenslander of the Year
Donald Smith, operatic tenor
Michelle Steele, Winter Olympian at the 2006 Winter Olympics
Don Tallon, Australian Cricketer
Keith Thiele, World War II Pilot (awarded DSO, DFC & 2 medal bars)
Tommy Trash, ARIA and Grammy nominated Australian DJ & Producer
Shane Tichowitsch, Darts player
Brad Evans, Queensland Top 10 Entrepreneur 2018


=== Representatives ===
Current

David Batt, (Liberal National Party), State member for Bundaberg
Keith Pitt (Liberal National Party of Queensland), Federal member for HinklerFormer

Prime Ministers Andrew Fisher and Frank Forde both represented Federal electorates that included Bundaberg, though neither was originally from the area.


== Notes ==


== External links ==
Bundaberg, University of Queensland
"The Districts of Queensland (15)". Queensland Country Life. 1 December 1901. p. 9. Retrieved 14 November 2015 – via National Library of Australia. — A description of Bundaberg in 1901