Bundaberg is a city in south-east Queensland, Australia, about 385 kilometres (239 mi) north of the state capital, Brisbane. It is 15 kilometres (9.3 mi) inland from the Coral Sea coast and situated on the Burnett River. It is a major centre within the broader Wide Bay–Burnett geographical region
Bundaberg is the business centre for a major sugar cane growing area, and is well known for its namesake export, Bundaberg Rum. The city is an important tourism gateway for inland national parks and the southern end of the Great Barrier Reef and resort islands. It is the seat of the Bundaberg Regional Council.
As at June 2018, the urban population of the Bundaberg was 70,921.


== Etymology ==


=== City name ===
The name was coined by surveyor John Charlton Thompson and his assistant Alfred Dale Edwards. Bunda is derived from the name of one of the kinship groups of the local Taribelang people, to which was added the Saxon suffix berg, meaning "town". Colloquially the city is known as "Bundy".


=== Bourbong street ===
Bourbong Street is the main street of the city and there is some controversy in regards to its spelling and meaning; Bourbong was alternatively spelled Bourbon or Boorbong, which was a local Aboriginal title given to a large waterhole in the area. The main street was historically also gazetted in the Bundaberg Mail as "Bourbon" street, but by 1941 there is no reference to "Bourbon" street. Robert Strathdee's farming selection in the vicinity of the watering holes was recorded on early survey maps as 'Boorbung'.A pioneer pastoralist of the region, Nicholas Tooth, wrote that "Bourbong" was derived from the local Aboriginal phrase "bier rabong", meaning "plenty dead". Tooth, who took up land in the area in the early 1860s, found that Aboriginal people resolutely avoided the "bier rabong" vicinity. He later found the skeletal remains there of around twenty Aboriginal people who were apparently massacred in a raid by the Native Police.


== History ==


=== Original people ===
The local Aboriginal group is the Taribelang Bunda people. They are the original inhabitants of the region which stretches from the Burrum River in the south to the Baffle Creek in the north.The kinship groups of the Taribelang people are called Balguin, Banjurr, Barrang, Bunda, Butchulla, Goeng, Kabi Kabi, Koreng Goreng, and Turroine.
https://www.slq.qld.gov.au/blog/identifying-main-words-bundaberg-tribe-taribelang-kalkie-language-within-great-sandy-strait 
https://www.facebook.com/watch/BundaKubeezMuseum/


=== Initial British colonisation ===
The first non-indigenous man to visit the area was James Davis in the 1830s. He was an escaped convict from the Moreton Bay Penal settlement who lived with the Kabi people to the south of the region. He resided mostly around the Mary River and was referred to as Durrumboi. The Burnett River was surveyed by John Charles Burnett, after whom it was named during his exploration mission of the Wide Bay and Burnett regions in 1847.British occupation of the land in the region began in 1848 when pastoral squatters Gregory Blaxland Jnr and William Forster established a sheep station. Blaxland was a son of the Blue Mountains explorer, Gregory Blaxland, and Forster was later to become a Premier of New South Wales. They selected a very large area of land which encompassed most of the western part of the modern day Bundaberg Region along the Burnett River. They named this pastoral lease Tirroan. Blaxland and Forster had previously set up sheep stations near the Clarence River and had a notable history of conflict with Aboriginal people. This continued at Tirroan when two of their shepherds were killed by Aboriginal people in 1849. Forster and Blaxland led a punitive expedition causing multiple Aboriginal deaths. Further conflict occurred the following year when Blaxland was clubbed to death. Forster and a number of other squatters conducted another reprisal, resulting in a large massacre of Aboriginal people in scrubland toward the coastal part of Tirroan. In the early 1850s, Forster sold the property to Alfred Henry Brown who changed the name of the pastoral lease to Gin Gin. At the same time, Native Police officer, Richard Purvis Marshall, took up the Bingera leasehold in the rainforest scrubland downstream from Tirroan. Three towns in the Bundaberg region, Tirroan, South Bingera and Gin Gin, commemorate these massive initial leaseholds.


=== Cattle and logging ===

Before colonisation, much of the land around the lower reaches of the Burnett River consisted of either the Woongarra Scrub, a subtropical rainforest that stood where most of the Bundaberg canefields now grow, or the Barolin Plains, a lightly timbered grassland that stretched along the coastal fringe. Neither of these areas were suitable for sheep farming but the British soon found that raising cattle was possible. In the early 1860s the first cattle stations in the area were established; Branyan on the south side of the Burnett River and Tantitha on the north side.Timber companies, such as that owned by William Pettigrew, started the logging of the Woongarra Scrub in 1867.
In 1868, Samuel Johnston erected a sawmill in Waterview, on the north bank of the Burnett River. The Waterview sawmill became a prominent supplier of timber until its closure in 1903 after being damaged by flood.


=== Town of Bundaberg ===
In 1867, timber-getters and farmers, John and Gavin Steuart, established the Woondooma property which consisted of a few houses and a wharf on the northern banks of the Burnett River where Bundaberg North now stands. An official survey of the area was undertaken in 1869 by John Charlton Thompson, assisted by James Ellwood and Alfred Dale Edwards, and the town of Bundaberg was gazetted across the river on the higher, southern banks. The first Bundaberg land sale was held in Maryborough on 11 May 1870 where hotelier John Foley bought the original lots.


=== Sugar ===
Most of the early settlers exploited the timber and grew maize on their selections but as a result of the incentives of the Sugar and Coffee Regulations of 1864, sugar became a major component in Bundaberg's development from the 1870s.  Experimental sugar cane cultivation in the district was first grown at John Charlton Thompson's Rubyanna property in 1870 and the first sugar mill was built by Richard Elliot Palmer at his Millbank plantation in 1872. Bundaberg rapidly became an important sugar production region after the construction of the Millaquin Sugar Refinery at East Bundaberg by Robert Cran and his sons in 1882. The Fairymead sugar processing plant owned by the Young Brothers (Arthur, Horace and Ernest Young) opened in 1884 which further augmented Bundaberg's sugar producing capacity.
The initial 35 years of the sugar industry in Bundaberg was reliant on South Sea Islander workers, who were often blackbirded and kept in a status close to slavery. The first significant shipload of Kanaka labour, as it was called, to arrive on the Burnett River came in January 1872 aboard the Petrel. Allegations of kidnapping and wounding immediately arose concerning the recruitment of the Islanders on this vessel. Influential Bundaberg plantation owners were able to purchase recruiting ships in order to obtain labour directly from areas such as the Solomon Islands and the New Hebrides. The Young Brothers owned the Lochiel and the May vessels, the Cran family and Frederic Buss were the major investors in the Helena while the Ariel was co-owned by a number of local planters. While some of the recruitment was voluntary, violence and deception toward Islanders often took place. For example, the crew of the Helena fought a battle with the locals of Ambrym while taking Islanders from there.These labourers had to work for three years and were only paid at the end of this time period. Instead of cash, they usually received substandard goods and trinkets of minimal value as payment. Excessive mortality of the Islanders while serving their term of labour in the Bundaberg region was frequent. Overwork, poor housing, inadequate food, contaminated water supplies and a lack of medical care all contributed to the high death rate. Penalties for the plantation owners whose neglect resulted in these fatalities were rare and did not exceed a £10 fine. Importing South Sea Islander labour was made illegal in 1904 and enforced repatriation of these workers out of Bundaberg and other locations in Queensland occurred from 1906 to 1908.

The 1911 Queensland sugar strike occurred after the phasing out of South Sea Islander labour, with workers claiming that many plantation owners had substituted black indentured labourers (sometimes referred to as slaves) with white ones. Workers sought better accommodation, wages and conditions, including an eight-hour day and a minimum weekly wage of 30 shillings, including food. The mobilisation of unionists from Bundaberg to Mossman was a major achievement, with the 1911 strike lasting over seven weeks in Bundaberg where the town's economy was largely based on the sugar industry. The end result of the strike was a Commonwealth Royal Commission into the sugar industry in 1911–12, which had been initially requested by Harry Hall, a Bundaberg AWA organiser in 1908 with a petition signed by 1500 Bundaberg sugar workers. The Royal Commission, with ALF Secretary Albert Hinchcliffe as secretary, concluded the AWA demands had been justified. The union victory was a watershed in organised labour in Queensland and Australia.


=== Further progress ===

St Joseph's School opened on June 1876.With the passage of the Local Authorities Act 1902, Barolin Division became the Shire of Barolin and the Borough of Bundaberg became the Town of Bundaberg on 31 March 1903. On 22 November 1913, Bundaberg was proclaimed a City.In 1912 Bundaberg pioneering aviator Bert Hinkler built and successfully flew his own glider on Mon Repos beach. He also completed a noteworthy non-stop flight from London to Turin in 1920. The following year in 1921 Hinkler flew from Sydney to Bundaberg, non-stop, in a record breaking flight of 8 and a half hours, in the process beating a telegram he had sent to his mother, to warn her of his arrival.The Bundaberg War Memorial commemorating those who died in the Anglo-Boer War and World War I was unveiled by Major-General Charles Brand on 30 July 1921. The Bundaberg digger was imported from Italy and is constructed of Italian marble. The completed memorial, at a cost of £1,650, was the third most costly to be erected in Queensland. It is a major regional memorial and one of the two most intact digger memorials that remain in their original settings of intersections.
In the 1960s the township was completely flooded by the Burnett river. In 1967 Bundaberg celebrated its centenerary by producing a coin and opening The Bundaberg and District Historical Museum in the Bundaberg Botanical Gardens in Bundaberg North.


=== Bundaberg in the 21st Century ===

In December 2010, Bundaberg suffered its worst floods in 60 years, when floodwaters from the Burnett River inundated hundreds of homes.Two years later, in January 2013, Bundaberg experienced its worst flooding in recorded history as a result of Cyclone Oswald. Floodwaters from the Burnett River peaked at 9.53 meters. Over 4000 properties and 600 businesses had been affected by floodwaters, which moved in excess of 70 km/h. Two defence force Blackhawk helicopters were brought in from Townsville as part of the evacuation operation, which ultimately used an additional 14 aircraft.
On the 6th of April 2018 , Prince Charles visited Bundaberg Rum Distillery He stated, “I'm thrilled that this Distillery's proving to be the one that produces some of the most famous and special of all rums around the world."


== Heritage listings ==

Bundaberg has a number of heritage-listed sites, including:

Corner of Bargara Road and Zeilke Avenue, Kalkie: Kalkie State School
Bourbong Street, Bundaberg Central: Bourbong Street Weeping Figs
Bourbong Street, Bundaberg Central: Bundaberg War Memorial
Bourbong Street, West Bundaberg: Bundaberg War Nurses Memorial
Bourbong Street between Bundaberg Central and Bundaberg East: Kennedy Bridge
155a Bourbong Street: Bundaberg Post Office
184 Bourbong Street, Bundaberg Central: Bundaberg School of Arts
191–193 Bourbong Street, Bundaberg Central: Commercial Bank
13 Crofton Street: Bundaberg Central State School
30 George Street, South Bundaberg: St John's Lutheran Church
46 Johnston Street, Millbank: South Sea Islander Church
1 Maryborough Street, Bundaberg Central: Fallon House
corner of Maryborough and Woongarra Streets, Bundaberg Central: St Andrews Uniting Church
Quay Street, Bundaberg Central: Bundaberg Police Station
Quay Street, Bundaberg Central, to Perry Street, Bundaberg North: Burnett Bridge
Quay Street, from Bundaberg Central to Bundaberg East: Saltwater Creek Railway Bridge
Sir Anthony's Rest Street, Qunaba: Sir Anthony's Rest
17 Sussex Street, East Bundaberg: East Bundaberg Water Tower
Thornhill Street, Bundaberg North: Fairymead House
55 Woongarra Street: 4BU Radio Station
Cnr Woongarra and Maryborough streets, Bundaberg Central: Christ Church, Bundaberg The church sits adjacent to Buss Park which contains a memorial to Bert Hinkler.


== Population ==
In the 2016 Census, there were 69,061 people in Bundaberg (Significant Urban Area). 

Aboriginal and Torres Strait Islander people made up 4.3% of the population.
81.2% of people were born in Australia. The next most common countries of birth were England 3.2%, New Zealand 1.8%, Philippines 0.7%, South Africa 0.5% and Scotland 0.4%.
88.9% of people spoke only English at home. Other languages spoken at home included Mandarin 0.5%, Italian 0.4%, German 0.3%, Afrikaans 0.2% and Tagalog 0.2%.
The most common responses for religion were No Religion 26.3%, Catholic 18.7% and Anglican 18.6%.


== Climate ==
Bundaberg has a humid subtropical climate (Cfa) with wet hot summers and mild winters. The climate is rated the most equable of any Australian town or city and ranked 5th on a worldwide comparison. The mean daily maximum temperature is highest in January at 30.3 °C (86.5 °F), and the mean daily minimum is lowest in July at 9.9 °C (49.8 °F). The coldest temperature recorded in Bundaberg is −0.7 °C (30.7 °F), and some inland areas of Bundaberg sometimes experience frosts. The mean annual rainfall is 1,142.6 mm (44.98 in).


== Suburbs ==


== Economy ==

Subtropical Bundaberg is dependent to a large extent on the local sugar industry. Extensive sugar cane fields have been developed throughout the district. Value-adding operations, such as the milling and refinement of sugar, and its packaging and distribution, are located around the city. A local factory that manufactured sugar-cane harvesters was closed down after it was taken over by the US multinational corporation Case New Holland. Most of the raw sugar is exported. A bulk terminal for the export of sugar is located on the Burnett River east of Bundaberg.
Another of the city's exports is Bundaberg Rum, made from the sugar cane by-product molasses. Bundaberg is also home to beverage producer Bundaberg Brewed Drinks, Craft Brewery Bargara Brewing Company and Craft Distillery Kalki Moon.
Commercial fruit and vegetable production is also significant: avocado, banana, bean, button squash, capsicum, chilli, citrus, cucumber, custard apple, egg fruit, honeydew melon, lychee, mango, passionfruit, potato, pumpkin, rockmelon, snow peas, stone fruit, sweet corn, sweet potato, tomato, watermelon, zucchini. Macadamia nuts are also grown.Because of its high rate of unemployment, Bundaberg has been referred to as the "dole capital of Australia".


== Tourism ==
Tourism is an important industry in Queensland, and Bundaberg is known as the 'Southern Gateway to the Great Barrier Reef'. The city lies near the southern end of the reef in proximity to Lady Elliot and Lady Musgrave Islands. The nearby town of Bargara is an increasingly popular holiday and retirement destination.

The Mon Repos turtle rookery is located on the coast just east of Bundaberg. The northern bank of the Burnett River between the Don Tallon and Burnett bridges is home to a colony of flying foxes.Nearby beaches are popular with both locals and tourists. Moore Park Beach, to the city's north, has 20 kilometres (12 mi) of golden sandy beach. Beaches on the southern side of the Burnett River are (from north to south) the Oaks Beach, Mon Repos, Nielson Park, Bargara Beach, Kellys Beach, Innes Park and Elliott Heads.
Cania Gorge National Park, Deepwater National Park, Eurimbula National Park and Kinkuna National Park, located in the Bundaberg region are popular with campers and bush-lovers.Tours of the Bundaberg Rum distillery and attractions at Bundaberg Botanic Gardens, such as the 2 ft narrow gauge Australian Sugar Cane Railway, are also popular with tourists. The Mystery Craters, 35 unexplained water-filled holes in the ground, discovered in 1971 at South Kolan, are also a tourist attraction.Opened in 2002 by the former member for Hinkler Paul Neville, the Tom Quinn Community Centre gardens (a multiple "Bundy in Bloom" winner) is a site to be seen with local flora and fauna, its own cafe, marketplace, chapel, green house, training facilities, woodwork and indigenous nature section.Opened in December 2008, the Hinkler Hall of Aviation is an historical aviation tourist attraction that celebrates pioneer solo aviator Bert Hinkler. In 1928, Hinkler was the first person to fly solo from England to Australia. The museum includes an exhibition hall, featuring multi-media exhibits, a flight simulator, a theatre, five aircraft and the historic Hinkler House.
Other local attractions and events include the Whaling Wall, East Bundaberg Water Tower, Baldwin Swamp Environmental Park, Alexandra Park Zoo, Buss Park, Barrell House, Bundy in Bloom, Whale watching, reef tours of Lady Musgrave & Lady Elliiot islands, the Bundaberg Show, Bundaberg & Childers Regional Art Galleries, the Bundaberg Gliding school, Fishing Charters, the Bundaberg International Air Show, and the Woongarra Marine Park.


=== Museums and galleries ===
The Bundaberg region contains a variety of museums and art galleries that showcase the region's history and culture.
Hinkler Hall of Aviation
Hinkler House
Fairymead House and Sugar History Museum
BRAG, the Bundaberg Regional Art Gallery
CHARTS, the Childers Art Space
Bundaberg and District Historical Museum
Bundaberg Railway Museum
Bundaberg Rum Distillery Tours
Bundaberg Botanic Gardens containing the 'Hinkler Hall of Aviation', 'Hinkler House', 'Fairymead House' and the 'Bundaberg Steam Tramway Preservation Inc.'
Mystery Craters in South Kolan
Schmeider's Cooperage (Bundy Kegs)
Bundaberg Ginger Beer


=== Memorials ===
Bundaberg War Memorial
Hinkler Memorial


== Culture ==


=== Arts and entertainment ===
Bundaberg has two cinemas. The Reading Cinemas, on Johanna Boulevarde, west Bundaberg, and the Moncrieff Entertainment Centre (formerly known as the Moncrieff Theatre), located on Bourbong Street, central Bundaberg. The Moncrieff Entertainment Centre also holds live musical and theatrical performances year round.The Bundaberg Regional Art Gallery (BRAG) is a large multi-purpose visual arts facility located in central Bundaberg. The Bundaberg Regional Council operates a public library at 49 Woondooma Street.


=== Media ===
The NewsMail newspaper is published in Bundaberg from Monday to Saturday. It is available in print and online. 
Several community newspapers are also available including the Guardian, The Bugle & the Bundaberg Coastline

Bundaberg is served by three commercial television stations (Seven Queensland, WIN Television and Nine) and publicly owned services (ABC TV) and (SBS).
Local news coverage of Bundaberg and the Wide Bay is provided on all three commercial networks with both Seven Queensland's Seven Local News and WIN Queensland's WIN News half-hour bulletins airing at 6pm each weeknight. Southern Cross Austereo also airs brief local news updates at various intervals throughout the day on Channel 9, presented from studios in Canberra.


=== Popular culture ===
The city has been the location for three film sets:

the 1989 film, The Delinquents, starring Kylie Minogue, which was set in Bundaberg, but partly shot in Brisbane
the 1977 film, The Mango Tree
the 2014 film, Talking Back at Thunder, starring Steven Tandy.


== Sport ==

Most major Australian sporting codes are played in Bundaberg.


=== Australian Rules ===
Bundaberg has two current clubs playing in the AFL Wide Bay competition.

Across The Waves Bundaberg Eagles (merger of North Bundaberg and Souths/ATW Magpies)
Brothers Bulldogs (formerly West Bundaberg)


=== Basketball ===
Bundaberg has two professional teams competing in the ConocoPhillips Central Queensland Cup. They are the Bundaberg Autobarn Bulls (men) and Bundaberg Bears (women) and both feature local players.


=== Rowing ===
Bucca Weir, west of Bundaberg, is home to the Queensland State Rowing Championships every year in December.


=== Rugby League ===
The Bundaberg Rugby Football League is a nine-club competition run under the Queensland Rugby League's Central Division. Bundaberg competes in the Central Division's 47th Battalion Shield and the Bundaberg Grizzlies formerly competed in the Queensland Cup statewide competition.


=== Soccer ===
Bundaberg was home to the Bundaberg Spirit soccer club. They participated in the Queensland State League against other teams across Queensland.


=== Tennis ===
The Bundaberg & District Tennis Senior Association operates eleven floodlit clay courts in Drinan Park, Bundaberg West at the corner of George & Powers Streets. Competition tennis is played all year round. The Bundaberg & District Junior Tennis Association operates five artificial grass courts, and two granite courts.


== Community groups ==
The Bundaberg branch of the Queensland Country Women's Association meets at the QCWA Hall at 15 Quay Street, Bundaberg Central. The Hinkler branch of the Queensland Country Women's Association meets at the McDonalds Central Bundaberg on the corner of Woongarra & Targo Street, Bundaberg Central.


== Education ==
There are many public and private primary schools in Bundaberg. Bundaberg South State School opened on 11 May 1891, with an enrollment of 167 students and under the direction of William Benbow. The school celebrated its 125-year anniversary in 2016.Bundaberg has three public high schools, Bundaberg North State High School which opened on 29 January 1974, Bundaberg State High School which opened on 30 January 1912  (the second-oldest high school in Queensland that is still open) and Kepnock State High School which opened on 28 January 1964. There are also three main private secondary schools: Shalom Catholic College, St Luke's Anglican School, and Bundaberg Christian College.
There is a campus of the Wide Bay Institute of Technical and further education on Walker St and a campus of the Central Queensland University, located adjacent to the airport. There is a campus of the Booth College at the Salvation Army's Tom Quinn Community Centre.


== Transport ==

Bundaberg Airport has flights to Brisbane and Lady Elliot Island. The city is home to the Jabiru Aircraft Company, which designs and manufactures a range of small civil utility aircraft.
Bundaberg's bus operator is Duffy's City Buses. As of 2013, they transport over 1000 passengers in town services, and over 2000 passengers in school services every day. Routes extend to the beach suburbs of Burnett Heads, Bargara, and Innes Park. Stewart & Sons also operates bus services in the area.

Bundaberg is serviced by several Queensland Rail passenger trains, including the Tilt Train and is approximately four and a half hours north of Brisbane by rail. The closed North Bundaberg station formerly served the Mount Perry railway line and is now a museum.
Bundaberg is situated at the end of the Isis Highway (State Route 3), approximately 50 kilometres (31 mi) east of its junction with the Bruce Highway. Many long-distance bus services also pass through the city.
Bundaberg Port is located 20 kilometres (12 mi) northeast of the city, at the mouth of the Burnett River. The port is a destination for ships from Australia and overseas. It is predominantly used for shipping raw sugar and other goods related to that industry such as Bundaberg Rum.


== Health ==
Bundaberg is served by three hospitals. One public hospital, Bundaberg Base Hospital on Bourbong St, and two private hospitals, Friendly Society Private Hospital & Mater Hospital.
The Friendly Society Hospital has undergone a redevelopment and forms part of the GP Super Clinic Program.Bundaberg is also home to the Royal Flying Doctor Service, who regularly transport patients to Bundaberg from more rural and remote areas, as well as transferring critically ill patients to Brisbane for specialist care.


== Military ==
Bundaberg houses two military bases. Bundaberg Army Barracks and Training Ship (TS) Bundaberg. Bundaberg barracks contains mostly infantrymen and army cadets. TS Bundaberg houses mostly Cadet staff and Navy Cadets.


== Sister cities ==
The city council responsible for the Bundaberg Region maintains Sister City arrangements with two cities.


== People ==


=== Notable residents ===

Clint Bolton, association football player, Socceroo, 2 time A-League championship winning player
Joshua Brillante, Australian football player
David Carter, tennis player
Wayne Coles-Janess, producer and director, documentary and feature films
Allan Davis, Road racing cyclist, 2009 Tour Down Under Winner
Troy Elder, Hockey player
Steve Goodall, cyclist, 1978 Commonwealth Games Bronze Medalist, 1976 Olympian
Coen Hess, rugby league footballer
Bert Hinkler, pioneer aviator
Antonio Kaufusi, rugby league footballer
