Sudbury, officially Greater Sudbury (French: Grand-Sudbury), is a city in Ontario, Canada. It is the largest city in Northern Ontario by population, with a population of 161,531 at the 2016 Canadian Census. By land area, it is the largest in Ontario and the fifth largest in Canada. It is administratively a Unitary authority, and thus not part of any district, county, or regional municipality. The City of Greater Sudbury is separate from but entirely surrounded by Sudbury District.
The Sudbury region was inhabited by the Ojibwe people of the Algonquin group for thousands of years prior to the founding of Sudbury following the discovery of nickel ore in 1883 during the construction of the transcontinental railway. Greater Sudbury was formed in 2001 by merging the cities and towns of the former Regional Municipality of Sudbury with several previously unincorporated townships. Being located inland, the local climate is extremely seasonal with average January lows of around −18 °C (0 °F) and average July highs of 25 °C (77 °F).The population resides in an urban core and many smaller communities scattered around 330 lakes and among hills of rock blackened by historical smelting activity. Sudbury was once a major lumber centre and a world leader in nickel mining. Mining and related industries dominated the economy for much of the 20th century. The two major mining companies which shaped the history of Sudbury were Inco, now Vale Limited, which employed more than 25% of the population by the 1970s, and Falconbridge, now Glencore. Sudbury has since expanded from its resource-based economy to emerge as the major retail, economic, health and educational centre for Northeastern Ontario. Sudbury is also home to a large Franco-Ontarian population that influences its arts and culture.


== History ==
The Sudbury region was inhabited by the Ojibwe people of the Algonquin group as early as 9,000 years ago following the retreat of the last continental ice sheet. In 1850, a large tract of land, including what is now Sudbury, was signed over to the British Crown by local Ojibwe chiefs as a part of the Robinson Huron Treaty. In exchange the Crown pledged to pay an annuity to First Nations people, which was originally set at $1.60 per treaty member and increased incrementally; its last increase was in 1874, leaving it fixed at $4.French Jesuits were the first to establish a European settlement when they set up a mission called Sainte-Anne-des-Pins, just before the construction of the Canadian Pacific Railway in 1883. The Sainte-Anne-des-Pins church played a prominent role in the development of Franco-Ontarian culture in the region.

During construction of the railway in 1883, blasting and excavation revealed high concentrations of nickel-copper ore at Murray Mine on the edge of the Sudbury Basin. This discovery brought the first waves of European settlers, who arrived not only to work at the mines, but also to build a service station for railway workers.James Worthington, the superintendent of construction on the Northern Ontario segment of the railway, selected the name Sudbury after Sudbury, Suffolk, in England, which was the hometown of his wife Caroline Hitchcock. Sudbury was incorporated as a town in 1893, and its first mayor was Joseph Étienne aka Stephen Fournier.The American inventor Thomas Edison visited the Sudbury area as a prospector in 1901. He is credited with the original discovery of the ore body at Falconbridge. Rich deposits of nickel sulphide ore were discovered in the Sudbury Basin geological formation. The construction of the railway allowed exploitation of these mineral resources and shipment of the commodities to markets and ports, as well as large-scale lumber extraction.Mining began to replace lumber as the primary industry as the area's transportation network was improved to include trams. These enabled workers to live in one community and work in another. Sudbury's economy was dominated by the mining industry for much of the 20th century. Two major mining companies were created: Inco in 1902 and Falconbridge in 1928. They became two of the city's major employers and two of the world's leading producers of nickel.

Through the decades that followed, Sudbury's economy went through boom and bust cycles as world demand for nickel fluctuated. Demand was high during the First World War, when Sudbury-mined nickel was used extensively in the manufacturing of artillery in Sheffield, England. It bottomed out when the war ended and then rose again in the mid-1920s as peacetime uses for nickel began to develop. The town was reincorporated as a city in 1930.
The city recovered from the Great Depression much more quickly than almost any other city in North America due to increased demand for nickel in the 1930s. Sudbury was the fastest-growing city and one of the wealthiest cities in Canada for most of the decade. Many of the city's social problems in the Great Depression era were not caused by unemployment or poverty, but due to the difficulty in keeping up with all of the new infrastructure demands created by rapid growth — for example, employed mineworkers sometimes ended up living in boarding houses or makeshift shanty towns, because demand for new housing was rising faster than supply. Between 1936 and 1941, the city was ordered into receivership by the Ontario Municipal Board. Another economic slowdown affected the city in 1937, but the city's fortunes rose again with wartime demands during the Second World War. The Frood Mine alone accounted for 40 percent of all the nickel used in Allied artillery production during the war. After the end of the war, Sudbury was in a good position to supply nickel to the United States government when it decided to stockpile non-Soviet supplies during the Cold War.

The open coke beds used in the early to mid 20th century and logging for fuel resulted in a near-total loss of native vegetation in the area. Consequently, the terrain was made up of exposed rocky outcrops permanently stained charcoal black by the air pollution from the roasting yards. Acid rain added more staining, in a layer that penetrates up to 3 in (76 mm) into the once pink-grey granite.
The construction of the Inco Superstack in 1972 dispersed sulphuric acid through the air over a much wider area, reducing the acidity of local precipitation. This enabled the city to begin an environmental recovery program. In the late 1970s, private and public interests combined to establish a "regreening" effort. Lime was spread over the charred soil by hand and by aircraft. Seeds of wild grasses and other vegetation were also spread. As of 2010, 9.2 million new trees have been planted in the city. Vale has begun to rehabilitate the slag heaps that surrounds their smelter in the Copper Cliff area with the planting of grass and trees, as well as the use of biosolids to stabilize and regreen tailings areas.In 1978, the workers of Sudbury's largest mining corporation, Inco (now Vale), embarked on a strike over production and employment cutbacks. The strike, which lasted for nine months, badly damaged Sudbury's economy. The city government was spurred to launch a project to diversify the city's economy. Through an aggressive strategy, the city tried to attract new employers and industries through the 1980s and 1990s.

The city of Sudbury and its suburban communities, which were reorganized into the Regional Municipality of Sudbury in 1973, was subsequently merged in 2001 into the single-tier city of Greater Sudbury. In 2006, both of the city's major mining companies, Canadian-based Inco and Falconbridge, were taken over by new owners: Inco was acquired by the Brazilian company CVRD (now renamed Vale), while Falconbridge was purchased by the Swiss company Xstrata, which itself was purchased by Anglo–Swiss Glencore, forming Glencore Xstrata. Xstrata donated the historic Edison Building, the onetime head office of Falconbridge, to the city in 2007 to serve as the new home of the municipal archives. On September 19, 2008, a fire destroyed the historic Sudbury Steelworkers Hall on Frood Road. A strike at Vale's operations, which began on July 13, 2009, was tentatively resolved in July 2010. The 2009 strike lasted longer than the devastating 1978 strike, but had a much more modest effect on the city's economy than the earlier action—unlike in 1978, the local rate of unemployment declined slightly during the 2009 strike.The ecology of the Sudbury region has recovered dramatically, helped by regreening programs and improved mining practices. The United Nations honoured twelve cities in the world, including Sudbury, with the Local Government Honours Award at the 1992 Earth Summit to recognise the city's community-based environmental reclamation strategies. By 2010, the regreening programs had successfully rehabilitated 3,350 ha (8,300 acres) of land in the city; however, approximately 30,000 ha (74,000 acres) of land have yet to be rehabilitated.


== Geography ==

Sudbury has 330 lakes over 10 ha (25 acres) within the city limits. The most prominent is Lake Wanapitei, the largest lake in the world completely contained within the boundaries of a single city. Ramsey Lake, a few kilometres south of downtown Sudbury, held the same record before the municipal amalgamation in 2001 brought Lake Wanapitei fully inside the city limits. Sudbury is divided into two main watersheds: to the east is the French River watershed which flows into Georgian Bay and to the west is the Spanish River watershed which flows into the North Channel of Lake Huron.

Sudbury is built around many small, rocky mountains with exposed igneous rock of the Canadian (Precambrian) Shield. The ore deposits in Sudbury are part of a large geological structure known as the Sudbury Basin, which are the remnants of a nearly two billion-year-old impact crater; long thought to be the result of a meteorite collision, more recent analysis has suggested that the crater may in fact have been created by a comet.Sudbury's pentlandite, pyrite and pyrrhotite ores contain profitable amounts of many elements—primarily nickel and copper, but also platinum, palladium and other valuable metals.Local smelting of the ore releases this sulphur into the atmosphere where it combines with water vapour to form sulphuric acid, contributing to acid rain. As a result, Sudbury has had a widespread reputation as a wasteland. In parts of the city, vegetation was devastated by acid rain and logging to provide fuel for early smelting techniques. To a lesser extent, the area's ecology was also impacted by lumber camps in the area providing wood for the reconstruction of Chicago after the Great Chicago Fire of 1871. While other logging areas in Northeastern Ontario were also involved in that effort, the emergence of mining related processes in the following decade made it significantly harder for new trees to grow to full maturity in the Sudbury area than elsewhere.

The resulting erosion exposed bedrock in many parts of the city, which was charred in most places to a pitted, dark black appearance. There was not a complete lack of vegetation in the region as paper birch and wild blueberry patches thrived in the acidic soils. During the Apollo manned lunar exploration program, NASA astronauts trained in Sudbury to become familiar with impact breccia and shatter cones, rare rock formations produced by large meteorite impacts. However, the popular misconception that they were visiting Sudbury because it purportedly resembled the lifeless surface of the Moon persists.The city's Nickel District Conservation Authority operates a conservation area, the Lake Laurentian Conservation Area, in the city's south end. Other unique environmental projects in the city include the Fielding Bird Sanctuary, a protected area along Highway 17 near Lively that provides a managed natural habitat for birds, and a hiking and nature trail near Coniston, which is named in honour of scientist Jane Goodall.Six provincial parks (Chiniguchi River, Daisy Lake Uplands, Fairbank, Killarney Lakelands and Headwaters, Wanapitei and Windy Lake) and two provincial conservation reserves (MacLennan Esker Forest and Tilton Forest) are also located partially or entirely within the city boundaries.


=== Climate ===
Greater Sudbury has a humid continental climate (Köppen climate classification: Dfb). This region has warm and often hot, humid summers with long, cold and snowy winters. It is situated north of the Great Lakes, making it prone to arctic air masses. Monthly precipitation is equal year round, with snow cover expected six months of the year. Although extreme weather events are rare, one of the worst tornadoes in Canadian history struck the city and its suburbs on August 20, 1970, killing six people, injuring two hundred, and causing more than C$17 million in damages.The highest temperature ever recorded in Greater Sudbury was 41.1 °C (106.0 °F) on July 13, 1936. The lowest temperature ever recorded was −48.3 °C (−54.9 °F) on December 29, 1933.


== Administration ==


=== Municipal politics ===
From the city hall at Tom Davies Square, the city is headed by twelve council members and one mayor both elected every four years. The current mayor is Brian Bigger, who was elected in the 2014 municipal election. The 2011 operating budget for Greater Sudbury was C$471 million, and the city employs 2006 full-time workers.


=== Federal and provincial politics ===
The city is divided between the federal electoral districts of Sudbury and Nickel Belt in the House of Commons of Canada, and the provincial electoral districts of Sudbury and Nickel Belt in the Legislative Assembly of Ontario. The federal and provincial districts do not have identical boundaries despite using the same names; most notably, the Walden district of the city is located in Sudbury federally but in Nickel Belt provincially. The city is represented federally by Members of Parliament Paul Lefebvre and Marc Serré, both of the Liberal Party of Canada, and provincially by Jamie West and France Gélinas of the Ontario New Democratic Party. The provincial Ministry of Energy, Northern Development and Mines has its head office in the city.
Both federal and provincial politics in the city tend to be dominated by the Liberal and New Democratic parties. Historically, the Liberals have been stronger in the Sudbury riding, with the New Democrats dominant in Nickel Belt, although both ridings have elected members of both parties at different times.


== Communities ==

The city of Sudbury and its suburban communities were reorganized into the Regional Municipality of Sudbury in 1973, which was subsequently merged in 2001 into the single-tier city of Greater Sudbury.
In common usage, the city's urban core is still generally referred to as Sudbury, while the outlying former towns are still referred to by their old names and continue in some respects to maintain their own distinct community identities despite their lack of political independence. Each of the seven former municipalities in turn encompasses numerous smaller neighbourhoods. Amalgamated cities (2001 Canadian census population) include: Sudbury (85,354) and Valley East (22,374). Towns (2001 Canadian census population) include: Rayside-Balfour (15,046), Nickel Centre (12,672), Walden (10,101), Onaping Falls (4,887), and Capreol (3,486). The Wanup area, formerly an unincorporated settlement outside of Sudbury's old city limits, was also annexed into the city in 2001, along with a large wilderness area on the northeastern shore of Lake Wanapitei.


== Culture ==
Sudbury's culture is influenced by the large Franco-Ontarian community consisting of approximately 40 percent of the city's population, particularly in the amalgamated municipalities of Valley East and Rayside-Balfour and historically in the Moulin-à-Fleur neighbourhood. The French culture is celebrated with the Franco-Ontarian flag, recognized by the province as an official emblem, which was created in 1975 by a group of teachers at Laurentian University and after some controversy has flown at Tom Davies Square since 2006. The large francophone community plays a central role in developing and maintaining many of the cultural institutions of Sudbury including the Théâtre du Nouvel-Ontario, La Nuit sur l'étang, La Galerie du Nouvel-Ontario, Le Centre franco-ontarien de folklore and the Prise de parole publishing company. The city hosted Les Jeux de la francophonie canadienne in 2011.


=== Arts ===

The Sudbury Arts Council was established in 1974. Its mandate is to connect, communicate and celebrate the arts. It has an important role to provide a calendar of events and news about arts and culture activities. The city is home to two art galleries—the Art Gallery of Sudbury and La Galerie du Nouvel-Ontario. Both are dedicated primarily to Canadian art, especially artists from Northern Ontario.
The city's two professional theatre companies are the anglophone Sudbury Theatre Centre (STC) and the francophone Théâtre du Nouvel-Ontario (TNO). The STC has its own theatre venue downtown, while the TNO stages its productions at La salle André Paiement, a venue located on the campus of Collège Boréal. Theatre productions are also staged by students at Laurentian University's affiliated Thornloe faculty, by a community theatre company at Cambrian College, as well as by high school drama students at Sudbury Secondary School, Lo-Ellen Park Secondary School, St. Charles College and École secondaire Macdonald-Cartier with its troupe Les Draveurs. Sudbury also has numerous community theatre companies throughout the city, including its first and only for-charity theatre company, UP Theatre.Place des Arts, a new project to provide a community hub for the city's francophone cultural institutions including a 300-seat concert hall, a 120-seat theatre studio, an art gallery, a bistro, a gift boutique and bookstore, a children's arts centre and 10,000 square feet of studio space for artists, began construction in the downtown core in 2019.


==== Festivals ====
Cinéfest Sudbury International Film Festival, the city's primary annual film festival, has been staged in September each year since 1989. Two smaller specialist film festivals, the Junction North International Documentary Film Festival for documentary films and the Queer North Film Festival for LGBT-themed films, are also held each year. Mainstream commercial films are screened at the SilverCity theatre complex, which is also the primary venue for most Cinéfest screenings. Science North is home to an IMAX theatre which screens a program of IMAX films, the Cavern at Science North hosts some gala screenings during Cinéfest and screens science documentaries during the year, and the Sudbury Indie Cinema programs a repertory cinema lineup of independent and international films as well as organizing both the Junction North and Queer North film festivals.The city has hosted an annual Sudbury Pride festival since 1997,.
The Up Here Festival, launched in 2015, blends a program of musical performance with the creation of both murals and installation art projects throughout the downtown core.


==== Literature ====
Notable works of literature themed or set primarily or partially in Sudbury or its former suburbs include Robert J. Sawyer's The Neanderthal Parallax trilogy, Alistair MacLeod's novel No Great Mischief, Paul Quarrington's Logan in Overtime and Jean-Marc Dalpé's play 1932, la ville du nickel and his short story collection Contes sudburois. The city is also fictionalized as "Chinookville" in several books by American comedy writer Jack Douglas, and as "Complexity" in Tomson Highway's musical play The (Post) Mistress.Noted writers who have lived in Sudbury include playwrights Jean-Marc Dalpé, Sandra Shamas and Brigitte Haentjens, poets Robert Dickson, Roger Nash, Gregory Scofield and Margaret Christakos, fiction writers Kelley Armstrong, Sean Costello, Sarah Selecky, Matthew Heiti and Jeffrey Round, journalist Mick Lowe and academics Richard E. Bennett, Michel Bock, Rand Dyck, Graeme S. Mount and Gary Kinsman.


==== Music ====

Sudbury's most successful artists have predominantly been in the country, folk and country-rock genres. These include Robert Paquette, Kate Maki, Nathan Lawr, Gil Grand, Kevin Closs, CANO, Jake Mathews, Loma Lyns, Alex J. Robinson, Chuck Labelle, En Bref and Ox. The rap rock bands Project Wyze and Konflit Dramatik were also based in Sudbury. High-profile musicians play at the Sudbury Community Arena. Bell Park's outdoor Grace Hartman Amphitheatre and Laurentian University's Fraser Auditorium are sometimes used for summer bookings. Smaller touring indie rock bands, as well as some local musicians, are usually booked at The Townehouse Tavern, while local bands play a number of small music venues across the city. The city is also home to annual music festivals including the Northern Lights Festival Boréal, the Up Here Festival and La Nuit sur l'étang. The local Sudbury Symphony Orchestra performs six annual concerts of classical music. Sudbury is also home to the Blue Saints Drum and Bugle Corps, a youth drum corps active since 1952.
One of Stompin' Tom Connors' most famous songs, "Sudbury Saturday Night", depicts the hard-drinking, hard-partying social life of hard rock miners of Sudbury. Miriam Linna, who drummed in the Cramps, Nervus Rex and The A-Bones, was also born in Sudbury.


=== Attractions ===

Science North is an interactive science museum and Northern Ontario's most popular tourist attraction with around 288,000 visitors per year (as of 2018). It consists of two snowflake-shaped buildings on the southwestern shore of Ramsey Lake and just south of the city's downtown core. There is also a former ice hockey arena on-site, which includes the complex's entrance and an IMAX theatre. The snowflake buildings are connected by a rock tunnel, which passes through a billion-year-old geologic fault. Sudbury's mining heritage is reflected in another major tourist attraction, Dynamic Earth. This interactive science museum focuses principally on geology and mining history exhibitions and is also home to the Big Nickel, one of Sudbury's most famous landmarks. The city is also home to the Greater Sudbury Heritage Museums, a group of historical community museums, and a mining heritage monument overlooking the city's Bell Park.
The Inco Superstack was the tallest freestanding chimney in the world at 380 m (1,250 ft) until the construction of the Ekibastuz GRES-2 Power Station, and is currently the second tallest structure in Canada after the CN Tower. It is almost the same height as the roof of the Empire State Building.


=== Sports ===

Sudbury has many trails that are used year-round. The Sudbury Trail Plan grooms almost 1,200 km (750 mi) of trails for snowmobiles in the winter. There are approximately 200 km (120 mi) of non-motorized trails in the city, many of which were built by Rainbow Routes Association. There is 23 km (14 mi) of diverse hiking, biking, and jogging trails found in the Lake Laurentian Conservation Area near downtown. Other trails link Sudbury to areas outside of the city including the Trans Canada Trail, which passes through the city, and the Voyageur Hiking Trail. The city is also home to Sudbury Downs, a harness racing track located in Azilda.
There are a number of sports teams located in the city including the Sudbury Wolves who play at the Sudbury Community Arena. The Wolves are an ice hockey team with the Ontario Hockey League. The Sudbury Spartans football club have played in the Northern Football Conference since 1954. Laurentian University participates in the U Sports league by the Laurentian Voyageurs and the Laurentian Lady Vees. Cambrian College is represented in the Canadian Collegiate Athletic Association by the Cambrian Golden Shield, and Collège Boréal is represented by the Boréal Vipères. High school students compete in the Sudbury District Secondary School Athletic Association (SDSSAA), which is a division of Northern Ontario Secondary School Athletics (NOSSA). The city hosted the Pan American Junior Athletics Championships in 1980, the IAAF World Junior Championships in Athletics in 1988, the Brier: Canada's annual men's curling championships, in 1953 and 1983, the 2001 Scott Tournament of Hearts: the women's curling championship, and the 2010 Ontario Summer Games.
Greater Sudbury hosts a professional basketball team, the Sudbury Five, who play at the Sudbury Community Arena. The Five are owned by Sudbury Wolves Sports and Entertainment and began play in the National Basketball League of Canada in November 2018.


== Demographics ==
Greater Sudbury is the most populous municipality and census metropolitan area in Northern Ontario. In the 2016 census, the city's population increased to 161,531, a growth of 0.8 per cent over the 2011 population of 160,274. The median age is 41.1 years, slightly higher than the provincial average of 39.0 years. The census metropolitan area of Greater Sudbury (population 164,770) consists of the city, the town of Markstay-Warren and the adjacent First Nations reserves of Wahnapitei (population 116) and Atikameksheng Anishnawbek (population 386), formerly known as Whitefish Lake. As the Wahnapitei First Nation is an enclave within the city boundaries, it is also counted as part of Greater Sudbury's census division population of 161,647; this figure excludes Atikameksheng and Markstay-Warren, which are counted as part of the separate Sudbury District.
