The state university, the Universidad Michoacana de San Nicolás de Hidalgo, is the oldest university in the Americas, which has its origins in the college founded in 1540 by Vasco de Quiroga in Pátzcuaro, the Colegio de San Nicolás Obispo. This school was founded to train priests and missionaries for work in Michoacán. The school gained a royal seal and patronage in 1543. In 1566, colonial religious authorities took over the school and in 1574, academics here were under the jurisdiction of the Jesuits. With the episcopal seat changed to Valladolid, the school moved also in 1580 and was fused with the already existing Colegio de San Miguel Guayangareo. The school was reformed in the 17th century and its curriculum was redesigned in the 18th to include courses in philosophy, religious law, civil law and other subjects.  At the beginning the 19th century, the school became one of New Spain's main centers of learning and academia, producing scholars such as a Miguel Hidalgo y Costilla, José Ma. Morelos, José Sixto Verduzco, José María Izazaga and Ignacio López Rayón, most of whom would have a role in the upcoming Mexican War of Independence. The school closed during the war but was reopened in 1847 with the name Primitivo y Nacional Colegio de San Nicolás de Hidalgo, focusing more on secular studies such as chemistry, physics, mathematics, biology, etc. based on the European university model.

After the Mexican Revolution, the school was reorganized and renamed again to the Universidad Michocana de San Nicolás de Hidalgo in 1917, which consolidated a number of other schools and disciplines into the new organization.Nowadays, the Universidad Michoacana de San Nicolás de Hidalgo is the most important university in the state of Michoacán. It has been rated also as one of the Top 10 best public universities in Mexico. The university has recently expanded to other smaller cities in the state other than Morelia, such as Uruapan, Apatzingán, Ciudad Hidalgo, Lázaro Cárdenas, Coalcoman, Huetamo, Tangancicuaro and Zitacuaro. In 2011, according to the INEGI census, the university had 55,546 regular students.
Other universities in the city include Instituto Tecnológico de Morelia (ITM), Universidad Tecnológica de Morelia (UTM), Instituto Michoacano de Ciencias de la Educación, Centro de Investigación y Desarrollo del Estado de Michoacán (CIDEM), the Morelia Campus of the National Autonomous University of Mexico, Instituo de Estudios Superiores de la Comunicación (IESCAC), Universidad Pedagógica Nacional, Conservatorio de las Rosas, Universidad Vasco de Quiroga, Universidad Latina de America, Universidad La Salle Morelia, Instituto Tecnológico y de Estudios Superiores de Monterrey- Campus Morelia ITESM, Universidad Sor Juana Inés de la Cruz and many other different private universities.


== Sports ==

Morelia is represented by their soccer team, Monarcas Morelia, in the Liga MX.
Monarcas Morelia was founded in 1950 on a field outside the city where a monument to Lázaro Cárdenas is now located. The team's original name was Club Deportivo Morelia and was owned by Eucuario Gómez. The club's colors are the city's flag colors red and yellow because Morelia is known to be the most Spanish city in Mexico. 
was nicknamed “Amarillo”(Yellow) During the 1956–57 season, when the club won the right to play in the 1st division in which they played in their first tournament for the Copa México against Club América.
The club descended into the 2nd division again in 1968 and experienced tough times during the early 70s. By the end of the 1973–74 season the team was completely restructured by 32 Morelia Businessmen who acquired the team. After 13 years in the 2nd division, the team finally returned to 1st division play in 1981 and by the mid-1980s was competitive and reaching the Liguilla (playoffs) regularly.
Following many years of playing at Estadio Venustiano Carranza, the completion of Estadio Morelos in 1989 gave the team a new home. In 1996, the team was acquired by TV Azteca and the name Monarcas (Monarchs) Morelia was adopted in 1999 because of the three Spanish Monarchs shown in the flag of Morelia. The team won its first championship during the Invierno 2000 season and by mid-decade, was playing in international competition such as the Copa Libertadores and the Liga de Campeones de la CONACACAF (CONCACAF Champions League). The team's latest success came during the 2010 North American SuperLiga tournament, which Monarcas won over the New England Revolution on September 1, 2010, at New England.
The team closed the Apertura 2010 tournament of the Primera División de México (Mexico's 1st division), failing to make the "liguilla".


== Transportation ==

Morelia is three or four hours from Mexico City via the Atlacomulco-Maravatío-Morelia highway and is connected by highways to the states of Mexico, Querétaro, Guanajuato and Jalisco. It is connected to the Michoacán coast via highway 200 that passes through Uruapan to the port of Lázaro Cárdenas. General Francisco Mujica International Airport or Morelia International Airport (IATA: MLM, ICAO: MMMM) is an international airport at Morelia, Michoacán, Mexico. The airport handles both domestic and international flights, with connections to Mexico City, Uruapan, Lázaro Cárdenas, Acapulco, Zihuatanejo, Guadalajara, Monterrey, Tijuana and several destinations in the United States. The airport is named after a former governor of the state of Michoacán.


== The municipality ==

As the municipal seat, Morelia is the governing authority of 423 other communities, almost all of which are small communities of between three and 1,000 people, with 89% of the municipality's population of 684,145 people within the city itself. The municipality covers a territory of 1,199.02 square kilometres (462.94 sq mi) and borders the municipalities of Tarímbaro, Chucándiro, Huaniqueo, Charo, Tzitzío, Villa Madero, Acuitzio, Lagunillas, Coeneo, Tzintzuntzan and Quiroga.Much of the municipality is in the Guayangareo Valley between two rivers: the El Grande and the El Chiquito. Guayangareo means "large hill with a flat side." The municipality's territory is rugged and dominated by peaks such as Punhuato, El Zapote and the Otzumatlán mountain range, with the highest peak being Quinceo with an elevation of 2,787 metres (9,144 ft). The municipality belongs to the Lerma-Santiago river hydraulic region, with the main rivers being the El Grande and the El Chiquito. There are a number of streams including the Zarza and Pitaya. The most important dam here is Cointzio, with other smaller ones being Umécuaro, Laja Caliente and La Mintzita.
Vegetation outside the city varies based on elevation and the type of soil. Mountainous areas are mostly covered in conifers while lower and drier areas have trees such as mesquite. To the south of the city is the Lázaro Cárdenas Forest, which is an ecological reserve. Animal life mostly consists of small mammals, with coyotes being the largest, birds of prey and some reptiles.The growth of the city of Morelia is having a negative impact on the surrounding forested area. This is particularly problematic in the area north of the city, which belongs to the Lake Cuitzeo basin, and is a main recharge area for the city's aquifer. The forested areas around the city are also important for the city's air quality and as a breeding place for pollinating insects needed for agriculture. UNAM has been documenting the species in these forests with the aim of getting them declared as biological reserves.One industrial area is the Ciudad Industrial de Morelia, which mostly houses small and medium-sized enterprises. Some of the products manufactured here include cooking oil, flour, cement, plastics, bottling and candies. Tourism is a rising component of the economy, taking advantage of area's colonial heritage, smaller traditional communities, natural areas and archeological zones such as Santa María de Guido in the city, Barranca de los Lobos in Teremendo, Nahuatl Sanctuary and Catrina in Capula. However, it has not been developed sufficiently to be a major contributor. Tourism accounts for the main economic activity in Morelia. Morelia contains many ecological areas, such as the Rio Bodoquero, which attracts majority of tourists and local residents. Unfortunately, due to Mexico's rising crime in drug trafficking within the cartels, this can provide a grave disincentive in the tourism sector for Morelia.According to Standard & Poor's report for November 2009, the government of Morelia maintains an adequate development budget, backed by relatively high income and low debt. It is rated on a national scale for Mexico as A+. The economy is projected to be stable with the government keeping control of expenses.


== References ==


== External links ==