Morelia (Spanish pronunciation: [moˈɾelja]; from 1545 to 1828 known as Valladolid) is a city and municipality in the north central part of the state of Michoacán in central Mexico. The city is in the Guayangareo Valley and is the capital and largest city of the state. The main pre-Hispanic cultures here were the Purépecha and the Matlatzinca, but no major cities were founded in the valley during this time. The Spanish took control of the area in the 1520s. The Spanish under Viceroy Antonio de Mendoza founded a settlement here in 1541 with the name of Valladolid, which became rival to the nearby city of Pátzcuaro for dominance in Michoacán. In 1580, this rivalry ended in Valladolid's favor and it became the capital of the colonial province. After the Mexican War of Independence, the city was renamed Morelia in honor of José María Morelos, who hailed from the city. In 1991, the city was declared a UNESCO World Heritage Site for its well-preserved colonial buildings and layout of the historic center.


== History ==

Human settlements in the Guayangareo Valley in which Morelia is located have been dated back as far as the 7th century.  Artifacts found here have shown Teotihuacán culture influence on early cultures in this area. In the 12th century, the Purépecha arrived in the valley. They dominated it politically for the rest of the pre-Hispanic period but did not build any major settlements here. Between the 12th and the 15th century, Matlatzincas moved into the area with permission of the Purépechas, who were based around nearby Pátzcuaro Lake. The main Matlatzinca settlement was where Júarez Plaza in the city is today.The Spanish pushed into the Guayangareo Valley between 1525 and 1526, headed by Gonzalo Gómez. In the 1530s, the area was evangelized by Franciscans such as Juan de San Miguel and Antonio de Lisboa.What would become the city of Morelia was founded by Viceroy Antonio de Mendoza and a number of encomenderos in 1541, who first named it Nueva Ciudad de Mechuacan (New City of Michoacán). The newly founded settlement grew quickly, prompting Vasco de Quiroga to go to Spain and procure for rival settlement Pátzcuaro the title of city and a seal, to prevent “new city” from becoming the capital of Michoacán. The action also required that the new settlement change its name to Guayangareo. In 1545, Guayangareo gained city status from Charles V in 1545 with the name of Valladolid, after the hometown of Antonio de Mendoza. This was part of a power struggle between Antonio de Mendoza and Vasco de Quiroga over the province of Michoacán. During Quiroga's lifetime, he managed to keep political and ecclesiastical power in Pátzcuaro despite the viceroy's and encomenderos’ objections. However, Quiroga died in 1565. By 1580, both political and religious authority (Episcopal see) had been transferred to the city of Valladolid, moving the College of San Nicolás, which Vasco founded and laying the groundwork for establishing a new cathedral for the province.The 17th century saw growth for Valladolid, with the construction of the cathedral and aqueduct. The cathedral was begun in 1640 (finished in 1744) and the aqueduct in 1657. Both of these structures would later be worked on in the 18th century by Master Architect of Valladolid, Diego Durán. During the 17th century, many of the city's large churches and monasteries were established, such as the monasteries of San Francisco, San Agustin, El Carmen and La Merced as well as the convents of Las Rosas, Las Monjas and Capuchinas. Churches include La Compañía, San Juan and La Cruz, but the most important structure built during this time period was the cathedral. The location of this cathedral defined the composition and development of the city from then on.At the end of the colonial period, Valladolid was a small city with about 20,000 inhabitants. It was also an educational center with four important schools such as the College of San Nicolás. These schools would turn out scholars such as Miguel Hidalgo y Costilla and José María Morelos y Pavón, who were sympathetic to the new republican ideas coming out of post-revolution France and United States. Demonstrations against Spanish rule had been occurring in the town in 1809, culminating in the Conspiracy of 1809. This plot was discovered,  with the main conspirators were arrested and sent to other parts of New Spain, which helped to spread republican ideas.One year later, after forming his army in Guanajuato state, Miguel Hidalgo y Costilla arrived and took over the city, proclaiming the end of slavery in Mexico. The city was taken back by royalist forces soon after. Morelos came here to try and dislodge the royalists but was defeated by Agustín de Iturbide. Another prominent figure in the war, Mariano Matamoros was shot by firing squad on the city's main square in 1814. The city remained in royalist hands until 1821, Iturbide, who had switched sides, and Vicente Guerrero entered the city with the Trigarante Army.In 1828, the newly created state of Michoacán changed the name of the city from Valladolid to Morelia, in honor of José María Morelos y Pavón. This is the official name it retains today, although its Purépecha name remains Uaianarhio and has had nicknames such as City of Pink (Cantera) Stone, the City of Open Doors, The Rose of the Winds, The Garden of New Spain and religiously as Morelia of the Sacred Heart of Jesus. The city became a municipality in 1831.The later 19th century is marked by struggles between liberal and conservatives forces in Mexico. During the Revolution of Ayutla, the city was taken by rebel forces under Epitacio Huerta and General García Pueblita, but was taken back in 1855 by forces under Antonio López de Santa Anna. Rebels attacked Santa Anna's troops again a year later. French troops imposing imperial rule entered the city in 1863, with the republican forces moving capital of Michoacán to Uruapan while conservative families in Morelia pledged support for emperor Maximilian I, who then visited the city. In 1867, the city is taken by republican general Nicolás de Régules and the capital of Michoacán returned to Morelia.  In 1869, during a rebellion against Benito Juárez’s government, General Epitacio Huerta attacked government positions in the city but were beaten back by forces under Mariano Escobedo.

The first factories were opened in the city between 1868 and 1870, along with the first telegraph line. The railroad followed in 1883, as well as street cars.In 1910, celebrations are held for the centennial of Independence but tensions are high in the city due to the shortage of grain and the continuation of President Porfirio Diaz in power. One year later, revolutionaries loyal to Francisco I. Madero are welcomed into the city. In 1914, the capital was moved from Morelia to the city of Tacámbaro. The city was then taken by forces under General Sánchez in the same year, and by forces loyal to Francisco Villa in 1915.In 1920, the Palace of the State Government was briefly taken over by farm workers and others from all over the state. Isaac Arriaga is assassinated here in 1921. The city is attacked again by rebels calling themselves “Delahuertistas” in 1924. The fight mostly occurs in the main plaza with the city defended by General Lopez, Garcia and Avila Camacho.During the 1960s the street vendors were removed from the historic center of the city, and palm trees that lined the Avenida Madero, the main east-west road, were cut down. In 1966, there was a student revolt at the state university which was put down by the army.The 1970s and 1980s are marked by construction including the Periferico bypass ring around the city. During the 1980s, damage due to geographic faults, exacerbated by falling water tables from groundwater pumping is noticed. This problem is similar to problems faced by other cities on the Trans-Mexican Volcanic Belt such as Querétaro and Mexico City.In 1991, the city was declared a UNESCO World Heritage Site due to its well-preserved colonial architecture. In 2001, street vendors were moved again from the historic center to make the area more tourist-friendly. Traffic was rerouted from here as well with the construction of new bypasses. In 2006 and 2007, many of the plazas and gardens in the historic center were remodeled.In 2008, eight people were killed in a grenade attack. 
In 2009, the Morelia metropolitan area was tentatively established as consisting of the municipalities of Zinapécuaro, Álvaro Obregón, Charo, Tarímbaro and Morelia. This initial determination was made by the Secretary of Urbanism and Environment, with further refinements to be made as the municipal presidents of these entities meets to discuss limits, strategies and further actions. One of these actions has been to establish a formal commission to administer the area.


== Geography ==


=== Climate ===
Under the Köppen climate classification, Morelia has a subtropical highland climate (Cwb), with warm-to-hot days and cool nights year round due to its high elevation. Most precipitation falls during the summer rainy season. Average monthly temperatures are between 14 and 22 °C (57 and 72 °F), with maximum temperatures of 38.3 °C (100.9 °F) in the summer of 1998 and the lowest temperature of −5.2 °C (22.6 °F) in January 1985.


== Government ==


== Notable sites ==

Almost all of Morelia's notable sites lie in its historic center, due to its history. This historic center is roughly equivalent to the original layout of the city when it was founded in 1541, and most of this layout has survived intact to the present day. Anticipating growth, this original layout had very wide streets and plazas for the time, with streets systematically arranged to allow for elongation. The streets are systematically laid out, but not rigidly squared, with most having gentle curves designed into them. Most of the grandest structures were completed during the 18th century, including the facade and bell towers of the cathedral, the Colegio Seminario (today the State Government Palace), La Alhóndiga (today part of the Palace of Justice) and numerous private mansions. During the same time period, infrastructure such as the city's aqueduct and various plaza fountains were constructed. The Mexican federal government lists 1,113 buildings built from the 16th to the 20th century as having historical value. The buildings encompass the various architectural styles that have been fashionable in Mexico, but nearly all are built of pink cantera stone, which gives the city a unified appearance. Several measures were taken in the 20th century to preserve this part of the city. In 1956, the city enacted regulations to preserve the historic center's colonial buildings. In 1990, President Carlos Salinas de Gortari issued a decree making the historic center of Morelia a national historic monument. In 1991, the same area was declared a World Heritage Site by UNESCO, which covers 200 of the area's historic buildings.

The heart of the historic center is the cathedral and its surrounding plazas: the Plaza de Armas, also known as the Plaza de los Mártires, the Juárez Plaza and the Melchor Ocampo Plaza.  The largest plaza is the Plaza de Armas, which has been remodeled several times since it was designed in the 16th century. It has been renamed several times as well, from “de la Constitución,” “de la República” to the current official name of “de los Mártires” but popularly it retains the name of “Plaza de Armas.” The alternate name, Plaza de los Mártires (Plaza of the Martyrs) is in honor of people like Mariano Matamoros, Guadalupe el Salto and others who were executed here during the Mexican War of Independence and later in 1830 during political unrest. The plaza is surrounded by portals, and colonial era buildings such as the Banca Promex, the Virrey de Mendoza Hotel, the Juan de Dios Gomez House and the old town hall, also called the Michelena House. Until the late 19th century, a monument to Morelos had been here, but this was removed along with the fountain and replaced by a kiosk that was brought from London and remains to this day. The last remodeling of the plaza occurred in the mid 20th century under the direction of architect and painter Juan O'Gorman. The Melchor Ocampo Plaza was originally named “Plaza de la Paz.” In the late 19th century, this plaza was remodeled and a monument to Ocampo sculpted by Primitivo Miranda was placed here. Another statue by Miranda, this one of Jose Maria Morelos y Pavon was placed in the small plaza on the west side of the cathedral and named the Morelos Plaza.

The first church on the Cathedral site was built in 1577, which was a modest structure of adobe and wood. Many years later, this structure would be almost completely destroyed by a fire. Originally, the Cathedral of Michoacán was in Pátzcuaro in a church that now is the Basilica of Nuestra Señora de la Salud. When cathedral status was moved from there to Valladolid in 1580, the city became the civil, religious and cultural capital of the territory. In 1660, Bishop Marcos Ramírez del Prado, placed the first stone of the new cathedral, which was designed by Vicenzo Baroccio. Of the major churches of the early colonial period, only this and the Mexico City Cathedral do not face west, as was customary. The Cathedral of Michoacán is also unique in that it is dedicated to the Transfiguration of Jesus, rather than some form of the Virgin Mary. The cathedral was consecrated in 1705, even though it was not yet finished. The facade as a relief of the transfiguration of Christ and the east nave is dedicated to the sheepherders and Wise Men of the Nativity. Built of pink cantera stone,  the cathedral's two 60-meter-high (200 ft) towers still dominate the skyline of the city, and are the second tallest Baroque towers in Mexico.The cathedral's official name is Cathedral of the Divine Savior of Morelia. Since it was built over the 17th and 18th century, elements of Neoclassical, Herreresque and Baroque architecture can be seen in the building. The facade of the cathedral is mostly decorated in pilasters rather than columns and relieves rather than sculptures. There are more than two hundred pilasters but no columns, the only church built this way during the colonial period.Inside, there are a number of elements that stand out. The baptismal font was made of silver in the 19th century and was used to baptize Mexico's first emperor, Agustín de Iturbide. A three-meter-tall (9.8 ft) monstrance made of pure silver adorns the main altar and is unique in that it can be disassembled and reassembled. Also on the altar is a 16th-century cornstalk paste image of the Señor de la Sacristía (Lord of the Sacristy), whose gold crown was a gift from Philip II of Spain. A newer addition is the organ from Germany, which has 4,600 pipes and is one of the largest in Latin America. On Saturdays at 8:45 pm the cathedral sponsors a sound-and-light show.In front of the cathedral is the old Seminario Tridentino de San Pedro, one of the educational institutions of the colonial city. Today it is the Palace of the State Government. It was constructed by Thomás de Huerta in the latter 18th century. The school had graduates such as José María Morelos and Melchor Ocampo. The facade is mostly the original, with only the seal of Mexico added in the mid 19th century, when this building was converted for use as the home of the Michoacán state government. Inside are three courtyards with the walls of the first courtyard covered in murals done by Alfredo Zalce in the 1960s.

Traslado de las Monjas in the musueumThe Casa de la Cultura is also the home of the Instituto Michoacano de Cultura (Michoacan Institute of Culture) and the State Secretary of Culture. It is in the former monastery of Nuestra Señora del Carmen Descalzo, which was established in 1593. The church building was probably finished in 1619, the date inscribed on the south portal, but monastery construction continued into the 17th century. In the 19th century, the Reform Laws expropriated the cloisters and living quarters but left the church to its religious function, which continues to this day. After expropriation, the monastery area was first used as the home of the Primer Cuerpo de Caballería del Estado (First Cavalry Corps of the State). Over time the church fell into disrepair but was restored in the 1940s. The rest of the complex was restored and converted to its present function starting in 1977.The Orquidario of Morelia is an orchid museum which houses approximately 3,400 species of the flower. The botanical garden consists of three greenhouses with some outside space. The museum is managed by SEMARNAT as part of a program to preserve wild species. The botanical garden has a surface area of over 990 meters2 and was founded in 1980.The Museo Regional Michoacano (Regional Museum of Michoacán) was founded in 1886 and its design was heavily influenced by French ideas of museum design of the time. It is housed in a building that belonged to Emperor Maximilian I, and is of ornate Baroque design. Most of the exhibits are about the history of the region with rooms dedicated to pre-Hispanic artifacts and colonial art. One noted piece is the painting called “Traslado de las Monjas” which is considered to be the finest work produced in Michoacán during the colonial period. Other important works include the original volume of the Voyage de Humboldt et Bonpland, edited in Paris in 1807 and the murals done by Alfredo Zalce, Federico Cantú and Grace Greenwood. There are also interactive exhibits on the origins of the earth and life. The museum also has conference rooms, a library and a reading room.

The Museo del Estado (The State Museum) is dedicated to the state's past and present. It was opened in 1986 and divided into three sections – archeology, history and ethnology of the state. There is also an exhibit of the old Mier Pharmacy with its equipment from 1868. The museum is a mansion dating from the 18th century.The Museo de Arte Colonial (Museum of Colonial Art) holds a collection of documents, old books, religious ornaments and maps from the colonial period. Its main attraction is its collection of more than 100 figures of Christ done in cornstalk paste. These figures were created by indigenous artists, starting under the direction of Vasco de Quiroga, between the 16th and 19th centuries. There are also paintings done by Miguel Cabrera and José Padilla from the 18th century. The museum is in an old Baroque residence from the 18th century. Prior to the building's use as a museum, it was the site of the first official government press in the state, founded in 1821.The Casa Museum José María Morelos y Pavón (José María Morelos y Pavón House Museum) contains a collection of items from the colonial and early independence periods of Mexico's history, including articles that belonged to Morelos himself. Morelos bought the house in 1802, but did not live there much, especially in the years just before and during the Mexican War of Independence because of his involvement with the movement. In 1933, the house was declared a national monument and in 1939 became the property of INAH to be converted into this museum. Later, the building underwent another round of restoration work and was re-inaugurated in 1991. The lower level is mostly dedicated to Morelos with the rooms on the upper level dedicated to the war in general. The museum is also the archive of the Bishopric of Michoacán and contains documents from the 16th to the 20th century.

The Casa Natal de Morelos (Morelos’ Birthplace) is the house where José María Morelos y Pavón was born in 1765. The building is a large mansion with a Neoclassic facade and a Baroque interior. In 1888, the original building was destroyed to build a farmhouse. This is the building that has been restored and turned into a museum in 1964, for the coming bicentennial of Morelos’ birth. The museum contains documents and belongings of Morelos including ones he signed, money he had coined, paintings and a large library.The Museo de la Máscara (Mask Museum) presents two different mask collections, totaling more than 165 examples from cultures in twenty Mexican states. It is located in the Casa de Artesanias de Morelia (Handcraft House of Morelia).The Museo de Arte Contemporáneo Alfredo Zalce (Alfredo Zalce Museum of Contemporary Art) mostly contains works done by Alfredo Zalce and Efraín Vargas, both renowned Michoacán painters. It also holds temporary exhibits by Mexican and international artists.The Plaza Monumental de Morelia was established in 1951, which was destined exclusively for bullfights. Nowadays, the ring also hosts concerts, lucha libre, and weddings.The city Aqueduct was first documented in the year 1549. As it was uses to navigate fresh water to the required destination that the people could get it from. The water system was made of used wood from canoes in the area to create the base structure during its construction. As years passed with the usability of the aqueduct constantly changing, there was an incident that occurred in the year 1784. The incident was that part of the Morelia aqueduct foundation collapsed, leaving hundreds without access to the water. On October 21, 1785, a concerning documented the reconstruction of the aqueduct, a man named Fray Antonio de San Miguel volunteered make a plan of the reconstruction of the structure. With Fray Antonio plans they completely reconstructed the arches and added fixtures to fix up the previous damages. As the damages were completed the aqueduct was used until it stopped functioning in the year 1910, it still remains in standing to this day. The whole Aqueduct structure consisted of 253 arches (some have collapsed during the years), 700 meters tall (2297 ft).


== Festivals ==
The Festival Internacional de Música de Morelia is an annual event that was begun in 1988 by Bernal Jiménez, who had the dream of making Morelia the “Salzburg of Americas”. The festival consists of more than forty concerts with over 500 artists participating. It has become the largest music festival in Morelia, with private and government sponsors, esp. CONACULTA. Concerts include those by chamber orquestras, choirs, ensambles, trios and soloists such as pianist Joanna MacGregor and the Britten Symphony. Each year, a different country is the “special guest,” which in 2009 was the United Kingdom. In that year, some of the participants included the London Symphony Orchestra, the Brodsky Quartet, La Britten Symphony Orchestra, the Coro Nova Scholla Gregoriana Di Verona of Italy, and violinist Tanya Anisimova from Russia. Participants from Mexico included the National Symphonic Orchestra, the Orquesta Sinfónica de Minería and flautist Horacio Franco.The International Summer Opera Festival of Morelia (ISOFOM) started in 2017 and has attracted thousands of audience members to its opera galas and concerts. Students come from all over the world to study with the renowned faculty and experience the life in Morelia for three weeks each June. In 2019, the festival presents its first full-length opera Falstaff by Verdi, in the beautiful Teatro Ocampo, as well as a Gala evening in the Palacio Clavijero. The mission of ISOFOM is to bring young up-and-coming performers of opera to the Michoacan audiences and share with them that special art form in landmark locations all across Morelia, at an affordable price.

The Festival Internacional de Cine de Morelia was begun in 2003, and is mostly dedicated to Mexican cinema, showcasing up-and-coming directors and productions. The majority of activities take place in the Cinépolis Morelia Centro, but also includes other theaters, auditoriums and public plazas.
Morelia is the site of the annual Zapata Vive Morelia Festival, which celebrates the life of Emiliano Zapata with cultural and political activities. The purpose of the event is to promote exhibitions by artistic, cultural and social organizations from the state of Michoacán and other parts of the country. Events are spread out over several days and include ones such as concerts, round tables and information sessions. The event encourages those organizations who work with the lower social classes and are politically left to participate.The Festival de Escala is an annual event dedicated to promoting rock climbing in the municipality at places such as El Paredón de la Noria, just south of the city proper.A popular festival that features a 3-day Salsa competition in the heart of Morelia is called "SalsaMich". Typically held in March, the festival brings Salsa dancers from all across the country to Morelia to compete for prizes.


== Education ==

During the colonial period the city had four major educational institutions, the Colegio Seminario Tridentino, the Colegio de San Nicolás, the Colegio de los Jesuitas and the Colegio de las Rosas.
