Llyswen is a small section west of Union Ave, east of Ruskin Drive, south of Ward Ave and north of Plank Road. This low-lying area is almost entirely suburban, with small areas of multiple residential, residential commercial, neighborhood business, and highway business. The Llyswen Historic District was added to the National Register of Historic Places in 2002.


==== Garden Heights ====
Garden heights are the area east of Plank Road, northwest of Lakemont and south of Frankstown Road. Garden Heights is mostly single residential but is highway business along Plank Road, residential commercial along with parts of Frankstown Road and Logan Boulevard, and light industrial south of Logan Boulevard.  This is the only section of the defined city limits that Interstate 99 actually passes through.


==== Calvert Hills ====
Calvert Hills is a small area between 12th Street and 16th Street north to south and 17th Ave to the east. This is the area of multiple, single and suburban residential on the hills around the former Keith Junior High School, which is now an apartment complex.


==== 5th Ward ====
The 5th Ward and Westfall is the area on the west side of the tracks south of Calvert Hills and north of the Curtin  Neighborhoods. It borders a park to the west also called Westfall.


==== Newburg and Red Hill ====
The northwestern corner of 5th Ward is known as Newburg, with Red Hill being farther north up Route 36. The boundaries for the southern area are 20th Street to the north and 10th Ave to the south. The 5th Ward is a mix of single and suburban residential.


== Demographics ==
As of the 2010 census, the city was 93.8% White, 3.3% Black or African American, 0.1% Native American, 0.4% Asian, and 2.0% were two or more races. 1.3% of the population was of Hispanic or Latino ancestry. The 2000 Census reported the following predominate ancestry/ethnicities: German (35%), Irish (17%), Italian (12%), English (7%), Polish (4%), Black or African American (2%), Dutch (2%), Scotch-Irish (2%), French (2%), Scottish (1%), Pennsylvania German (1%), Welsh (1%), Swedish (1%), Slovak (1%).
As of the census of 2000, there were 49,523 people, 20,059 households, and 12,576 families residing in the city. The population density was 5,069.7 people per square mile (1,957.1/km2). There were 21,681 housing units at an average density of 2,219.5 per square mile (856.8/km2). The racial makeup of the city was 96.01% White, 2.49% African American, 0.10% Native American, 0.32% Asian, 0.02% Pacific Islander, 0.24% from other races, and 0.83% from two or more races. Hispanic or Latino of any race were 0.74% of the population.
There were 20,059 households, out of which 28.4% had children under the age of 18 living with them, 44.6% were married couples living together, 13.8% had a female householder with no husband present, and 37.3% were non-families. 31.6% of all households were made up of individuals, and 14.7% had someone living alone who was 65 years of age or older. The average household size was 2.37 and the average family size was 2.98.
In the city, the population was spread out, with 22.9% under the age of 18, 10.9% from 18 to 24, 27.3% from 25 to 44, 22.0% from 45 to 64, and 16.8% who were 65 years of age or older. The median age was 37 years. For every 100 females, there were 88.3 males. For every 100 females age 18 and over, there were 84.5 males.
The median income for a household in the city was $28,248, and the median income for a family was $36,758. Males had a median income of $28,851 versus $21,242 for females. The per capita income for the city was $15,213. About 12.9% of families and 17.7% of the population were below the poverty line, including 24.1% of those under age 18 and 9.0% of those age 65 or over.


== Economy ==
Historically, the sole economic force driving the growth of Altoona into a City was the Pennsylvania Railroad. While the various local railroad shops still employ over a thousand people, they are no longer the driving economic engine of the area.

The top field of employment in Altoona and the metro area is healthcare. Facilities include: UPMC Altoona with its many local facilities that employ thousands, Healthsouth Rehabilitation Hospital and its several local facilities, James E. Van Zandt VA Medical Center, dozens of doctors offices, and over 20 nursing homes and assisted living facilities.
Altoona serves as the corporate home to Sheetz, a rapidly growing convenience store chain in the United States. It now has 600 locations throughout Pennsylvania, Virginia, Maryland, West Virginia, Ohio and North Carolina.
Altoona also serves as the headquarters to the candy company Boyer. Famous for their “Mallo Cup,” the company was founded in 1936, 42 years after the founding of The Hershey Company. 
Another massive employer is the retail and service industries. Altoona is the linchpin of the Tri-City Region. Its location along I-99 draws from a large trade area over a wide geographic area that extends to State College and Johnstown and over 40 miles (64 km) south along I-99 past I-70. Altoona draws the most retail customers in the region due to its centralized location and to the fact that it has the best complementary retail of the three markets with 2,800,000 square feet (260,000 m2) of retail space. A new shopping center, Convention Center Commons, opened in 2015. The new shopping includes an AMC Movie Theater, and a Holiday Inn Express.Areas of retail include:

Downtown region.
The 17th Street corridor including what remains of the Station Mall.
Certain large zoned sections along Logan Boulevard and 6th Avenue.
The Logan Valley Mall which is a major retail staple of the area.
Approximately 3.5 miles (5.6 km) stretch of Pleasant Valley Boulevard and Valley View Boulevard as they converge into Plank Road, consisting of numerous stores and shopping centers.  This area plus Route 764 which runs through Altoona and the northern and southern suburbs is known as the "Green Banana".
The Walmart and Target shopping centers.
The Logan Town Centre which is the newest shopping center in the area and sits directly next to I-99.


=== Industry ===
As typical of many Rust Belt cities, the economic downturn of the railroad resulted in the closure of many of the downtown's landmark stores and industries; and the simultaneous rise in prominence of the automobile shifted commercial development to the suburbs. However, through recent revitalization efforts, Altoona's downtown maintains a significant level of economic vitality and hosts few office and residential vacancies. The downtown maintains a significant focus on pedestrian-oriented development, as evidenced by the presence of more pedestrian bridges and underpasses across the railroad tracks (connecting the two parts of downtown) than automobile crossings.
Penn State Altoona has bought several downtown buildings, including the former Playhouse Theater building, the six-story Penn Furniture building, and the former WRTA building. The University has turned them into the Devorris Downtown Center, the Aaron Building and the Kazmaier Family Building. Recently Sheetz has added another building to Penn State Altoona called The Sheetz Center for Entrepreneurial Excellence on the former site of a department store behind the Amtrak Station. The University provides a flow of resources into the downtown, aiding in revitalization efforts. As an example of the university's value to the downtown's economy, the installation of the Blue Lot near the Wolf Court Building has improved the economic attraction of downtown by offering up to three hours of free parking. A bike path connecting the Campus to Downtown Altoona has also been built.


== Sports ==
In the early 20th century, the Pennsylvania Railroad constructed a large sports complex at the intersection of Chestnut Avenue and Seventh Street. It was named Cricket Field in an attempt to appeal to Cricket-loving British investors. Cricket did not catch on with the Altoona populace, so its close relative baseball became the choice for Cricket Field. Well known baseball players as Babe Ruth and Josh Gibson played at Cricket Field, and the stadium was also the venue for numerous other sporting events, musical competitions, marching units, and activities. A plaza that's home to; Wendy's, Rite Aid Pharmacy and the Pennsylvania State Parole & Probation, stands today on the site of Cricket Field.

Altoona was the site of a 1.25-mile (2.01 km) board track called Altoona Speedway from 1923 to 1931. On June 15, 1929, just two weeks after winning the 1929 Indianapolis 500, Ray Keech was killed in an accident at the Altoona Speedway.


=== Mansion Park Stadium ===
Altoona Area School District's Mansion Park Stadium has long been recognized as one of the finest athletic complexes in Pennsylvania. The stadium, which has a seating capacity of 10,400, is a source of community pride and regularly serves as the site of a variety of events that benefit the economy of the Altoona-Blair County area.
In the summer of 2009, Sports Construction Group, LLC installed "Trophy Turf," which has a 48-ounce face weight and inlaid football and soccer lines.
Mansion Park's first artificial surface was installed in 1989. Omniturf provided a way to maximize the use of the facility throughout the year and at the same time, save taxpayer dollars through reduced maintenance costs. AstroTurf 12-2000 was installed in 1999. The eight-lane polyurethane running track was installed in 1989 and has been resurfaced several times.
For 22 consecutive seasons, the playing surface has received rave reviews from players and coaches as athletes have experienced controlled footing regardless of the weather conditions. Most importantly, there has been a significant decrease in serious injuries since the artificial turf was installed.
During a typical fall season, more than 60 events take place on the turf. Altoona High varsity and junior varsity teams, Altoona Area Junior High School ninth grade teams, and Bishop Guilfoyle High School all play home football games at Mansion Park. The stadium is also the site of AAHS boys and girls soccer matches and countless practice sessions. District and interdistrict football and soccer playoffs are held each year at Mansion Park, the home of the PIAA Football Championships from 1992 through 1997. The Pennsylvania Scholastic Football Coaches Association East-West High School All-Star Game was played at Mansion Park from 2001 to 2010.
Numerous high school and junior high school track meet, including the District 6 Class AA and AAA championships and the West Central Coaches Meet, are held at the stadium each spring. The track is also used extensively on a daily basis by hundreds of community residents who enjoy walking and jogging.
Mansion Park has also been the site of a 1992 Pittsburgh Steeler intrasquad scrimmage, the Pennsylvania State Athletic Conference men's and women's college soccer championships, University of Pittsburgh preseason football practices and the 1995 PIAA Soccer Championships.
Music events have also been well received. Appearances by The Beach Boys, Up With People, the United States Marine Drum and Bugle Corps, the Penn State Blue Band, the Ohio State Pride of the Buckeyes Band, the University of Notre Dame Band of the Fighting Irish, the University of Illinois Marching Illini and the Indiana University of Pennsylvania Marching Band have attracted huge crowds. Drum Corps International competitions were held in 1998 and again in 2000.
Altoona Area High School's Commencement is scheduled at the stadium each year. Mansion Park is also the home of the American Cancer Society's Relay For Life.
In early 2010, a new scoreboard featuring a video display board with an improved stadium sound system was erected thanks to the generosity of local sponsors.


== Education ==
Altoona has an education system that contains three high schools, two parochial, one public. Bishop Guilfoyle High School is one of the private parochial schools having grades 9–12. Great Commission Schools is the second private parochial school having grades K–12. Altoona Area High School houses grades 10–12. Altoona High is much larger than Bishop Guilfoyle, graduating around 500 students annually, while Guilfoyle graduates around 70.
D.S. Keith Junior High and Theodore Roosevelt Junior High merged in 2008 to become the Altoona Area Junior High School. Roosevelt was torn down and the ground on which it stood was constructed into the new field for the new junior high. D. S. Keith was turned into residential apartments.
Altoona is the location of the Pennsylvania State University, Ivyside Park campus, also known as Penn State Altoona. This is the third largest of the Pennsylvania State University Commonwealth campuses. The college has approximately 3,903 students as of the 2014–15 school year.Altoona also has several technical schools. The Greater Altoona Career and Technology Center (GACTC) is located on 16th Street next to the high school and offers a variety of technical classes for both Junior High and High School students throughout Blair County, as well as high school graduates seeking a technical degree. YTI Career Institute has a campus in Logan Hills on Fairway Drive. South Hills Business School has a campus located on 58th Street.


== Media ==


=== Newspapers ===
Altoona Mirror


=== Radio ===


=== Television ===
The Altoona television market is part of the regional Johnstown/Altoona/State College market.


== Infrastructure ==


=== Transportation ===
Altoona is a major center on the Norfolk Southern Railway's (NS) Pittsburgh Line. In Altoona, helper engines are added to heavy trains to give them extra power up and over Horseshoe Curve west of town. The Juniata Heavy Repair Shop Complex, originally built by the PRR, is the primary repair and maintenance facility on NS. On an average day, 60 to 80 trains pass through Altoona. The historical importance to the railroad industry and the current high level of railroad activity has made Altoona a mecca for railfans for over 60 years, with the Railroaders Memorial Museum and the Horseshoe Curve being popular spots.
Amtrak's Pennsylvanian stops at Altoona station once daily in each direction.
Local bus service in the city is provided by AMTRAN. In 2007, AMTRAN customers suffered a major loss in service due to cuts in state funding. In May of that year, Governor Rendell visited Altoona to discuss plans intended to rectify this situation.
Roadway service primarily consists of Interstate 99, which provides access to the Pennsylvania Turnpike to the south and Interstate 80 to the north; and U.S. Route 22, which provides east–west service and direct access to Pittsburgh and Harrisburg. Local roadways in Altoona tend to be given numerical names, and Streets are aligned northwest–southeast and Avenues are aligned northeast–southwest.
The Altoona–Blair County Airport provides commercial air service for Altoona, offering daily flights to Pittsburgh International Airport on Southern Airways Express as part of the Essential Air Service.


=== Emergency services ===
Altoona and the Altoona Area are serviced by several companies for emergency services. Given that Altoona is entirely encompassed by Logan Township, and some small areas within the city are belonging to the Township, City and Township services often intermingle. Given the close proximity to Hollidaysburg and Duncansville Boroughs as well as Allegheny and Blair Townships, City, borough and township services will often assist or be called in place of each other.


=== Police ===
The Altoona Police Department (APD) services the City. APD is about 66 strong, and the precinct is located on 16th St downtown.
Logan Township Police Department services all areas of Logan Township. However, since the Township encompasses the City, in order to be centrally located the precinct is located in the City on 7th Ave. LTPD is 16 strong.


=== Fire ===

The Altoona Fire Department (AFD) supplies fire and Quick Response Service (QRS) to the City, as well as Haz-Mat response for Blair County. The Department is also a part of the IAFF, local 299.
There are also several Volunteer Companies located just outside the city limits on all sides.


=== EMS ===
AMED or the Altoona Mobile Emergency Department provides EMS services for both Altoona and Logan Township as well as many surrounding areas in Blair County including Bellwood, Tyrone, and Roaring Spring. AMED has several online and several offline ambulances on duty at the main station 430 on 7th Avenue and 10th Street as well as an additional online ambulance at 480 in Lakemont.


== Notable people ==
John Ake, 19th Century baseball player
Harry J. Anslinger, first commissioner of the Federal Bureau of Narcotics
Leonard Beerman, rabbi
Michael Behe, professor of biochemistry, author, proponent of intelligent design
Brad Benson, professional football player, New York Giants
Troy Benson, professional football player, New York Jets
Andrew Jackson Bettwy, mayor of Nogales, Arizona
Janet Blair, actress, star of such films as I Love Trouble and My Sister Eileen
Ron Blazier, baseball player, Philadelphia Phillies
Rob Boston, author, advocate of church-state separation
Paul Revere Braniff, entrepreneur
Samuel Canan, 34th governor of American Samoa
Susan Candiotti, CNN reporter
Sam Cohn, New York talent agent
Ripper Collins, professional baseball player, member of the Gashouse Gang
Charlie Crist, congressman and former governor of Florida
Paul C. Donnelly, NASA manager
John Ebersole, professional football player New York Jets
Ed Flanagan NFL player for Detroit Lions and San Diego Chargers, four-time NFL Pro Bowl selection, coach and teacher
Danny Fortson, professional basketball player, Seattle SuperSonics
Frank Gansz, American football coach
Aaron Gilbert, painter
Hope Hibbard, zoology professor, marine biology researcher
Hedda Hopper, gossip columnist and actress, buried in Rose Hill Cemetery in Altoona
Tommy Irwin, baseball player
Mike Iuzzolino, basketball player
Edwin A. Jaggard, Minnesota Supreme Court justice
Richard T. James, inventor of the Slinky
Stan Jones, Pro Football Hall of Famer (inducted 1991)
Robert Jubelirer, Pennsylvania politician
Theodore H. Kattouf, ambassador to the United Arab Emirates and Syria
Henry Kloss, engineer
Robert E. Laws, Medal of Honor recipient, World War II
Cindy Lovell, educator and writer
James Loy, Deputy Secretary of the U.S. Department of Homeland Security
Pat Malone, MLB pitcher, appeared in three World Series
Barry McCauley, opera singer
John J. McGuire, science-fiction writer
Kelly M. Miller, American academic
Johnny Moore, basketball player
William Nesbit, first president of the Pennsylvania State Equal Rights League
Jackie Paisley, IFBB professional bodybuilder
John Pielmeier, playwright and screenwriter
H. Beam Piper, novelist and author of "Fuzzy" & 'Paratime' novels
Mike Reid, musician and songwriter; retired football player
Darlie Routier, convicted murderer
Wade Schalles, all-time record holder for most pins and most wins in amateur wrestling
Bob Sheetz, founder of the Sheetz convenience store chain
D. Brooks Smith, judge
Harry E. Soyster, general
Steve Taneyhill, football player, South Carolina
Andrew Kevin Walker, screenwriter
Doug West, NBA basketball player
Paul Winter, saxophonist


== Sister cities ==
Altoona is a sister city with:

 St. Pölten, Austria


== See also ==
War Governors' Conference
Mishler Theatre
Railroaders Memorial Museum
Penn Alto Building
Georgism


== References ==


== External links ==
Official website
"Altoona" . Encyclopædia Britannica (11th ed.). 1911.
A Special History Study Pennsylvania Railroad Shops and Works Altoona, Pennsylvania