Altoona is a city in Blair County, Pennsylvania, United States. It is the principal city of the Altoona Metropolitan Statistical Area (MSA). The population was 46,320 at the time of the 2010 Census, making it the eleventh most populous city in Pennsylvania. The Altoona MSA includes all of Blair County and was recorded as having a population of 127,089 at the 2010 Census, around 100,000 of whom live within a 5-mile (8.0 km) radius of the Altoona city center according to U.S. Census ZIP Code population data. This includes the adjacent boroughs of Hollidaysburg and Duncansville, adjacent townships of Logan, Allegheny, Blair, Frankstown, Antis, and Tyrone, as well as nearby boroughs of Bellwood and Newry.
Having grown around the railroad industry, the city is currently working to recover from industrial decline and urban decentralization experienced in recent decades. The city is home to the Altoona Curve baseball team of the Double A Eastern League, which is the affiliate of the Pittsburgh Pirates Major League Baseball team. The 90-year-old Altoona Symphony Orchestra, under the direction of Maestra Teresa Cheung (since 2007) has been calling Altoona home since 1928. Prominent landmarks include the Horseshoe Curve, the Railroaders Memorial Museum, the Juniata Shops of the Altoona Works, the Mishler Theatre, the Cathedral of the Blessed Sacrament, and the Jaffa Shrine Center.


== History ==

Altoona was founded by the Pennsylvania Railroad (PRR) in 1849 as the site for a shop and maintenance complex. Altoona was incorporated as a borough on February 6, 1854, and as a city under legislation approved on April 3, 1867, and February 8, 1868.


=== Altoona ===
One explanation of the city's name is that the word "Altoona" is a derivative of the Latin word altus, meaning "high".This explanation is contradicted by Pennsylvania Place Names. Although Altoona, in Blair County, is popularly known as "the Mountain City", its name has no direct or indirect etymological relation to the Latin adjective Altus, signifying "elevated, lofty." Two very different explanations of the origin of this name are current. The one which seems to be the most natural and reasonable runs as follows: "The locomotive engineer who ran the first train into Altoona in 1851 was Robert Steele, who died several years ago, aged nearly 90 years. He was then the oldest continuous resident of the city. He was much respected and had long been one of the private pensioners of Andrew Carnegie. Mr. Steele is authority for the statement that Col. Beverly Mayer, of Columbia, Pennsylvania, who, as a civil engineer of what was then the Pennsylvania Central Railway, had laid out the tracks in the yards of the newly projected city, named the place Altoona after the city of Altona in Danish Holstein, which became part of Germany in 1864."
The German Altona, which is today a district of Hamburg, lies on the right bank of the Elbe, immediately west of Hamburg city center, and is an important railway and manufacturing center with a population of nearly 200,000. The etymological derivation of the name Altona is not known with certainty, but widely believed to be Low German all to na, meaning "all too near" (sc. Hamburg). However, linguistic research indicates that the name of German Altona is probably based on a former tributary of the Elbe river called Altenawe or Altenah (meaning old meadow), which is shown in the 1568 map of the Elbe river by Melchior Lorichs and in the 1652 maps by Johannes Mejer (published by Caspar Danckwarth).In 1849, David Robinson sold his farm to Archibald Wright of Philadelphia, who transferred the property to his son, John A. Wright, who laid it out in building lots, became one of the founders of Altoona, and was responsible for the naming of the town. According to his own statement, he had spent considerable time in the Cherokee country of Georgia, where he had been especially attracted by the beautiful name of Allatoona, which he had bestowed upon the new town in the belief that it was a Cherokee word meaning "the high lands of great worth." In the Cherokee language there is a word eladuni, which means "high lands", or "where it is high"; but to a Cherokee, Allatoona and eladuni are so different that the former could hardly be derived from the latter.An older history dated 1883 favored the Cherokee derivation, stating that "Its name is not derived from the Latin word altus nor from the French word alto, as has frequently been asserted and published, but from the beautiful, liquid, and expressive Cherokee word Allatoona. This is on the authority of the person who bestowed the name, Mr. Wright, of Philadelphia, who was long a resident of the Cherokee country in Georgia, and an admirer of the musical names of that Indian language."For 60 days in 2011, the city officially changed its name to "POM Wonderful Presents: The Greatest Movie Ever Sold" in exchange for $25,000 as part of a marketing gimmick for the movie of the same name.


=== Growth ===

In late September 1862, Altoona was home to the War Governors' Conference which brought together 13 governors of Union states. This body gave early approval to the Emancipation Proclamation. The town grew rapidly in the late 19th century, its population approximately 2,000 in 1854, 10,000 in 1870, and 20,000 in 1880. The demand for locomotives during the Civil War stimulated much of this growth, and by the later years of the war, Altoona was known as a valuable city for the North. Altoona was also the site of the first Interstate Commission meeting to create and design the Gettysburg National Cemetery following the devastating Battle of Gettysburg. The centrality and convenience of the town's rail transportation brought these two important gatherings to the city during the war.


=== Horseshoe Curve ===
Horseshoe Curve, a curved section of track built by the PRR, has become a tourist attraction and National Historic Landmark. 
The curve was built to help trains cross the Allegheny Ridge, a barrier to westward trade. Construction of the Erie Canal in New York 20 years earlier had diverted much port traffic from Philadelphia to New York City, feeding that city's commercial dominance. Because the curve was an industrial link to the western United States, Horseshoe Curve was a primary target of eight Nazi saboteurs who had landed during World War II from U-boats of Nazi Germany's Kriegsmarine during Operation Pastorius.At its peak in the early 20th century, PRR's Altoona Works complex employed about 15,000 people and covered three miles (5 km) in length, 218 acres (88 ha) of yards and 37 acres (15 ha) of indoor workshop floor space in 122 buildings. The PRR built 7,873 of its own locomotives at the Works, the last in 1946. PRR shaped the city, creating the city's fire departments and moving the hospital to a site nearer to the shop's gates. Today, the fire department employs 65 people and is the largest career department between Harrisburg and Pittsburgh. PRR sponsored a city band and constructed Cricket Field (a sports complex). In 1853, the PRR built the Mechanic's Library, the first industrial library in the nation which exists today as the Altoona Area Public Library. With the decline in railroad demand after World War II, things began to decline. Many treasures of the city's history disappeared, including the Logan House Hotel and railroad shops.Horseshoe Curve remains a popular tourist attraction. There is a free funicular that takes visitors to a viewing area, or it can be reached by climbing 194 steps.


=== Tornado ===
On May 22, 1949, at about 6 pm, a tornado moved through the southern part of Altoona. According to the Altoona Mirror, the tornado touched down near Sugar Run Road in the Canan Station area and cut a 100-yard swath of destruction through the southwestern portion of Altoona. Trees over a foot in diameter were "twisted apart" and several houses were unroofed, and garages were demolished in the Canan Station and Sugar Run areas. Along 58th Street large trees were uprooted, one of them left a seven-foot hole in the ground. Also on 58th Street, the roof was torn off a restaurant, as was the brand-new neon sign, also a large billboard was pushed to the ground. Houses lost shingles and there was extensive tree damage in the Eldorado and Llyswin sections of town. Huge trees were blown down in Highland Park. The Adams School, located near the end of the tornado's path at 6th Avenue and 24th street, had damage to its slate roof and several windows were blown out.
Another tornado touched down in Morrisons Cove. Houses were unroofed and barns were destroyed in the Henrietta and Millerstown Area. A 17-year-old girl was injured in Henrietta. The damage done by these tornadoes is consistent with winds of 105–110 miles per hour (169–177 km/h).A map made by Dr. Ted Fujita in 1974 of all of the tornadoes in the U.S. between 1930 and 1974 shows these two tornadoes mapped as F1 tornadoes on the Fujita Scale.


=== Current ===
Altoona is one of the dual seats of the Roman Catholic Diocese of Altoona–Johnstown. The Cathedral of the Blessed Sacrament was made a cathedral and rechristened from St. John's Church in 1851.
The Altoona Mirror newspaper, founded in 1876 by Harry Slep, is Altoona's oldest media outlet. Today, the newspaper has a daily circulation of 32,000 and a Sunday circulation of 39,000. Approximately 13,000 people read the online edition of the newspaper each day.
Altoona is home to the world's oldest wooden roller coaster, the Leap-The-Dips, located in Lakemont Park.


== Geography ==
Altoona lies at the base of Brush Mountain within Logan Valley and Pleasant Valley. According to the United States Census Bureau, the city has a total area of 9.8 sq mi (25.3 km2), all land. Altoona is situated in the Allegheny Mountains.


=== Climate ===
Altoona has a humid continental climate (Köppen Dfb) climate, with cold, snowy winters, and humid, very warm summers. The monthly daily average temperature ranges from 23.8 °F (−4.6 °C) in January to 70.8 °F (21.6 °C) in July, although extremes in temperature have ranged from −29 °F (−34 °C) in 1904 to 103 °F (39 °C) in 2011. Unofficial readings in the town below -30 in the cold snap of January 1977 were recorded, but the official low on that night was "only" -20. The hardiness zone is 6a.
Total precipitation is greatest in May and least in February. Snowfall averages 60.6 inches (154 cm) per season, with almost all of that total occurring from December to March, although significant falls are not unheard of in April/May and October/November.


=== City neighborhoods ===

The main sections of Altoona are the Downtown, Center City, Logantown, Fairview, Juniata, Wehnwood, Calvert Hills, 5th Ward, Westmont, Eldorado, East End, Dutch Hill, Pleasant Valley, Hileman Heights, 6th Ward, Mansion Park, Llyswen, Garden Heights, and Highland Park. Some significant neighborhoods are Little Italy, Gospel Hill, Toy Town, Columbia Park, Knickerbockers, and Curtin. Some areas within Logan Township are not within the defined City limits but still considered sections of Altoona, including Lakemont, Greenwood, Bellmeade, Westfall, Newburg, and Red Hill. Many of the older districts consist of a mix of rowhomes and individual homes, which were a common building style in railroad towns so-as to provide for worker and manager housing, respectively.


==== Downtown ====
The downtown is the cultural and commercial center of Altoona and straddles the famous railroads. As is typical to a traditional city layout, the downtown is centrally located and contains significant development in all directions from the downtown. Much of the downtown area is listed on the National Register of Historic Places as the Downtown Altoona Historic District. Popular landmarks include the Mishler Theatre, the Penn Alto Building (formerly the Penn Alto Hotel), the Gable's Building, City Hall, the Cathedral of the Blessed Sacrament, and Eleventh Avenue itself.
Altoona is notable for having several churches, such as the Cathedral of the Blessed Sacrament at the corner of 13th Street and 13th Avenue, the building on the corner of 12th Street and 14th Avenue that used to house the First Presbyterian Church, and the First Lutheran Church on the corner of 14th Street and 12th Avenue. The Station Medical Center, formerly known as the Station Mall, was a downtown mall built during the 1970s in place of many old railroad shops. The downtown contains most of what's known as Altoona's Little Italy district.
Because of the geography of the area, exact or natural boundaries for Downtown are not present. Therefore, Downtown is generally defined by what the City has zoned as Central Business: between 13th Ave and the PRR Expressway, and from 7th Street to 16th Street. However, it is common for areas within Logantown and Center City to be expressed locally as "downtown."
The Texas Hot Dog was originally created in downtown Altoona in 1918, although the Paterson, New Jersey, Texas Hot Dog location, which opened in 1924, is more famous.


===== Architecture =====
The commercial core of the downtown includes many multistory residential, commercial, and mixed-use facilities designed in at the turn-of-the-20th-century in a mix of Victorian, Edwardian Baroque, and Neo-Romanesque styles. This style features high ceilings, resulting in taller buildings than is typical for the number of floors. The high ceilings are typically made of either tin or plaster, although sometimes a drop ceiling is utilized.
Individual homes originally provided housing to managers and executives of the PRR and have structural similarities to Victorian or Edwardian mansions, but built very narrow and tall. These are sometimes used as double or triple family apartments or even converted into commercial space. Outside of the commercial core is a mosaic of multistory commercial structures, mixed-use facilities, single story commercial structures, apartment buildings, multi-unit housing, and single-family homes.
The United States post office in Altoona contains two oil-on-canvas WPA commissioned murals painted by Lorin Thompson in 1938 titled Pioneers of Altoona and Growth of the Road. Murals were produced from 1934 to 1943 in the United States through the Section of Painting and Sculpture, later called the Section of Fine Arts, of the Treasury Department.


==== Center City ====
Center City comprises industrial and commercial zones as well as urban and multiple household residential zones. Often, the Center City, Little Italy, and Gospel Hill areas (as well as Lower Fairview) are included as part of "downtown" for tourism and promotional purposes, much like how the Strip District in Pittsburgh is promoted. This is due to both the proximity and the fact that the buildings from these sections are similar to downtown buildings and blend in with the skyline. On the west side of the tracks, Center City extends around Downtown 2-3 blocks with heavy residential, industrial and commercial to the north, south, and west. The eastern side of the tracks, which according to the public maps is called "East Side", runs along the length of the tracks from 1st Street to 23rd street and from the tracks to 6th Avenue west to east. However, the Altoona Area High School is considered Center City despite standing on the Dutch Hill side of 6th Avenue. The East Side of Center City is home to the High School and Junior High, the former Roosevelt Junior High School, the Altoona Railroaders Museum, Boyer Candies, the Station Medical Center of Altoona Regional Health System, as well as many current and old railroad facilities.


==== Little Italy and Gospel Hill ====
The neighborhood area known as Little Italy is the neighborhood between 7th Street and 12th Street north to south and 9th Ave to 6th Ave west to east, sometimes this is extended to include the Station Medical Center. Gospel Hill is the neighborhood in the area of 15th Street and 16th Ave and adjacent to the park of the same name.


==== Logantown ====
Logantown is the area just north of Downtown and is considered a direct extension of Downtown. It borders Fairview along 16th Ave, Willow Ave and Cherry Ave to the north, 13th Ave and Chestnut Ave to the south, and Juniata Gap Road to the east. This is where UPMC Altoona is located, which is the tallest building in Altoona at 14 Floors. This is also where Cricket Field used to be located. Logantown is zoned as a mix of commercial and residential and contains some of the oldest houses built in Altoona that is still standing.


==== Fairview ====
Fairview is a mostly residential area North and West of Downtown and Logantown. It borders Calvert Hills to the south at 12th Street, Downtown and Logantown to the east along 16th Ave and Willow Ave and then along Cherry Ave after 5th Street, and borders Juniata Gap Road to the north. Fairview is zoned as multiple household residential in the areas directly bordering Downtown, and transitions to single household residential after 21st Avenue, and eventually to suburban after 24th Ave. Many houses in the part of downtown near Fairview and lower Fairview are the middle-density mansions originally owned by managers and executives of the PRR. The most striking example of this is the Penn Alto residential hotel on the corner of 13th Avenue and 12th Street, which has two single-unit houses next to it. Conversely, there are several multistory residential and commercial buildings on 17th Avenue. One of the sections of the downtown is called "Lower Fairview" due to its transitional nature. The houses between 14th and 15th avenues (with two commercial buildings included) on 12th street are designed based on an architectural pattern used in Philadelphia's urban neighborhoods.


==== Dutch Hill ====
Dutch Hill district contains an abundance of historic neighborhoods and traditional "corner markets". This section gets its name from the abundance of Germans who moved into this area when the City was still expanding. Dutch Hill is the area that borders the City Center to the East and is zoned as multiple household residential. The boundaries are generally considered 4th Street to 17th Street north to south, and 6th Avenue to Walton Avenue from west to east. However, as the Altoona Area High School and Junior High are considered City Center, the border is around 4th Ave (or 3rd Ave if the entire school zone is included) when between 11th Street and 17th Street.


==== Juniata ====
Juniata is defined as north of Juniata Gap Road, east of East 25th Ave and on the west side of the railroad line. The area is zoned as mostly residential limited, but also uniquely has a significant area of light and heavy industry as well as a central business area. This is because Juniata was once its own city, and was incorporated into Altoona in the late 19th century. Because of this, the section's street names had conflicting numbers with the rest of the City and had to be given a North prefix. The commercial area is sometimes nicknamed "downtown Juniata." The most important street in Juniata's L-shaped commercial district is North Fourth Avenue. The J.L. Noble School was added to the National Register of Historic Places in 1996. The original Thompson's Pharmacy was on 2nd Street in Juniata before moving a few blocks to a larger main store and branching out to become a small, local chain.


==== East End ====
The East End is defined as the area on the east side of the railroad line north of 4th Street. It is called the East End because it borders the north end of the tracks where trains would depart east towards Philadelphia. Because of this, most streets have an East prefix. The East End is mostly single household residential and suburban but has small areas of residential-commercial and neighborhood business along Kettle Street and Lloyd Street, as well as highway business along Pleasant Valley Boulevard.


==== Pleasant Valley ====
Pleasant Valley is the area that centers on Pleasant Valley Boulevard, which is a massive stretch of highway business that runs the entire length of Altoona. The Sheetz store is known locally as "Super Sheetz" is located here along 17th Street and was the first of its kind ever built. The area is defined as southeast of Walton Ave and extends from 1st Street til 22nd Street and defined by Polk Ave to the east. As well as the large highway business area, Pleasant Valley also has an even amount of single household residential and suburban along with some small stretches of residential commercial and urban.


==== Eldorado ====
Eldorado is the southern section of Altoona, south of Logan Boulevard and west of 6th Avenue as well as a small section south of 57th Street all the way to Rhode Island Avenue (Goods Lane) in the east. Eldorado is zoned as almost entirely suburban, with small areas of light industrial and neighborhood business. The Sheetz Headquarters is located in this area. At one time, this section was also known as the "West End" because trains leaving the south end of town head west towards Pittsburgh. Some parts of Eldorado are actually outside of incorporated Altoona and located in Allegheny Township and Logan Township.


==== Toy Town ====
Toy Town is the neighborhood between 31st and 33rd Streets and centered on Race Street.


==== Lakemont ====
Lakemont is located southeast of Garden Heights between Frankstown Road and Logan Boulevard. While residing within Logan Township just outside the official border of the City and designated as the "Village of Lakemont", it is commonly accepted as a section of Altoona. In fact, Peoples Natural Gas Field the home of the Altoona Curve resides in Lakemont. Also in Lakemont is Lakemont Park and Galactic Ice. Lakemont is zoned as single household residential, residential commercial and highway business.


==== Greenwood ====
Greenwood is the area north of the East End and begins around a block north of Grant Street. While mostly residing within Logan Township just outside the official border of the City and designated as the "Village of Greenwood", it is commonly accepted as a section of Altoona, especially since a 3 block by 4 block zone lies within the city limits. Greenwood is zoned almost entirely as suburban with a section of highway business along Route 220. Greenwood Road is a lone exception with a more urban residential zoning. Ward Trucking's headquarters are located in this section of Altoona.


==== Wehnwood ====
Wehnwood is the area west of 25th Ave between Wehnwood Road to the north and 1st St to the south. This is part of where Penn State Altoona is located. Wehnwood is mostly zoned as suburban or single residential with an area of neighborhood business along 25th Ave and Juniata Gap Road. There is a fair amount of student housing surrounding the campus, and therefore a small pocket of urban residential next to it.


==== Mansion Park ====
Mansion Park is named for the Baker Mansion, one of its prominent houses. There are several streets surrounding the old plantation where mansions built in the early 20th century still stand. Mansion Park Stadium is also located here, which is the 10,000 seat stadium where the Altoona Area High School Mountain Lions play. The Mansion Park area is located east of 6th Avenue, with Logan Boulevard and Ward Avenue to the south, 27th Street to the north and a block past Union Avenue to the east.


==== Columbia Park ====
Columbia Park is the neighborhood adjacent to Tuckahoe Park between 6th Ave and Union Ave with Crescent Road to the south. The area is single and suburban residential.


==== Highland Park ====
Highland Park is the area south of Logan Boulevard, east of 6th Avenue, north of 57th Street and west of Ruskin Drive. The name comes from the hill that the area is centered on is the only significant highland in southern Altoona. The actual Highland Park is located on top of the hill. Highland Park is zoned entirely suburban.


==== The Knickerbockers ====
The Knickerbockers are a unique collection of homes along 6th Ave between Burgoon Road to the north and 41st Street to the south. The Knickerbocker Historic District was added to the National Register of Historic Places in 2002. This collection of extremely closely built together homes are a local landmark, and the Knickerbocker Tavern is one of the most popular bars in the area.


==== 6th Ward ====
6th Ward is the area south of Dutch Hill, west of Pleasant Valley, east of Curtin Neighborhoods and north of Mansion Park. It is between 17th and 27th Streets north to south, and 6th Ave and Michelle Drive west to east. This area consists of multiple and single residential. There are several streets in the 6th Ward where mansions from the early 20th century still stand.


==== Westmont ====
Westmont is the area on the east side of the tracks south of 21st street and between the 5th Ward and the tracks to the west and the 9th Ave tracks to the east. The area is zoned as multiple, single and suburban residential as well as residential commercial and light industrial. This is probably one of the more varied and diverse areas of the city architecturally.


==== Curtin ====
Curtin is the neighborhood where the Jaffa Mosque is located. As well as the Broad Avenue Historic District, which was added to the National Register of Historic Places in 2002.


==== Hileman Heights ====
Hileman Heights is a suburban area south of Pleasant Valley. The heights are from South 25th Street south to South 27th Street and are between Wren Ave to the west and Robin Ave to the east. There is also a small section of residential commercial.


==== Llyswen ====
