The first 18 km of Route 1 in Tuban Regency follows northwest-southeast direction until reaching Tambakboyo. From there, the route curves to the northeast for eight kilometers until curving again to the southeast, drawing farther away from shoreline. 12 km later, it runs again near the shoreline in Jenu, from which it proceeds for another southeast direction. Upon arriving in Tuban some seven kilometers later, it is divided between east- and westbound section. The eastbound section is carried by Jl. Martadinata and Jl. Sudirman for four kilometers, after which Route 17 that carries the old Great Post Road diverges from Route 1, while Route 1 itself turns to the south, carried by Jl. Manunggal until joining with Route 1's westbound section in Manunggal Monument. Its westbound section is respectively carried from east to west by Jl. Pahlawan, Jl. HOS. Cokroaminoto, Jl. Moh. Yamin, Jl. Gajah Mada, Jl. Dr. Wahidin, and Jl. Teuku Umar. Route 1 runs to the southeast for three kilometers, continued by southward direction for three kilometers, and then it runs southeastwards for seven kilometers before crossing over Solo River, that becomes the southern border of Tuban Regency, marking the entrance of Route 1 in Lamongan Regency.
Not far from the bridge, Route 1 curves northeast and merges with Route 20 that previously passes underneath the Route 1. The Route 1's section in Lamongan Regency mostly runs eastwards, passing through subdistricts of Babat, Pucuk, Sukodadi, Turi, Lamongan, and Deket for 32.5 km, followed by a southeastward curving. Northern railway line runs parallel with entire Lamongan segment of Route 1; the route is crossed by the railway for two times, both located in Downtown Lamongan.
One kilometer from the curving, Route 1 goes into Gresik Regency. The route still parallels with railway lines before drawing farther some 7.5 km later. Route 1 then curves to the east for two kilometers, followed by southeastward curving. One kilometer later, it curves east again. Route 1 is divided between east- and westbound section near Bunder Bus Station located 1.5 km from the curving. It encounters a junction with Surabaya-Gresik Toll Road approximately one kilometer eastward, where most vehicles intending to go to Surabaya, Manyar or Sidoarjo take the toll road, while the vehicles intending to go to Downtown Gresik take the route. Continuing 910 m east, it passes underneath the toll road and encounters Sumber Junction some 1.25 km later. Route 1 turns northwards for 840 m, and proceeds to the east after reaching Gresik Kota Baru Junction. Route 1 then meets the eastern terminus of Route 17 some 2.5 km later, making it runs concurrently again with Great Post Road. Continuing 1.7 km east, it turns to the south after encountering a junction near PT. Semen Gresik factory. Before entering Surabaya, Route 1 is divides between south- and northbound section approximately 2.5 km later, and then both sections passing over Lamong River.
Upon entering Surabaya, both sections merges again, and Route 1 encounters an intersection with Romokalisari Toll Plaza. The route continues southeastward, and is crossed by Gresik railway line branching off from Northern Line in Kandangan Station. Continuing 2.7 km southeast, Route 1 runs inside Margomulyo Industrial Zone for six kilometers. 1.5 km later, Route 1 passes underneath Surabaya-Gresik Toll Road. In Morokrembangan village, Route 1 turns to the south after encountering a junction, carried by Jl. Demak, which has a major intersection with Jl. Dupak (providing an access into Surabaya-Gresik Toll Road) and Northern railway line. After proceeding for 2.5 km, Route 1 encounters a junction with Jl. Kalibutuh, and turns to the east. It encounters an intersection near Tembok Market some 800 m later. From here, Route 1 is carried by Jl. Raya Arjuno running southward for 850 m and southeastward for 550 m. In Pasar Kembang, Route 1 meets a junction again, an runs to the south as Jl. Pasar Kembang for 680 m. Route 1 encounters again with an intersection, and proceeds southeast as Jl. Diponegoro for 2.7 km. Route 1 has two major intersections around Surabaya Zoo, in which it is carried by Jl. Wonokromo. After crossing over Mas River, Route 1 runs southwards, and overpassing Southern railway line 700 m later. From here until reaching Sidoarjo Regency in the south, Route 1 is carried by Jl. Ahmad Yani for 4.6 km, running parallel with Eastern railway line that has branched off from Surabaya Inner City Line in Wonokromo Station that also becomes the eastern terminus for Southern Line.
Waru Roundabout marks the boundary between Surabaya and Sidoarjo. It also provides access to Surabaya-Gempol Toll Road and Juanda International Airport. 960 m south of the roundabout, Route 1 overpasses a three-way junction with Route 15 leading for Mojokerto. In Aloha Roundabout, located two kilometers south, Route 1 is divided between north- and southbound directions, where the roundabout provides access toward the airport via Jl. Juanda. Eastern railway line still runs in the east of the route before underpassing the route in Buduran some 6.5 km southward. When entering Downtown Sidoarjo, Route 1 is carried by Jl. RM. Mangundiprojo (450 m), Jl. Jenggolo (710 m), and Jl. A. Yani (890 m), passing alun-alun. From here, Route 1 is divided between south- and northbound directions. The southbound direction is carried by Jl. Gajah Mada (970 m) and Jl. Mojopahit (1.2 km), while the northbound direction is carried by Jl. Gatot Subroto (350 m), Jl. Sunandar Priyosudarmo (1.2 km), Jl. Diponegoro (960 m), and Jl. Thamrin (250 m). All heavy vehicles are obliged to take Sidoarjo Eastern Ringroad. After meeting in Tenggulunan village, Route 1 runs southward and intersects with railway line some 3.4 km later. Porong Arterial Road intersects with Route 1 nearby, and most traffic between Sidoarjo and Malang takes the arterial road in order to avoid traffic jam in Porong. After the intersection, Route 1 runs parallel with the railway and Sidoarjo mudflow. Continuing One kilometer south, it intersects with Surabaya-Gempol Toll Road, and, after passing near Porong Market and Porong River, exits Sidoarjo Regency some 2.8 km southward.
Upon entering Pasuruan Regency, Route 1 meets an intersection where Route 23 leading to Malang diverges. Route 1 itself turns to the southeast, and passes under a viaduct carrying Eastern railway line. The viaduct is very low that makes all heavy vehicles and busses have to take Route 23 first southward and enter Route 1 again in Gempol Roundabout located 2.5 km from the viaduct. The roundabout also provides access toward former Gempol-Porong segment of Surabaya-Gempol Toll Road that has currently been damaged by Sidoarjo mudflow. Route 1 curves eastward, and runs parallel with Eastern railway line until entering Bangil, the seat of Pasuruan Regency, some 4.5 km later. Route 1 begins to divide between east- and westbound segment in front of Pegadaian Building, Indonesian pawnshop service. After meeting 500 m later, Route 1 proceeds to the east. 2.5 km later, it intersects railway line, and runs parallel with the railway. After proceeding to the northeast for 1.7 km, it curves to the southeast.
After running for 6.5 km, Route 1 crosses Welang River, entering Pasuruan City. In a junction near Kraton Market located 460 m east, Route 1 is carried by two different trunk roads. The northern part is carried by Jl. Soekarno-Hatta (3.9 km), Jl. Balai Kota (430 m), Jl. Veteran (880 m), and Jl. Ir. H. Juanda (2 km), while the southern part is carried by Jl. Gatot Subroto (2.9 km), Jl. Urip Sumoharjo (1.3 km), Jl. Untung Suropati (700 m), Jl. Hasyim As'ari (1.7 km) and Jl. HOS. Cokroaminoto (2.2 km). After the two parts meet again in Blandongan village, Route 1 proceeds to the southeast. It exits Pasuruan City 670 m later, then it enters Pasuruan Regency again. Continuing seven kilometers southeast, it intersects railway line near Grati. Eleven kilometers east of the rail crossing, Route 1 reaches Nguling Bridge, marking the entrance to Probolinggo Regency.
Continuing 1.5 km southeast, Route 1 crosses railway line near Tongas Asri Restaurant, Tongas, thus making the railway line runs parallel with the route. 1.5 km from railway crossing, there is a three-way junction that has been a most-taken access toward Bromo Tengger Semeru National Park. Route 1 reaches Ketapang Junction some 8.5 km southeastward, where the western part of Route 25 diverges. The junction is also an entrance to Probolinggo City. Route 1 initially runs to the east for four kilometers. After a junction with Jl. Suroyo, Route 1 curves southeastward, and encounters the last crossing with Eastern railway line one kilometer later. 580 m later, Route 1 encounters a junction with the eastern part of Route 25 in Randu Panggeng Junction.
Route 1 enters Probolinggo Regency again some 860 m southeastward. In Gending, located seven kilometers southeastward, the route approaches the coast of Madura Strait in Bentar Beach and begins to curves eastwards for five kilometers before curving northeastwards and drawing away from the strait. Before being aligned eastwards 22 km later, the route passes through the subdistricts of Gending, Pajarakan, Kraksaan (seat of Probolinggo Regency), and Paiton. Six kilometers later, Route 1 enters Paiton Generating Station, and begins to be curvaceous. There is also a rest area in the vicinity of Paiton Generating Station.
Upon exiting Paiton Generating Station some six kilometer later, the route enters Situbondo Regency, and begins to travel along the coast. Continuing ten kilometer east, it reaches Besuki, the biggest community in Western Situbondo Regency. After passing through alun-alun, the route curves to the north, and turns to the east after encountering a junction. In Suboh, located 3.5 km east, the route intersects with a regional road leading for Bondowoso Regency. In Mlandingan, it curves to the northeast six kilometers later, going along the edge of Mount Ringgit. The route runs adjacent with the coast until reaching Panarukan 22 km eastward. In this segment, the route also passes near Pasir Putih Beach, that becomes a popular tourist destination in the Eastern salient of Java (Indonesian: Tapal Kuda). There are many hotels and restaurants built in the area. In Panarukan, there is a level crossing with now-defunct Kalisat to Panarukan railway line. After crossing over Sampeyan River, which becomes the eastern terminus of Great Post Road built by Daendels, the route reaches Downtown Situbondo seven kilometers eastward. Route 1 continues nine kilometers east, intersecting narrow-gauge railway in Panji that carries sugarcane lorry to Panji Sugar Factory, and curves to the southeast in Kapongan. After passing through the subdistricts of Arjasa, Jangkar, Asembagus, and Banyuputih, the route enters Baluran National Park some 28 km southeast. In this segment, the route curves to the south and goes through a curvaceous path for 21.5 km.
After intersecting with a road going into the national park, Route 1 goes into Banyuwangi Regency 450 m southward, marked by a bridge over Bajulmati River. After running for 14 km southeastward, Route 1 approaches the coast of Bali Strait in Bangsring village, and remains so until reaching Ketapang nine kilometers southward. Before reaching Ketapang, the route passes through Watudodol Beach, a place that gives a sight over Bali. travellers Route 1's course ends in front of Ketapang Ferry Terminal, and its course toward Downtown Banyuwangi is continued by Route 3.


== References ==