Katowice (UK:  KAT-ə-VEET-sə, US:  KAHT-, Polish: [katɔˈvitsɛ] (listen); Silesian: Katowicy; German: Kattowitz) is a city in southern Poland, the capital city of the Silesian Region, and a center of the Upper Silesia and Dąbrowa Basin Metropolis. With the population of 292,774 (as of 2019), it is the eleventh-largest city in Poland. The wider Katowice urban area has the population of approximately 2 to 3 million people.
Throughout the mid-18th century, Katowice had developed into a village upon the discovery of rich coal reserves in the area. In 1742 the First Silesian War transferred Upper Silesia, including Katowice, to Prussia. Subsequently, from the second half of the 18th century, many German or Prussian craftsmen, merchants and artists began to settle in the region, which had been inhabited mostly by Poles over the past hundreds of years. Simultaneously Silesia experienced the influx of the first Jewish settlers. In the first half of the 19th century, intensive industrialization transformed local mills and farms into industrial steelworks, mines, foundries and artisan workshops. This also contributed to the establishment of companies and eventual rapid growth of the city. At the same time, Katowice became linked to the railway system with the first train arriving at the main station in 1847.The outbreak of World War I was favourable for Katowice due to the prospering steel industry. Following Germany's defeat and the Silesian uprisings, Katowice and parts of Upper Silesia were annexed by the Second Polish Republic. Poland was then backed by the Geneva Convention and the ethnic Silesian minority. On 3 May 1921, the Polish army entered Katowice and the Polish administration took control. The city became the capital of the autonomous Silesian Voivodeship as well as the seat of the Silesian Parliament and Committee of Upper Silesia. After the plebiscite, many former German citizens emigrated; however, a vibrant German community remained until the end of World War II. In 1939, after the Wehrmacht seized the town, Katowice and the provinces were incorporated into the Third Reich. The town was eventually liberated by the Soviet army on 27 January 1945.Katowice is a center of science, culture, industry, business, trade, and transportation in Upper Silesia and southern Poland, and the main city in the Upper Silesian Industrial Region. Katowice lies within an urban zone, with a population of 2,746,460 according to Eurostat, and also part of the wider Silesian metropolitan area, with a population of 5,008,000 according to the Brookings Institution or 5,294,000 according to the European Spatial Planning Observation Network.In 2020, the city is classified as a Gamma - global city by the Globalization and World Cities Research Network and is considered as an emerging metropolis. The whole metropolitan area is the 16th most economically powerful city by GDP in the European Union with an output amounting to $114.5 billion.Katowice is the seat of the Polish National Radio Symphony and Orchestra. It also hosts the finals of Intel Extreme Masters, an Esports video game tournament. In 2015, Katowice joined the UNESCO Creative Cities Network and was named a UNESCO City of Music.


== History ==

The area around Katowice, in Upper Silesia, has been inhabited by ethnic Polish Silesians from its earliest documented history. Initially it was ruled by the Polish Silesian Piast dynasty until its extinction. The settlement of the area surrounding Katowice dates back to the end of the 12th century. From 1138, the Bytom castellany encompassed territories where Katowice is now located. In 1177 the lands were legally handed over by Duke Casimir II the Just to his nephew Mieszko I Tanglefoot; this justified their incorporation into the medieval Silesian provinces. At the turn of the 14th century, new villages called Bogucice, Ligota, Szopenice and Podlesie were established, as well as the village of Dąb, mentioned in 1299 in a document issued by Duke Casimir of Bytom.
From 1327, the region was under Czech administration as part of the Kingdom of Bohemia. In historical documents dating from 1468, there was a reference to the settlement of Podlesie, which, at present, is one of the city districts, whereas the village of Katowice (or "Katowicze" in older records) was first mentioned in the year 1598. Historians assume that Katowice was founded on the right bank of the Rawa river by Andrzej Bogucki in around 1580.

In 1598 a village called Villa Nova was also documented to stand in the area now occupied by the city of Katowice. By this time the territory had changed from the Bohemian Crown to the domain of the Austrian Habsburg dynasty.Kattowitz gained city status in 1865 in the Prussian Province of Silesia. The city flourished due to large mineral (especially coal) deposits in the nearby mountains. Extensive city growth and prosperity depended on the coal mining and steel industries, which took off during the Industrial Revolution. The city was inhabited mainly by Germans, Silesians, Jews and Poles. In 1884, 36 Jewish Zionist delegates met here, forming the Hovevei Zion movement. Previously part of the Beuthen district, in 1873 it became the capital of the new Kattowitz district. On 1 April 1899, the city was separated from the district, becoming an independent city.

Under the Treaty of Versailles after World War I, the Upper Silesia plebiscite was organised by the League of Nations. Though Kattowitz proper voted 22,774 to remain in Germany and 3,900 for Poland, it was attached to Poland as the larger district voted 66,119 for Poland and 52,992 for Germany. Following the Silesian uprisings of 1918–21 Katowice became part of the Second Polish Republic with some autonomy for the Silesian Parliament as a constituency and the Silesian Voivodeship Council as the executive body).
During the early stages of World War II and the Poland Campaign, Katowice was essentially abandoned, as the Polish Army had to position itself around Kraków. Under the Nazi occupation many of the city's historical and iconic monuments were destroyed, most notably the Great Katowice Synagogue, which was burned to the ground on 4 September 1939. This was followed by the alteration of street names and the introduction of strict rules. Additionally, the use of Polish in public conversations was banned. The German administration was also infamous for organising public executions of civilians and by the middle of 1941, most of the Polish and Jewish population was expelled. Eventually, Katowice was occupied by the Red Army in January 1945. Significant parts of the downtown and inner suburbs were demolished during the occupation. This, however, cannot be compared with Warsaw, where the level of destruction reached 85%. As a result, the authorities were able to preserve the central district in its prewar character.
The postwar period of Katowice was characterised by the time of heavy industry development in the Upper Silesian region, which helped the city in regaining its status as the most industrialised Polish city and a major administrative centre. As the city developed so briskly, the 1950s marked a significant increase in its population and an influx of migrants from the Eastern Borderlands, the so-called Kresy. The city area began to quickly expand by incorporating the neighbouring communes and counties. However, the thriving industrial city also had a dark period in its short but meaningful history. Most notably, between 7 March 1953 and 10 December 1956, Katowice was called Stalinogród in honour of Joseph Stalin, leader of the Soviet Union. The change was brought upon by an issued decree of the State Council. The date of the alteration of the city name was neither a coincidence or accidental as it happened on the day of Stalin's death. In this way, the Polish Communist Party and the socialist authority wanted to pay tribute to the dictator. The new name never got accepted by the citizens and in 1956 the former Polish name was restored.

The following decades were more memorable in the history of Katowice. Regardless of its industrial significance, it started to become an important cultural and educational centre in Central and Eastern Europe. In 1968 the University of Silesia, the largest and most valued college in the area, was founded. Simultaneously the construction of large housing estates began to evolve. Furthermore, many representative structures were erected at that time, including the Silesian Insurgents' Monument (1967) and Spodek (1971), which have become familiar landmarks and tourist sights. The 1960s and 1970s saw the evolution of modernist architecture and functionalism. Katowice eventually developed into one of the most modernist post-war cities of Poland.
One of the most dramatic events in the history of the city occurred on 16 December 1981. It was then that 9 protesters died (7 were shot dead; 2 died from injury complications) and another 21 were wounded in the pacification of Wujek Coal Mine. The Special Platoon of the Motorized Reserves of the Citizens' Militia (ZOMO) was responsible for the brutal handling of strikers protesting against Wojciech Jaruzelski's declaration of martial law and the arrest of Solidarity trade union officials. On the 10th anniversary of the event, a memorial was unveiled by the President of Poland Lech Wałęsa.
In 1990 the first democratic local elections that took place marked a new period in the city's history. The economy of Katowice has been transforming from the heavy industry of steel and coal mines into "one of the most attractive investment areas for modern economy branches in Central Europe". Recently, the city's efficient infrastructure, rapid progress in the overall development and an increase in office space has made Katowice a popular venue for conducting business. The Katowice Expo Centre (Katowickie Centrum Wystawiennicze) organises trade fairs or exhibitions and attracts investors from all over the world.


== Geography ==
Katowice is a city in Upper Silesia in southern Poland, on the Kłodnica and Rawa rivers (tributaries of the Oder and the Vistula respectively). It is in the Silesian Highlands, about 50 km (31 mi) north of the Silesian Beskids (part of the Carpathian Mountains) and about 100 km (62 mi) southeast of the Sudetes Mountains. Katowice is in the Katowice Highlands, part of the Silesian Highlands, in the eastern part of Upper Silesia, in the central portion of the Upper Silesian Coal Basin. Katowice is an urban community in the Silesian Voivodeship in south-west Poland. It is central district of the Silesian Metropolis—a metropolis with a population of two million. It borders the cities of Chorzów, Siemianowice Śląskie, Sosnowiec, Mysłowice, Lędziny, Tychy, Mikołów, Ruda Śląska and Czeladź. It lies between the Vistula and Oder rivers. Several rivers flow through the city, the major two being the Kłodnica and Rawa. Within 600 km (370 mi) of Katowice are the capital cities of six countries: Berlin, Vienna, Prague, Bratislava, Budapest and Warsaw.


=== Climate ===
Katowice has a temperate, ocean-moderated humid continental climate (Köppen climate classification: Dfb/Cfb). The average temperature is 8.2 °Celsius (−2.0 °C (28 °F) in January and up to 18 °C (64 °F) in July). Yearly rainfall averages at 652.8 mm (25.70 in). Characteristic weak winds blow at about 2 m/s from the west, the Moravian Gate.


=== Districts ===


=== Demographics ===
At present, the city of Katowice is inhabited mostly by Poles and ethnic Silesians, but also by several minorities of Germans, Czechs and Moravians. This also makes the region religiously and culturally diverse. Over the years this diversity has strongly reflected on local architecture such as tenement housing and state buildings. The recent Polish census showed that the Silesians are the largest ethnic minority in Poland, with Germans being second on the list. Both of these minorities mostly live in the Silesian region. It is, therefore, the most multicultural province and voivodeship of Poland.
Prior to the Second World War, Katowice was mainly inhabited by Poles and Germans. The 1905 Silesian demographic census has shown that Germans made up nearly 75% of the total population. Following Germany's defeat in 1945, the large German majority was forced to flee. Most pre-war citizens (excluding Poles) were violently expelled by the new authorities. This resulted in a large group of exiled Silesians living in present-day Germany, creating a new association of Landsmannschaft Schlesien. One of its most notable spokesmen and leaders was the Christian Democratic Union politician Herbert Hupka.During the war, the Nazi occupant committed severe crimes against the local Gypsy and Jewish communities. Most of them were eventually killed or transported by cattle wagons to concentration camps such as Auschwitz for complete extermination. This led to a population drop between 1939 and 1945.


=== Conurbation ===
Katowice lies in the centre of the largest conurbation in Poland, one of the largest in the European Union, numbering about 2.7 million. The Katowice urban area consists of about 40 adjacent cities and towns, the whole Silesian metropolitan area (mostly within the Upper Silesian Coal Basin) over 50 cities or towns. The metropolitan area has a population of 5,294,000. In 2006, Katowice and 14 adjacent cities united as the Upper Silesian Metropolis. Its population is 2 million and its area is 1,104 km². In 2006–2007 the union planned to unite these cities in one city under the name "Silesia", but this proved unsuccessful.The Katowice conurbation comprises settlements which have evolved because of the mining of metal ores, coal and raw rock materials. The establishment of mining and heavy industry which have developed for the past centuries has resulted in the unique character of the cityscape; its typical aspects are the red brick housing estates constructed for the poorer working class, factory chimneys, manufacturing plants, power stations and quarries. The inhabitants of a large mining community like Katowice, and local administrations within the conurbation, which have only evolved due to mining, are a subject to overall decline after the liquidation of coal mines and factories. This is one of the reasons which led to the development of the service sector, including office spaces, shopping centres and tourism.


== Architecture ==

Katowice did not originate as a medieval town. The city centre was beginning to form in the mid-19th century when it was part of the Kingdom of Prussia and had an ethnic German majority. The buildings of the time are decorated in an eclectic style (mostly Renaissance with elements of Baroque) and elements of Art Nouveau style (Polish: secesja). By the end of the nineteenth century the centre was being referred to as a "little Paris" due to the presence of Parisian-styled tenement houses. Examples of Modernism, especially International Style and Bauhaus inspired architecture, still coexist with modern office buildings in central Katowice. Between the 1950s and 1980s many socialist apartment blocks were constructed around the inner suburbs. Notable examples from that period include a multipurpose arena complex called Spodek and parts of Koszutka district.Katowice is one of the few cities in Poland where nearly all architectural styles are present. For instance, the Market square in Katowice (Polish: Rynek Katowicki) is surrounded by a vast majority of buildings and edifices representing styles such as neoclassicism, modernism, socialist realism and contemporary-modern. Some tenements have neogothic elements, which are an outstanding example of this type in Central and Eastern Europe. The street outlines, especially within the older inner districts, closely resemble the ones in Paris. Representational boulevards and promenades were established despite the city's strong industrial character. These, however, mostly adorned the city center and not working-class outer suburbs.
Unfortunately many old majestic buildings were demolished in the 1950s to make space for monumental modern blocks. Among other reasons for their destruction was the immense architectural detail which once represented the wealth of local industrialists and property owners. This particularly didn't fit in with the Socialist-Communist authority at the time.
Today, the marketplace and several nearby streets with shopping promenades are closed to traffic.


=== Tourist attractions ===
Market square and adjacent streets: Warszawska, Teatralna, Dyrekcyjna, Staromiejska, Dworcowa, św. Jana, Pocztowa, Wawelska, 3 Maja, Stawowa, Mielęckiego, Starowiejska and Mickiewicza, the so-called "Great Market Square of Katowice" or "Old town of Katowice"—many historic (monument) buildings. This is a group of functional-architectural. On the market square and most of the above-mentioned streets are prohibitions or restrictions on cars. Streets: Staromiejska, Dyrekcyjna, Wawelska, Stawowa and Warszawska is lined decorative cobblestone creating a pedestrian zone. The authority plans to Katowice—Quarter streets: św. Jana, Dworcowa, Mariacka, Mielęckiego, Stanisława and Starowiejska is to become so "small market square".
Nikiszowiec – historical settlement of Katowice, candidate to UNESCO
Cathedral of Christ the King
St Mary's Church
Church of the Resurrection, Evangelical-Augsburg, built in 1856–1858
Church of St Michael Archangel, the oldest church in the city, built in 1510
Drapacz Chmur, one of the first skyscrapers in EuropeSilesian Parliament, built in 1925–1929. For a very long time, it was the biggest structure in Poland
Modernist old town
Spodek (a large sports centre/concert hall, whose name translates as the 'saucer', from its distinctive shape resembling a UFO flying saucer)
 Silesian Insurgents Monument (Polish: Pomnik Powstańców Śląskich), the largest and heaviest monument in Poland. It is a harmonious combination of architecture and sculpture with appropriate symbolism: the wings symbolize the three Silesian Uprisings 1919 – 1920 – 1921 while the names of places that were battlefields are etched on the vertical slopes. The monument, which was funded by the people of Warsaw for Upper Silesia, is considered Katowice's landmark.
Silesian Theater, built in 1907
Rialto Cinetheater, built in 1912
Silesian Museum, built in 1899
Old train station in Katowice, built in 1906
The Goldstein Palace
The Załęże Palace
Parachute Tower – a 50 m (160 ft) tall lattice tower was built in 1937 for training parachutists. It was used in the first days of World War II and is the only parachute tower in Poland.Other:

 Franciscan Monastery in Panewniki
Church of St Joseph (Załęże)
St Stephen's Church
Church of Christ Resurrection
The Monument to Marshal Piłsudski by Croatian sculptor Antun Augustinčić, 1937–39. It was commissioned in 1936 but brought to Poland in 1991
Monopol Hotel
Katowice Rondo, the large square/roundabout, reconstructed recently, with the semi-circular Galeria Rondo Sztuki in the centre.
The Altus Skyscraper, the tallest skyscraper


== Economy ==

Despite relatively small size, Katowice is one of the major industrial, commerce and financial hubs of Poland. 
Katowice enjoys a very strong job market. Despite being 11th city in Poland in terms of population, Katowice is the 7th largest number of employed, with 171,839 full-time positions as of 2019. Katowice is also second only to Warsaw in number of commuters coming from other municipalities to work in the city, at 113,830 commuting to work in Katowice. Unemployment rate in Katowice regularly ranks among the lowest in the country, and as of August 2020 it is the lowest in Poland at 1.5% (3,300 unemployed). As of 2018, Katowice had 10th highest salaries in Poland, at PLN 5,698.98 on average.Katowice transformed its economy from a heavy industry-based to professional services, education and healthcare. As of 2020, it is classified as global Gamma- city according to Globalization and World Cities Research Network, on par with Poznan, Cleveland or Bilbao.


=== Industry ===
Since its creation, Katowice's development was tightly connected to heavy industry, especially coal mining, steelworks and machine production. In 1931, 49.5% of inhabitants worked in industry, and 12.5% in coal mining alone. In 1989 industry accounted for 36% of all jobs in the city (112,000 employees). As of 2018, 34,294 people worked in industry in Katowice, 20.4% of total - below the national average. 
The first reported coal mine in Katowice (Murcki coal mine) was established in 1740, and in 1769 construction on Emanuelssegen mine started. As the demand for coal kept rising in the Kingdom of Prussia, further mines were opened: Beata (1801), Ferdinand (1823), Kleofas (1845). Later in 19th and early 20th century additional mines were opened: Katowice, Wujek, Eminenz (later renamed Gottwald and merged with Kleofas), Wieczorek, Boże Dary, Staszic and renewed Murcki. Currently two remain in operation: Wujek (scheduled to close in 2021) and Murcki-Staszic. Katowice is also the seat of Polska Grupa Górnicza, the largest coal mining corporation in Europe. 
Metallurgy was another important part of Katowice's economy. In 1863 a dozen zinc metallurgy facilities were reported in Katowice, with Wilhelmina (founded in 1834) being the largest. In early 1900s, Wilhelmina (later renamed Huta Metali Niezależnych Szopienice) was enlarged and became the largest Silesian producer of non-ferrous metals and world's largest producer of cadmium. Two major steelworks existed in the city: Huta Baildon, established in 1823 by the Scottish engineer and industrialist John Baildon (declared bankruptcy in 2001), and Huta Ferrum, established in 1874 and operating to this date in limited capacity. 


=== Business and commerce ===
Following the collapse of heavy industry in late 20th century, Katowice had to transform its economy towards more modern sectors. As a result, Katowice is a large business, conference and trade fair center. 
Katowice is headquarters to 18 public companies traded on the Warsaw Stock Exchange, with total market value of PLN 24.2 billion as of 2016, with the largest being ING Bank Śląski. As of 2019, 38 companies from Katowice make the list of 2000 largest enterprises in Poland according to Rzeczpospolita, with largest one being Tauron Polska Energia S.A. (10th place). As of 2012, 44,050 companies were registered in Katowice, almost 10% of all companies in the Silesian Voivodeship.
Retail is a very strong sector in Katowice. The city is home to several shopping centers and department stores, with Silesia City Center and Galeria Katowicka being the largest ones. Silesia City Center, located on a brownfield in place of a former coal mine, is the largest shopping center in Poland when number of stores is considered (310 different brands) and 7th largest in terms of retail space for rent (86,000 sq. m). It is also a part of a broader revitalization complex, that features an apartment complex and office space (under construction as of October 2020) as well. 
Katowice is also the seat of Katowice Special Economic Zone (Katowicka Specjalna Strefa Ekonomiczna).


== Culture ==

Katowice is the cultural centre of the entire Silesian agglomeration inhabited by over two million people and one of the leading cultural spots in Poland. Most importantly, it is a host city to some of the biggest theatrical and stage events. This also includes hosting gatherings and exhibitions as well as film and musical events. Annual musical festivals such as the Rawa Blues, the Tauron New Music Festival, the Silesian Jazz Festival, the Mayday Festival and other concerts, which attract yearly hundreds of thousands of tourists from the entire country. Katowice also temporarily hosts the OFF Festival, the most important alternative event in Poland.Katowice is the seat of an internationally renowned Karol Szymanowski Academy of Music, as well as the Polish National Radio Symphony Orchestra. The Silesian Philharmonic also has its seat in Katowice. The opening of a new architectural complex of the National Polish Radio Orchestra took place in 2014.
A showcase for Katowice is the "Camerata Silesia" – an ensemble aimed at promoting the city in Poland and overseas. Classical music also plays a significant role in Katowice and the city annually becomes a venue for numerous classical concerts and festivals. The list includes an International Festival of Young Music Competition Laureates, Grzegorz Fitelberg International Competition for Conductors, Chamber Music Festival, Ars Cameralis Festival and Katowice's opera, operettas and most of all ballet. In 2010, as part of the Chopin Year Celebrations, Katowice held the International Chopin Knowledge Challenge, which took place at the Spodek hall.
The BWA Contemporary Art Gallery in Katowice, established in 1949, is a notable institution concerning the Contemporary arts. Every three years, it is responsible for the organisation of the Polish Graphic Art Triennial. Several other galleries feature exhibitions of the works by artists from abroad along with film screenings, workshops for children and public fairs. The Silesian Museum in Katowice, opened in 1929, exhibits works by famous and renowned Polish artists like Józef Chełmoński, Artur Grottger, Tadeusz Makowski, Jacek Malczewski, Jan Matejko, Józef Mehoffer and Stanisław Wyspiański.List of notable attractions:

Silesian Theatre, named after the Polish writer and painter Stanisław Wyspiański, is the largest theatre in Silesia. It is located exactly in the central part of the market square facing westward. The complex was originally built as a German theatre between 1905 and 1907 by architect Carl Moritz.
