This is a list of cities, towns and villages in Papua New Guinea.


== List ==
Papua New Guinea's three cities are Lae, Mount Hagen and Port Moresby. The other settlements in the following list are towns and villages.


== See also ==
List of cities and towns in Papua New Guinea by population
Provinces of Papua New Guinea
Regions of Papua New Guinea
Districts of Papua New Guinea
Local-level governments of Papua New Guinea
List of cities in Oceania by population


== References ==

"Final Figures". www.nso.gov.pg. 2011 National Population and Housing Census: Ward Population Profile. Port Moresby: National Statistical Office, Papua New Guinea. 2014.
United Nations in Papua New Guinea (2018). "Papua New Guinea - Postal codes and Coordinates". Humanitarian Data Exchange. 1.31.9.


== External links ==
 Media related to Cities in Papua New Guinea at Wikimedia Commons